doc_id,unit_id,sentence,role,prev,next,speakers,targets,proc_symbolic_flag,event_phase,unit_hash,unit_dup_flag,source,date,preprocessed_text,hard_rule_keep,hard_rule_reason,policy_gate,policy_gate_reason,priority_keep,semantic_status,semantic_similarity,nli_status,nli_score,key_hit,final_status
meeting1_fdcdc9b55340,meeting1_fdcdc9b55340_u002,"蔡英文总统从马英九千总统时代的 20, 008 块调整到 27, 400 块。",context,"运用物价指数,根据物价指数或是经济成长的指数来调整劳工基本的薪资。","也许还有人不满不够,我们要继续加油,但他比马英九前总统做的实在更多。",[],[],False,,2d4789512f76d6237de01ab336e7487f,False,meeting1,,"蔡英文总统从马英九千总统时代的 20, 008 块调整到 27, 400 块。",True,institution_only,True,gate: core_election,False,REVIEW,0.28505992889404297,,,False,KEEP
meeting1_fdcdc9b55340,meeting1_fdcdc9b55340_u003,"也许还有人不满不够,我们要继续加油,但他比马英九前总统做的实在更多。",context,"蔡英文总统从马英九千总统时代的 20, 008 块调整到 27, 400 块。",,[],[],False,,3e2039f79c2c067610fa10647fee0efa,False,meeting1,,"也许还有人不满不够,我们要继续加油,但他比马英九前总统做的实在更多。",True,institution_only,True,gate: core_election,False,KEEP,0.5471630096435547,,,False,KEEP
meeting1_bf95df7b0c85,meeting1_bf95df7b0c85_u006,"虽然这些弱势的民众都有得到政府的照顾,但是他们所得的经费常常三餐都不够,根本没有能力在修复房子。",context,"我们这个座位后来也到高雄、到平东,甚至北上,到云林、嘉义,还有蓝图。",,[],[],False,,beeb3ae0514cdfdfdbfe5ec70518729a,False,meeting1,,"虽然这些弱势的民众都有得到政府的照顾,但是他们所得的经费常常三餐都不够,根本没有能力在修复房子。",True,institution_only,True,gate: 2 inst terms,False,REVIEW,0.27637386322021484,,,False,KEEP
meeting1_750bb718e7e6,meeting1_750bb718e7e6_u001,"过去未来我当总统,我要推广到全台湾来帮助弱势的民众修缮房子,让他们有一个地方可以牺牲。",context,"年久失修,防止漏水非常严重,尤其许多多的独居老人或者是边缘户,台风下雨,他是穿着雨衣哎,趴在桌子上等着雨。","同时我也会做其他公益的工作,谢谢大家。",[],[],False,,f77b2a572f94ac13c552a9ca2fc134d2,False,meeting1,,"过去未来我当总统,我要推广到全台湾来帮助弱势的民众修缮房子,让他们有一个地方可以牺牲。",True,institution_only,True,gate: core_election,False,KEEP,0.679370641708374,,,False,KEEP
meeting1_b513c24d11e8,meeting1_b513c24d11e8_u000,"现在请第三轮第一位候选人柯文哲先生发表证件,时间 10 分钟,请发言。",context,,,"[{""name"": ""柯文哲"", ""party"": ""TPP""}]",[],False,,42b5f15278183e43c1179e8373b15829,False,meeting1,,"现在请第三轮第一位候选人柯文哲先生发表证件,时间 10 分钟,请发言。",True,cooccur: actor×institution,True,gate: actor×inst,False,KEEP,0.44239312410354614,,,False,KEEP
meeting1_5f489fd62a14,meeting1_5f489fd62a14_u000,"好,今天是 2023 年 12 月 28 日,第2.24的总统大选只剩下 16 天,最后两个星期一个转念就可以改变他人的未来。",context,,"台湾诈骗很多,其实刚才赖沪总统就在示范什么叫诈骗,我请问你,我什么时候说过接受一个中国?",[],[],False,,ab2c4d3f0af623d08ceff8d8e17c3620,False,meeting1,,"好,今天是 2023 年 12 月 28 日,第2.24的总统大选只剩下 16 天,最后两个星期一个转念就可以改变他人的未来。",True,institution_only,True,gate: core_election,False,KEEP,0.4498070478439331,,,False,KEEP
meeting1_5f489fd62a14,meeting1_5f489fd62a14_u001,"台湾诈骗很多,其实刚才赖沪总统就在示范什么叫诈骗,我请问你,我什么时候说过接受一个中国?",claim,"好,今天是 2023 年 12 月 28 日,第2.24的总统大选只剩下 16 天,最后两个星期一个转念就可以改变他人的未来。","你说两岸一家亲,我跟你讲 2015 年我就讲过了,你们 2016 年的选举多少个你们民进党的立华为人摆脱我去暂代,连我妈妈都被拉去站台,其中玩电影又去了好几次诶,那时候你们只要不觉得两岸一家签有问题,把我利用完了拿到正圈的就把我踢走。",[],[],False,,28b005d47ba30fa1e81f7f346a3aa536,False,meeting1,,"台湾诈骗很多,其实刚才赖沪总统就在示范什么叫诈骗,我请问你,我什么时候说过接受一个中国?",True,institution_only,True,gate: core_election,False,KEEP,0.6071426272392273,,,False,KEEP
meeting1_5f489fd62a14,meeting1_5f489fd62a14_u002,"你说两岸一家亲,我跟你讲 2015 年我就讲过了,你们 2016 年的选举多少个你们民进党的立华为人摆脱我去暂代,连我妈妈都被拉去站台,其中玩电影又去了好几次诶,那时候你们只要不觉得两岸一家签有问题,把我利用完了拿到正圈的就把我踢走。",claim,"台湾诈骗很多,其实刚才赖沪总统就在示范什么叫诈骗,我请问你,我什么时候说过接受一个中国?",,"[{""name"": ""民进党"", ""party"": ""DPP""}]","[""两岸|cross-strait""]",False,,ae29b91094d69d1e46a296bbebe494d3,False,meeting1,,"你说两岸一家亲,我跟你讲 2015 年我就讲过了,你们 2016 年的选举多少个你们民进党的立华为人摆脱我去暂代,连我妈妈都被拉去站台,其中玩电影又去了好几次诶,那时候你们只要不觉得两岸一家签有问题,把我利用完了拿到正圈的就把我踢走。",True,cooccur: actor×institution,True,gate: actor×inst,False,KEEP,0.5109078288078308,,,True,KEEP
meeting1_e7ed23a839fc,meeting1_e7ed23a839fc_u001,"还有你刚才在讲说丢掉邦交国,我们在批评政府,你能不能拿出来?",claim,"两岸一家圈我 2015 年就讲过的,你们当时总不觉得有问题?","我知道台湾外交有困境,我会去批原我们自己政府。",[],[],False,,e6775f311d201658ef3e023304b93dd1,False,meeting1,,"还有你刚才在讲说丢掉邦交国,我们在批评政府,你能不能拿出来?",True,institution_only,True,gate: 2 inst terms,False,KEEP,0.5864113569259644,,,False,KEEP
meeting1_e7ed23a839fc,meeting1_e7ed23a839fc_u002,"我知道台湾外交有困境,我会去批原我们自己政府。",context,"还有你刚才在讲说丢掉邦交国,我们在批评政府,你能不能拿出来?","还有一点哦,你自称说市政成绩很好,亏你还是义政,你忘了你当市长的时候,登隔日死了多少人?",[],[],False,,6dea4522f20cd03a03908891594d337e,False,meeting1,,"我知道台湾外交有困境,我会去批原我们自己政府。",True,institution_only,True,gate: strong_anchor,False,KEEP,0.7213489413261414,,,False,KEEP
meeting1_e7ed23a839fc,meeting1_e7ed23a839fc_u005,"198 个国家的代表,他们的共事就是减少石化燃料,加速能源转型, 2050 要达到近零碳排化。",context,"就在两个星期前, cup twenty eight 才在杜拜落幕。","当全球先进国家都在注意这些问题的时候,民进党政府却好像与全世界脱节。",[],[],False,,1503430ce0a90c25b411e77217398f9a,False,meeting1,,"198 个国家的代表,他们的共事就是减少石化燃料,加速能源转型, 2050 要达到近零碳排化。",True,institution_only,True,gate: strong_anchor,False,REVIEW,0.2985585033893585,,,False,KEEP
meeting1_e7ed23a839fc,meeting1_e7ed23a839fc_u006,"当全球先进国家都在注意这些问题的时候,民进党政府却好像与全世界脱节。",context,"198 个国家的代表,他们的共事就是减少石化燃料,加速能源转型, 2050 要达到近零碳排化。","民进党做得很多,做得很少。","[{""name"": ""民进党"", ""party"": ""DPP""}]",[],False,,155183b09c4a78c4d625c35cccf912f8,False,meeting1,,"当全球先进国家都在注意这些问题的时候,民进党政府却好像与全世界脱节。",True,cooccur: actor×institution,True,gate: actor×inst,False,KEEP,0.499966561794281,,,False,KEEP
meeting1_e7ed23a839fc,meeting1_e7ed23a839fc_u008,"蔡英文总统承诺他要减少碳排放量,可是在他执政这 7 年来,台湾的碳排放量还在比基础年增加的 2.1 percent,我们必须换掉这一个装睡叫不醒的政府,让台湾真正与世界接轨,现在就是行动的时候。",claim,"民进党做得很多,做得很少。",,[],[],False,,0a8bc45e3f529ce667c7ba588175297a,False,meeting1,,"蔡英文总统承诺他要减少碳排放量,可是在他执政这 7 年来,台湾的碳排放量还在比基础年增加的 2.1 percent,我们必须换掉这一个装睡叫不醒的政府,让台湾真正与世界接轨,现在就是行动的时候。",True,institution_only,True,gate: core_election,False,KEEP,0.6009137630462646,,,False,KEEP
meeting1_6f147c9b4da9,meeting1_6f147c9b4da9_u000,"我的证件其实用 15 个字就可以贯通理性、务实、科学名义、专业价值,再加上执行力,面对能源问题、饥饿变迁,我们要用科学和新技术,不必用意识形态,面对牢堡健薄的改革参照的短缺,要勇敢的面对,不要避重就轻,拖延了事。",context,,"面对技术正义,我们要站在弱势的一方,而不是站在财团建商的那一方面。",[],[],False,,57a022bbcca1f3e6e221221fa7ed8a74,False,meeting1,,"我的证件其实用 15 个字就可以贯通理性、务实、科学名义、专业价值,再加上执行力,面对能源问题、饥饿变迁,我们要用科学和新技术,不必用意识形态,面对牢堡健薄的改革参照的短缺,要勇敢的面对,不要避重就轻,拖延了事。",True,institution_only,True,gate: strong_anchor,False,KEEP,0.4568294882774353,,,False,KEEP
meeting1_aeedadc96915,meeting1_aeedadc96915_u003,"我在台北执政 8 年,两岸关系降到了冰点,在民进党不断抹黑抹红,而且国民党也跟着起哄的情形下,我还是办了 8 次的双城论坛跟 2017 四大运。",context,"善意的对待每一个人,才能留下善的种子,消弥仇恨对立。","台湾的权利并没有因此受损,蔡英文总统还以总统的身份上台,宣布四大运开幕,对等尊严为台湾争取的应有的国际能见度。","[{""name"": ""民进党"", ""party"": ""DPP""}, {""name"": ""国民党"", ""party"": ""KMT""}]","[""两岸|cross-strait""]",False,,ea7fef867123626c19808ba14166a0a0,False,meeting1,,"我在台北执政 8 年,两岸关系降到了冰点,在民进党不断抹黑抹红,而且国民党也跟着起哄的情形下,我还是办了 8 次的双城论坛跟 2017 四大运。",True,cooccur: actor×institution,True,gate: actor×inst,False,KEEP,0.677494466304779,,,True,KEEP
meeting1_aeedadc96915,meeting1_aeedadc96915_u004,"台湾的权利并没有因此受损,蔡英文总统还以总统的身份上台,宣布四大运开幕,对等尊严为台湾争取的应有的国际能见度。",context,"我在台北执政 8 年,两岸关系降到了冰点,在民进党不断抹黑抹红,而且国民党也跟着起哄的情形下,我还是办了 8 次的双城论坛跟 2017 四大运。","我主张未实现状,台湾自主,两岸和平,我会以务实的态度维护台湾的民主自由、华治人权。 还记得吗?",[],[],False,,c2e5f38391507bca946dfe4134762962,False,meeting1,,"台湾的权利并没有因此受损,蔡英文总统还以总统的身份上台,宣布四大运开幕,对等尊严为台湾争取的应有的国际能见度。",True,institution_only,True,gate: core_election,False,KEEP,0.7248690724372864,,,False,KEEP
meeting1_aeedadc96915,meeting1_aeedadc96915_u006,"2016 年蔡英文总统当选那一晚,他说,从此台湾人民不需要因为他们的认同而道歉。",claim,"我主张未实现状,台湾自主,两岸和平,我会以务实的态度维护台湾的民主自由、华治人权。 还记得吗?",,[],[],False,,2634f95d2a259a0f8171176382b31ca7,False,meeting1,,"2016 年蔡英文总统当选那一晚,他说,从此台湾人民不需要因为他们的认同而道歉。",True,institution_only,True,gate: core_election,False,KEEP,0.5737111568450928,,,False,KEEP
meeting1_135b7f82ff69,meeting1_135b7f82ff69_u005,"我一辈子都在救人,我没有包袱,我也不会贪污,我永远为弱势探普罗大众来努力。",context,那么柯文泽是你是谁?,"我为理性务实科学解决人民生活的困境,我会用清廉勤政、爱民爱乡土来深化民族,我更时时思考着我们要留下一个什么样的团结下一代,当人民偷给我,我绝对会全心全力为国效力。",[],[],False,,4b9db2e5cd66922e6538ea5d662ff237,False,meeting1,,"我一辈子都在救人,我没有包袱,我也不会贪污,我永远为弱势探普罗大众来努力。",True,institution_only,True,gate: 2 inst terms,False,REVIEW,0.23980318009853363,,,False,KEEP
meeting1_cd4404fc144f,meeting1_cd4404fc144f_u000,"现在请第三轮第二位候选人侯友怡先生发表证件,时间 10 分钟,请发言。",context,,,[],[],False,,ae711ec621d82e500ae905702d4f9915,False,meeting1,,"现在请第三轮第二位候选人侯友怡先生发表证件,时间 10 分钟,请发言。",True,institution_only,True,gate: core_election,False,KEEP,0.4999552369117737,,,False,KEEP
meeting1_06eee85f3354,meeting1_06eee85f3354_u003,"代指是国外,代指你对我没对你的某个一个对,搞笑,这是我下面看起来代指第二个,详细再问三个候选人,大家彼此可以竞争,但是记得对事不要对人,尤其能让于心嘛。",context,"当然是台湾最重要团结,而台湾绝对不能用抹黑抹黄恶意的栽赃这句话想得到容易了。","我家里也有医生,你们也都认识医生的职业,我非常的尊重。",[],[],False,,1a059be319212779cbf9210eff6a17fa,False,meeting1,,"代指是国外,代指你对我没对你的某个一个对,搞笑,这是我下面看起来代指第二个,详细再问三个候选人,大家彼此可以竞争,但是记得对事不要对人,尤其能让于心嘛。",True,institution_only,True,gate: core_election,False,KEEP,0.5068532824516296,,,False,KEEP
meeting1_af8dda09e0ac,meeting1_af8dda09e0ac_u001,"南台湾同胞,我记得在 70 年代 80 年代国民党政府执政和洗村公鸡菇为戴湾及鹰 kabug 台湾可以变成高科技的指导习得利于什么?",context,"本下这案我从来不寄望别人给我说一声谢谢这句话爱贼奔魂,就算他见到我要说一声谢谢,我光看那边,所以我办过了案子,我记得那个过程,但是不需要人家说爱国干下,就算他给我个谢谢,我妈逼人家我们不爱过,有这本来的人在这一部分第二天我们来过来做青菜啊。","成功而发展半导体, 195 立搞定 50 年险。","[{""name"": ""国民党"", ""party"": ""KMT""}]",[],False,,83a77bd214599887d47c90caaae4b9e8,False,meeting1,,"南台湾同胞,我记得在 70 年代 80 年代国民党政府执政和洗村公鸡菇为戴湾及鹰 kabug 台湾可以变成高科技的指导习得利于什么?",True,cooccur: actor×institution,True,gate: actor×inst,False,KEEP,0.5384179949760437,,,False,KEEP
meeting1_510861f1d9a5,meeting1_510861f1d9a5_u000,"所以我们看看经济成长率, 14 年新低只有1.428,也是金融海啸以来最低的纪录。",context,,"国外会公布的景气灯号,今年 10 个月里面有 9 个月是蓝灯,是第一名的。",[],[],False,,9fad57cc20d6304d062b2270bcc782b8,False,meeting1,,"所以我们看看经济成长率, 14 年新低只有1.428,也是金融海啸以来最低的纪录。",True,institution_only,True,gate: 2 inst terms,False,REVIEW,0.21127387881278992,,,True,KEEP
meeting1_db6f20bc1bc7,meeting1_db6f20bc1bc7_u000,"那些十年先低那些斩民贤弟,所以很多人那个民调做出来说民进党对经济的市政满意度高不高?",claim,,"只不好英雄都不把力吃的,不满意都超过满意度,你咋拍一宿?","[{""name"": ""民进党"", ""party"": ""DPP""}]",[],False,,05c2b6ec10aa77719f128c703ec6bb62,False,meeting1,,"那些十年先低那些斩民贤弟,所以很多人那个民调做出来说民进党对经济的市政满意度高不高?",True,cooccur: actor×institution,True,gate: actor×inst,False,KEEP,0.4745677709579468,,,True,KEEP
meeting1_db6f20bc1bc7,meeting1_db6f20bc1bc7_u002,所以民进党人民给你打了经济成绩是不及格了。,context,"只不好英雄都不把力吃的,不满意都超过满意度,你咋拍一宿?","所以我今天特别讲出来民警两个缺点,但是民警两个缺点我们就必须面对这些错误上,让他要接受挑战,得让对外贸易,但是一个出国贸易导向的依赖度很高的国家,能在 GDP 大概我打起来吗?","[{""name"": ""民进党"", ""party"": ""DPP""}]",[],False,,2e85b4d27ee11cac8a3378016c05bd33,False,meeting1,,所以民进党人民给你打了经济成绩是不及格了。,True,cooccur: actor×institution,True,gate: actor×inst,False,KEEP,0.43684494495391846,,,True,KEEP
meeting1_db6f20bc1bc7,meeting1_db6f20bc1bc7_u006,"两岸我也知道关系做得不好一定会影响到我们国际经贸的组织,一定给它干扰,说明这种经过立马无能为力。",claim,"而且我们的科技空间要走出去,走不出去,我们能正如起码在两个人还要切个FI,还有更新加坡、纽西南切FTE。",,[],"[""两岸|cross-strait""]",False,,a319bde5f9fa78013ceb119c1e91641d,False,meeting1,,"两岸我也知道关系做得不好一定会影响到我们国际经贸的组织,一定给它干扰,说明这种经过立马无能为力。",True,institution_only,True,gate: 2 inst terms,False,KEEP,0.4865603744983673,,,True,KEEP
meeting1_6156e99b21ff,meeting1_6156e99b21ff_u000,"DCP、TPP、 ASIP 连夜话都岌岌可危,你都没话多一个对待问题经营掉这样的话缺水缺电缺工缺人才缺土地,这种打工怎样待机 20000 KB?",context,,"搞商会跟欧洲商会演讲的时候,他们过来讲一定缺电,能源政策一定有问题。",[],[],False,,2a08958aac5a4eb32df633bbd7f45e06,False,meeting1,,"DCP、TPP、 ASIP 连夜话都岌岌可危,你都没话多一个对待问题经营掉这样的话缺水缺电缺工缺人才缺土地,这种打工怎样待机 20000 KB?",True,cooccur: actor×institution,True,gate: actor×inst,False,REVIEW,0.39824652671813965,,,False,KEEP
meeting1_6156e99b21ff,meeting1_6156e99b21ff_u001,"搞商会跟欧洲商会演讲的时候,他们过来讲一定缺电,能源政策一定有问题。",context,"DCP、TPP、 ASIP 连夜话都岌岌可危,你都没话多一个对待问题经营掉这样的话缺水缺电缺工缺人才缺土地,这种打工怎样待机 20000 KB?","如果人员政策有问题,他不投资的,他要对外投资。",[],[],False,,f60f0ba04d90e4ad9792ca437d018009,False,meeting1,,"搞商会跟欧洲商会演讲的时候,他们过来讲一定缺电,能源政策一定有问题。",True,institution_only,True,gate: 2 inst terms,False,REVIEW,0.22278258204460144,,,False,KEEP
meeting1_6156e99b21ff,meeting1_6156e99b21ff_u003,"而且又面临到碳关系的势债转型的必要,尤其我们台湾在转型过程当中是为了转型跟低碳经济,其击爆所有最重要一个议题。",context,"如果人员政策有问题,他不投资的,他要对外投资。","因为软化地球的这个速度能够减缓其他共同的目标,所以建联碳排马西单共同被指。",[],[],False,,e3998a03d55fb4f1520ee9b3942c9e21,False,meeting1,,"而且又面临到碳关系的势债转型的必要,尤其我们台湾在转型过程当中是为了转型跟低碳经济,其击爆所有最重要一个议题。",True,institution_only,True,gate: 2 inst terms,False,KEEP,0.5260655879974365,,,True,KEEP
meeting1_0b324e0fcf1b,meeting1_0b324e0fcf1b_u001,"第一个区域的经济要板块融入,第二个改善投资环境,第三个企业要壮心壮血铁挖空区域经济贸易,我在任内会积极查理全球经济的整合,而这个美国的协助以及跟两岸要稳定的协商沟通,我让你给我第二日内完成 CP TPP,同时要启动a、 C p。",context,"南京在微微实行,那 2027 年前面生效,面对那些差距,水泥回调,钢铁里电力 did i go then 有玻璃要构造纸,所以建联碳排 job 对我们要刻不容寰,所以我提出了要改变台湾经济的是三大关键,也是三支箭。","然后在只要贸易国的FTA,我们的覆盖率要提升。",[],"[""两岸|cross-strait""]",True,legislative,76f7d0c0cbd21bc1ef13fc25a91f4739,False,meeting1,,"第一个区域的经济要板块融入,第二个改善投资环境,第三个企业要壮心壮血铁挖空区域经济贸易,我在任内会积极查理全球经济的整合,而这个美国的协助以及跟两岸要稳定的协商沟通,我让你给我第二日内完成 CP TPP,同时要启动a、 C p。",True,cooccur: actor×institution,True,gate: actor×inst,False,KEEP,0.5753015279769897,,,True,KEEP
meeting1_0b324e0fcf1b,meeting1_0b324e0fcf1b_u005,"要跟两岸谈,一定要先考虑到呆完的租房以及经济的安全,底下呼应产业的需求,尤其再重新协商 Alpha 的时候。",context,"一定在协商的过程当中一定要公开透明,要跟企业界好好的沟通,好好的让大家了解,让大家集齐嘛。","不管是祸贸跟胡贸,两岸要一个制度性的贸易协商的机制,确保台商在大陆的投资权益,外国抵贷带流的自行力。",[],"[""两岸|cross-strait""]",True,legislative,94c17b75cfba294cf94b9b00e16b2443,False,meeting1,,"要跟两岸谈,一定要先考虑到呆完的租房以及经济的安全,底下呼应产业的需求,尤其再重新协商 Alpha 的时候。",True,institution_only,True,gate: 3 inst terms,False,KEEP,0.45716995000839233,,,True,KEEP
meeting1_0b324e0fcf1b,meeting1_0b324e0fcf1b_u006,"不管是祸贸跟胡贸,两岸要一个制度性的贸易协商的机制,确保台商在大陆的投资权益,外国抵贷带流的自行力。",context,"要跟两岸谈,一定要先考虑到呆完的租房以及经济的安全,底下呼应产业的需求,尤其再重新协商 Alpha 的时候。",,[],"[""两岸|cross-strait""]",True,legislative,be06d601ba201ef727a435c4f5771696,False,meeting1,,"不管是祸贸跟胡贸,两岸要一个制度性的贸易协商的机制,确保台商在大陆的投资权益,外国抵贷带流的自行力。",True,institution_only,True,gate: 4 inst terms,False,KEEP,0.4732043743133545,,,True,KEEP
meeting1_1a5fe6b7a586,meeting1_1a5fe6b7a586_u000,"哈,沃尔玛伯他们哈,所以麦克达挂攻攻击的这些攻哈统一的中国,红色的中国,所以当然改善投资环境里面颠相重要嘛。",context,,"我能源政策已经讲过了,一律有序,以何减肥,然后节能优先。",[],[],False,,a68d7d7d391d918ec7581df85e1bcf74,False,meeting1,,"哈,沃尔玛伯他们哈,所以麦克达挂攻攻击的这些攻哈统一的中国,红色的中国,所以当然改善投资环境里面颠相重要嘛。",True,institution_only,True,gate: 2 inst terms,False,KEEP,0.5078846216201782,,,False,KEEP
meeting1_1a5fe6b7a586,meeting1_1a5fe6b7a586_u001,"我能源政策已经讲过了,一律有序,以何减肥,然后节能优先。",context,"哈,沃尔玛伯他们哈,所以麦克达挂攻攻击的这些攻哈统一的中国,红色的中国,所以当然改善投资环境里面颠相重要嘛。","那有序转型,最再深水能够多提供回来多提供,然后奖励他们,堵住他们嘛。",[],[],False,,9e285e326e1fa75927990d8d4378964e,False,meeting1,,"我能源政策已经讲过了,一律有序,以何减肥,然后节能优先。",True,institution_only,True,gate: strong_anchor,False,REVIEW,0.2869247794151306,,,False,KEEP
meeting1_1a5fe6b7a586,meeting1_1a5fe6b7a586_u003,"所以企业的调度,最后企业的创新相对茶列研发、自卫制造、节能减碳,大家做后二敢扩低而敢提升,二个不足以,最好第二点,三个周宽,我觉得针对我爸中国各个企业家四直七兆在处理,一调查出来在处理产业跟经济项目,活康配购组候选人,国资料小客最被看讨,所以我给大力一点,比他做中痛一定创造两岸和平。",context,"那有序转型,最再深水能够多提供回来多提供,然后奖励他们,堵住他们嘛。","要创造一个经济内阁,让我们台湾的护国神山遍及全球,台湾经济献启辉。",[],"[""两岸|cross-strait""]",False,,c145764b5cabc741c8aaae4f7b9a781d,False,meeting1,,"所以企业的调度,最后企业的创新相对茶列研发、自卫制造、节能减碳,大家做后二敢扩低而敢提升,二个不足以,最好第二点,三个周宽,我觉得针对我爸中国各个企业家四直七兆在处理,一调查出来在处理产业跟经济项目,活康配购组候选人,国资料小客最被看讨,所以我给大力一点,比他做中痛一定创造两岸和平。",True,institution_only,True,gate: core_election,False,KEEP,0.5234074592590332,,,True,KEEP
meeting1_1a5fe6b7a586,meeting1_1a5fe6b7a586_u004,"要创造一个经济内阁,让我们台湾的护国神山遍及全球,台湾经济献启辉。",context,"所以企业的调度,最后企业的创新相对茶列研发、自卫制造、节能减碳,大家做后二敢扩低而敢提升,二个不足以,最好第二点,三个周宽,我觉得针对我爸中国各个企业家四直七兆在处理,一调查出来在处理产业跟经济项目,活康配购组候选人,国资料小客最被看讨,所以我给大力一点,比他做中痛一定创造两岸和平。",,[],[],False,,91be304797bea8afbc072b13ab07e3ca,False,meeting1,,"要创造一个经济内阁,让我们台湾的护国神山遍及全球,台湾经济献启辉。",True,institution_only,True,gate: 2 inst terms,False,KEEP,0.6460623145103455,,,True,KEEP
meeting1_4450c2fde03d,meeting1_4450c2fde03d_u000,"现在请第三轮第三位候选人赖清德先生发表证件,时间 10 分钟,请发言。",context,,,"[{""name"": ""赖清德"", ""party"": ""DPP""}]",[],False,,b12560eada6220ba44ca3bf79f83dd12,False,meeting1,,"现在请第三轮第三位候选人赖清德先生发表证件,时间 10 分钟,请发言。",True,cooccur: actor×institution,True,gate: actor×inst,False,KEEP,0.49297910928726196,,,False,KEEP
