doc_id,unit_id,sentence,role,prev,next,speakers,targets,proc_symbolic_flag,event_phase,unit_hash,unit_dup_flag,source,date,preprocessed_text,hard_rule_keep,hard_rule_reason,policy_gate,policy_gate_reason,priority_keep,semantic_status,semantic_similarity,nli_status,nli_score,key_hit,final_status
meeting1_bd9068170e34,meeting1_bd9068170e34_u000,"各位观众,各位候选人大家好,今天是中央选举委员会为第 16 任总统、副总统选举所举办的第三场总统候选人电视证件发表会。",context,,"由本人中央选举委员会委员陈明负责主持,同时由本会陈月端委员在场监察。",[],[],False,,c7eeb4f5f8b9894712040fc75d0b7fdd,False,meeting1,,"各位观众,各位候选人大家好,今天是中央选举委员会为第 16 任总统、副总统选举所举办的第三场总统候选人电视证件发表会。",True,institution_only,True,gate: core_election,False,KEEP,0.43509745597839355,,,False,KEEP
meeting1_bd9068170e34,meeting1_bd9068170e34_u002,"首先,谨代表主办单位中央选举委员会向电视机前的观众悍来参加证件发表会的 3 位候选人表示感谢。",claim,"由本人中央选举委员会委员陈明负责主持,同时由本会陈月端委员在场监察。","在证件发表会正式开始前,先将证件发表会进行程序及注意事项向各位说明。",[],[],False,,2e62d6fd6fd9456554a348d414d80a9e,False,meeting1,,"首先,谨代表主办单位中央选举委员会向电视机前的观众悍来参加证件发表会的 3 位候选人表示感谢。",True,institution_only,True,gate: core_election,False,REVIEW,0.39609360694885254,,,False,KEEP
meeting1_bd9068170e34,meeting1_bd9068170e34_u004,"第一,电视证件发表会进行之程序是采取三轮方式发表证件,每一轮每位候选人发表证件时间为 10 分钟。",context,"在证件发表会正式开始前,先将证件发表会进行程序及注意事项向各位说明。",时间渐满前 3 分钟按铃一短声示意时间渐满时按铃二长生请结束发言。,[],[],False,,b90fea0d552795957ed3ef60d3152604,False,meeting1,,"第一,电视证件发表会进行之程序是采取三轮方式发表证件,每一轮每位候选人发表证件时间为 10 分钟。",True,institution_only,True,gate: core_election,False,REVIEW,0.23183901607990265,,,False,KEEP
meeting1_bd9068170e34,meeting1_bd9068170e34_u007,"时间建满时,候选人应急结束发言,不得以任何理由请求延长,如人不停止发言,主持人立即制止,并不予播出。",context,第二汉、第三轮证件发表的时间汉进行方式均相同。,"第二候选人因一抽签好次顺序发言,不得要求提前或延后。",[],[],False,,e9f80afb34938eac94b8011a63bf75c5,False,meeting1,,"时间建满时,候选人应急结束发言,不得以任何理由请求延长,如人不停止发言,主持人立即制止,并不予播出。",True,institution_only,True,gate: core_election,False,REVIEW,0.2784813940525055,,,False,KEEP
meeting1_bd9068170e34,meeting1_bd9068170e34_u008,"第二候选人因一抽签好次顺序发言,不得要求提前或延后。",context,"时间建满时,候选人应急结束发言,不得以任何理由请求延长,如人不停止发言,主持人立即制止,并不予播出。","经主持人畅明三次仍未上台发表证件者,以弃权论第三候选人发表证件时如有违背公共秩序、善良风俗之行为,主持人应予制止,并不予播出。",[],[],False,,c95317e6fc93bcab05cd53afb5af21e7,False,meeting1,,"第二候选人因一抽签好次顺序发言,不得要求提前或延后。",True,institution_only,True,gate: core_election,False,REVIEW,0.3161618113517761,,,False,KEEP
meeting1_bd9068170e34,meeting1_bd9068170e34_u009,"经主持人畅明三次仍未上台发表证件者,以弃权论第三候选人发表证件时如有违背公共秩序、善良风俗之行为,主持人应予制止,并不予播出。",context,"第二候选人因一抽签好次顺序发言,不得要求提前或延后。",,[],[],False,,ae8c3f6a1fd515d1edfdb5b10a628d7e,False,meeting1,,"经主持人畅明三次仍未上台发表证件者,以弃权论第三候选人发表证件时如有违背公共秩序、善良风俗之行为,主持人应予制止,并不予播出。",True,institution_only,True,gate: core_election,False,REVIEW,0.3733147084712982,,,False,KEEP
meeting1_1dfcac9007f6,meeting1_1dfcac9007f6_u000,接下来向各位介绍参加证件发表会的三位候选人。,context,,"抽签顺序,第一位候选人,柯文哲先生。",[],[],False,,cb46c3e15f5f95c64cce3c3273bf0e50,False,meeting1,,接下来向各位介绍参加证件发表会的三位候选人。,True,institution_only,True,gate: core_election,False,KEEP,0.43830522894859314,,,False,KEEP
meeting1_1dfcac9007f6,meeting1_1dfcac9007f6_u001,"抽签顺序,第一位候选人,柯文哲先生。",context,接下来向各位介绍参加证件发表会的三位候选人。,"第二位候选人,侯友谊先生。","[{""name"": ""柯文哲"", ""party"": ""TPP""}]",[],False,,60f0dc28b65688f066b866e718b5dc2b,False,meeting1,,"抽签顺序,第一位候选人,柯文哲先生。",True,cooccur: actor×institution,True,gate: actor×inst,False,REVIEW,0.40690672397613525,,,False,KEEP
meeting1_1dfcac9007f6,meeting1_1dfcac9007f6_u002,"第二位候选人,侯友谊先生。",context,"抽签顺序,第一位候选人,柯文哲先生。","第三位候选人,赖清德先生。","[{""name"": ""侯友谊"", ""party"": ""KMT""}]",[],False,,84104afccc014ae6c680c785798f85f6,False,meeting1,,"第二位候选人,侯友谊先生。",True,institution_only,True,gate: core_election,False,KEEP,0.44151920080184937,,,False,KEEP
meeting1_1dfcac9007f6,meeting1_1dfcac9007f6_u003,"第三位候选人,赖清德先生。",context,"第二位候选人,侯友谊先生。","现在开始进行今天的证件发表会,首先请第一轮第一位候选人柯文哲先生发表证件,时间 10 分钟,请发言。","[{""name"": ""赖清德"", ""party"": ""DPP""}]",[],False,,d0cddddb291ba9094c1762eae2b4111e,False,meeting1,,"第三位候选人,赖清德先生。",True,cooccur: actor×institution,True,gate: actor×inst,False,KEEP,0.48327258229255676,,,False,KEEP
meeting1_1dfcac9007f6,meeting1_1dfcac9007f6_u004,"现在开始进行今天的证件发表会,首先请第一轮第一位候选人柯文哲先生发表证件,时间 10 分钟,请发言。",context,"第三位候选人,赖清德先生。",,"[{""name"": ""柯文哲"", ""party"": ""TPP""}]",[],False,,f21de8b80e7a26907d01607d90ea018f,False,meeting1,,"现在开始进行今天的证件发表会,首先请第一轮第一位候选人柯文哲先生发表证件,时间 10 分钟,请发言。",True,cooccur: actor×institution,True,gate: actor×inst,False,REVIEW,0.3806186318397522,,,False,KEEP
meeting1_99448f8dbe08,meeting1_99448f8dbe08_u008,"我们如何建构一个社会安全网来让孩子跟家长可以安全地生活,这是我们作为领导人要思考的,我也邀请两位中等候选人一起思考,来提出看法。",context,"道具是拿着弹簧道具,学校不会被划线的,也不能阻止,还是我们缺的什么没有做才会这样?",,[],[],False,,48a73e3bfdaf8e8babdb2e8395485b14,False,meeting1,,"我们如何建构一个社会安全网来让孩子跟家长可以安全地生活,这是我们作为领导人要思考的,我也邀请两位中等候选人一起思考,来提出看法。",True,institution_only,True,gate: core_election,False,REVIEW,0.418235182762146,,,False,KEEP
meeting1_22046eb2a03c,meeting1_22046eb2a03c_u001,"今天我们要讲医疗参照劳保健康是基本人权,它是一个普世价值,也不会因为不同的信仰、宗教、政治、经济、社会而有所不同。",context,接下来我要来谈今天的议题。,"作为一个医生,我非常注重国人的健康。",[],[],False,,ffd0f86469c62c94443c5ae5adf907b3,False,meeting1,,"今天我们要讲医疗参照劳保健康是基本人权,它是一个普世价值,也不会因为不同的信仰、宗教、政治、经济、社会而有所不同。",True,institution_only,True,gate: 2 inst terms,False,REVIEW,0.33229970932006836,,,True,KEEP
meeting1_909e5fe749f8,meeting1_909e5fe749f8_u002,"病人、医护人员要健康,健保要健康。",context,"我认为台湾的医疗制度必须做一个全面的体检,第一步就是要先就鉴宝。","因此我主张第一提高医疗卫生支出的到 GDP 的 8 percent,目前只有 6.6 percent。",[],[],False,,c3108a7a2535e9516a02aeefc1a6e261,False,meeting1,,"病人、医护人员要健康,健保要健康。",True,institution_only,True,gate: strong_anchor,False,REVIEW,0.27406924962997437,,,True,KEEP
meeting1_da467078975c,meeting1_da467078975c_u006,"因此我主张投资健康,有效医疗、永续健保。",claim,"第七, 65 岁上的长子健薄会补助,应该比照太平市的制度,我们希望长子的健康也可以减少年轻子女的负担。",投资健康就是说健康比医疗重要。,[],[],False,,8eb9fed9020193c089ab150f886c28ad,False,meeting1,,"因此我主张投资健康,有效医疗、永续健保。",True,institution_only,True,gate: 2 inst terms,False,REVIEW,0.30546078085899353,,,True,KEEP
meeting1_da467078975c,meeting1_da467078975c_u009,"有效医疗要病人健康,叫医务人员健康,叫健保制度健康,医疗环境要健康,这样才能够提升整个医疗的治疗效率。",context,"OK,我们是希望病人不生病,那现在我们的国民不生病。","当然鉴宝不能倒闭,我们来谈肠灶有两个问题,它裁员不足,裁员不稳定。",[],[],False,,9cb8cf64f2964cd8a6b531f01ca6039c,False,meeting1,,"有效医疗要病人健康,叫医务人员健康,叫健保制度健康,医疗环境要健康,这样才能够提升整个医疗的治疗效率。",True,institution_only,True,gate: strong_anchor,False,REVIEW,0.2541077136993408,,,True,KEEP
meeting1_de6a82b53810,meeting1_de6a82b53810_u000,"卫部部长薛瑞远把打包票说,长照未来 5 年不会破产或者迟到,不会破产,因为基金里面还有钱,可是 5 年以后,所以我们不能把自己交给这种没有长期规划,走一步算一步的政府长债。",claim,,"要做得好,预算就要够,服务要多元完整。",[],[],False,,4bd7842535244775b64b69f76f2337c6,False,meeting1,,"卫部部长薛瑞远把打包票说,长照未来 5 年不会破产或者迟到,不会破产,因为基金里面还有钱,可是 5 年以后,所以我们不能把自己交给这种没有长期规划,走一步算一步的政府长债。",True,institution_only,True,gate: 2 inst terms,False,REVIEW,0.3609684407711029,,,False,KEEP
meeting1_c7c69055e492,meeting1_c7c69055e492_u005,"要让人民健康,就要义务健康,要义务健康就要健保健康。",context,这是国家领导人的责任。,"鉴宝的成功是台湾的骄傲,所以当然不能让鉴宝破产,但是也不能因为怕鉴宝破产就在压榨医务人员,因为这样将来失去保障的是国民的健康,所以我们要健薄有序,肠绕健全牢薄不正常。",[],[],False,,295e5da15539a0507a9e129014e6c840,False,meeting1,,"要让人民健康,就要义务健康,要义务健康就要健保健康。",True,institution_only,True,gate: strong_anchor,False,REVIEW,0.3263055086135864,,,True,KEEP
meeting1_0e9cb531b634,meeting1_0e9cb531b634_u000,"现在请第一轮第二位候选人侯友谊先生发表证件,时间 10 分钟。 请发言。",context,,,"[{""name"": ""侯友谊"", ""party"": ""KMT""}]",[],False,,db5374eaab4dcb4b4d9ebc605674a16c,False,meeting1,,"现在请第一轮第二位候选人侯友谊先生发表证件,时间 10 分钟。 请发言。",True,institution_only,True,gate: core_election,False,KEEP,0.4514455199241638,,,False,KEEP
meeting1_4211332154b4,meeting1_4211332154b4_u000,"现在请第一轮第三位候选人赖清德先生发表证件,时间 10 分钟。 请发言。",context,,,"[{""name"": ""赖清德"", ""party"": ""DPP""}]",[],False,,3b3a4be18f2bcb5f53ab4d2863f51a48,False,meeting1,,"现在请第一轮第三位候选人赖清德先生发表证件,时间 10 分钟。 请发言。",True,cooccur: actor×institution,True,gate: actor×inst,False,KEEP,0.4800509810447693,,,False,KEEP
meeting1_46399c758e46,meeting1_46399c758e46_u010,"自从决定参选总统以来,我常常在想,相较于历任的总统,我能够额外贡献给台湾什么?",context,我们大家一起来。,"我看到国民健康署的资料,国人平均余命已经到 8081 岁,但是不健康年数也高达 8.4 年。",[],[],False,,3fa4efab02c6a7597cabfbb1fd281d61,False,meeting1,,"自从决定参选总统以来,我常常在想,相较于历任的总统,我能够额外贡献给台湾什么?",True,institution_only,True,gate: core_election,False,KEEP,0.7650367021560669,,,False,KEEP
meeting1_2747ead0b517,meeting1_2747ead0b517_u000,"过去我在立法委员任内,我推动的癌症防治法要求政府宽列预算,从预防衰减治疗附件到安宁疗护,都应该要系统性地来照顾癌症的病人。",context,,"光在去年,根据这一套法律,魏无布所做的筛检就超过 400 多万人次,也筛出了五六万个癌前期的病人,早期的患者也因此可以早期发现、早期治疗,拯救了数万条宝贵的生命。",[],[],False,,0f7cf878431a93db80984b507efc0c85,False,meeting1,,"过去我在立法委员任内,我推动的癌症防治法要求政府宽列预算,从预防衰减治疗附件到安宁疗护,都应该要系统性地来照顾癌症的病人。",True,institution_only,True,gate: 2 inst terms,False,REVIEW,0.3977404236793518,,,False,KEEP
meeting1_e6b4afa32cb8,meeting1_e6b4afa32cb8_u004,"从感冒到器官移植,鉴宝统统都有照顾,也这几十年来,健保的满意度一直都高达九成以上。",context,"过去台湾社会因病而穷,因穷而病所衍生的种种社会问题。",但是鉴宝制度已经走到不得不革新的地步了。,[],[],False,,031120e850a62f7fe8e8a93c05efa8ca,False,meeting1,,"从感冒到器官移植,鉴宝统统都有照顾,也这几十年来,健保的满意度一直都高达九成以上。",True,institution_only,True,gate: strong_anchor,False,DROP,0.16577449440956116,DROP,-0.037782371044158936,True,KEEP
meeting1_37d84bc8307a,meeting1_37d84bc8307a_u005,"三年疫情已经过去,我认为防疫人员、医疗人员肩上都值得佩戴一枚勋章,我们对未来的健康台湾有信心。",claim,"战争的时候国军是英雄,防疫的时候医疗人员是英雄。",,[],[],False,,9f07e7c51a4bddf7d0f7cdae72b58449,False,meeting1,,"三年疫情已经过去,我认为防疫人员、医疗人员肩上都值得佩戴一枚勋章,我们对未来的健康台湾有信心。",True,institution_only,True,gate: 2 inst terms,False,KEEP,0.548230767250061,,,False,KEEP
meeting1_71e57011b607,meeting1_71e57011b607_u000,"现在请第二轮第一位候选人柯文哲先生发表证件,时间 10 分钟,请发言。",context,,,"[{""name"": ""柯文哲"", ""party"": ""TPP""}]",[],False,,abad15a1676ed61c85e46220b9f9bae7,False,meeting1,,"现在请第二轮第一位候选人柯文哲先生发表证件,时间 10 分钟,请发言。",True,cooccur: actor×institution,True,gate: actor×inst,False,KEEP,0.4278668165206909,,,False,KEEP
meeting1_df46fd76080a,meeting1_df46fd76080a_u000,"好,接下来的 10 分钟,我要向大家报告如何以理性、务实、科学的态度来处理台湾的外交、国防跟两岸政策。",context,,"过去 8 年,在民进党执政之下,台湾丢掉了 8 个,丢掉了 9 个邦交国现在剩下 13 个,这当然是历史新低。",[],"[""两岸|cross-strait""]",False,,01361b86e4a8ff20b1e190a9602a654a,False,meeting1,,"好,接下来的 10 分钟,我要向大家报告如何以理性、务实、科学的态度来处理台湾的外交、国防跟两岸政策。",True,institution_only,True,gate: 2 inst terms,True,KEEP,1.0,KEEP,1.0,True,KEEP
meeting1_df46fd76080a,meeting1_df46fd76080a_u001,"过去 8 年,在民进党执政之下,台湾丢掉了 8 个,丢掉了 9 个邦交国现在剩下 13 个,这当然是历史新低。",context,"好,接下来的 10 分钟,我要向大家报告如何以理性、务实、科学的态度来处理台湾的外交、国防跟两岸政策。","有人戏称外交部是断交部,但是我们也不忍苛责,因为真正的问题还是在台湾跟大陆的关系。","[{""name"": ""民进党"", ""party"": ""DPP""}]",[],False,,c864782562289d8be74cb570ad5da111,False,meeting1,,"过去 8 年,在民进党执政之下,台湾丢掉了 8 个,丢掉了 9 个邦交国现在剩下 13 个,这当然是历史新低。",True,cooccur: actor×institution,True,gate: actor×inst,False,KEEP,0.5131722688674927,,,False,KEEP
meeting1_df46fd76080a,meeting1_df46fd76080a_u002,"有人戏称外交部是断交部,但是我们也不忍苛责,因为真正的问题还是在台湾跟大陆的关系。",claim,"过去 8 年,在民进党执政之下,台湾丢掉了 8 个,丢掉了 9 个邦交国现在剩下 13 个,这当然是历史新低。","目前两岸之间几乎零互动,只有互相喊口号,完全没有沟通,这也让台湾台峡成为外国媒体所说的世界上最危险的区域。",[],[],False,,6d5f758ad9df04bcc3676b3b8aa4b9fb,False,meeting1,,"有人戏称外交部是断交部,但是我们也不忍苛责,因为真正的问题还是在台湾跟大陆的关系。",True,institution_only,True,gate: 2 inst terms,False,KEEP,0.7156479954719543,,,False,KEEP
meeting1_b23ce2de2623,meeting1_b23ce2de2623_u000,"首先我们来讨论国防的问题,台湾也不能把自己的命运寄托在别人的善意上面,因此必须建立强大的荷阻的国防力量。",context,,"所谓备战不畏战,能战不求战,就是我们的国防政策。",[],[],False,,7442c44f22f531f859df94cef1c9e701,False,meeting1,,"首先我们来讨论国防的问题,台湾也不能把自己的命运寄托在别人的善意上面,因此必须建立强大的荷阻的国防力量。",True,institution_only,False,,True,KEEP,1.0,KEEP,1.0,True,KEEP
meeting1_b23ce2de2623,meeting1_b23ce2de2623_u001,"所谓备战不畏战,能战不求战,就是我们的国防政策。",context,"首先我们来讨论国防的问题,台湾也不能把自己的命运寄托在别人的善意上面,因此必须建立强大的荷阻的国防力量。","和平是有代价的,因此国防预算要达到 GDP 的三percent,要让国军可以按照国家的战略计划去制定它的长期规划。",[],[],False,,12d368edbc97e59d4c19549f7db3dd19,False,meeting1,,"所谓备战不畏战,能战不求战,就是我们的国防政策。",True,institution_only,False,,True,KEEP,1.0,KEEP,1.0,True,KEEP
meeting1_b23ce2de2623,meeting1_b23ce2de2623_u002,"和平是有代价的,因此国防预算要达到 GDP 的三percent,要让国军可以按照国家的战略计划去制定它的长期规划。",context,"所谓备战不畏战,能战不求战,就是我们的国防政策。","但是也不要把国王预算用特别预算来处理,这个也是逃避利华院的监督啊。",[],[],False,,95dd75ec907fc6bab070951ed5fe318f,False,meeting1,,"和平是有代价的,因此国防预算要达到 GDP 的三percent,要让国军可以按照国家的战略计划去制定它的长期规划。",True,institution_only,True,gate: 2 inst terms,True,KEEP,1.0,KEEP,1.0,True,KEEP
meeting1_bbe03aa18cdb,meeting1_bbe03aa18cdb_u000,"取得武器画面经过与自主发展,两岸并行,延续国建国造、国际国造的政策,充实国防自主的能力。",context,,"同时我们也会广纳民间的技术,将研发能量集中在无人机、人工智慧灰弹这种台湾具有发展性和可行性的项目。",[],"[""两岸|cross-strait""]",False,,457aa0f3bfa3ef7eae4dc39673492c04,False,meeting1,,"取得武器画面经过与自主发展,两岸并行,延续国建国造、国际国造的政策,充实国防自主的能力。",True,institution_only,True,gate: 4 inst terms,True,KEEP,1.0,KEEP,1.0,True,KEEP
meeting1_bbe03aa18cdb,meeting1_bbe03aa18cdb_u002,"同时借着经过外购的机会来鼓励外国厂商在台湾生产,带动台湾的国防产业发展。",context,"同时我们也会广纳民间的技术,将研发能量集中在无人机、人工智慧灰弹这种台湾具有发展性和可行性的项目。",在协助本土业者利用我们优势的制造业进军国际武器的供应链来扩展军民粮用的市场。,[],[],False,,63570e05ffb2bdcb08ef4b4e73c1d342,False,meeting1,,"同时借着经过外购的机会来鼓励外国厂商在台湾生产,带动台湾的国防产业发展。",True,institution_only,False,,True,KEEP,1.0,KEEP,1.0,True,KEEP
meeting1_bbe03aa18cdb,meeting1_bbe03aa18cdb_u003,在协助本土业者利用我们优势的制造业进军国际武器的供应链来扩展军民粮用的市场。,context,"同时借着经过外购的机会来鼓励外国厂商在台湾生产,带动台湾的国防产业发展。",,[],[],False,,3d539445189312dc02e9259c71ff05d2,False,meeting1,,在协助本土业者利用我们优势的制造业进军国际武器的供应链来扩展军民粮用的市场。,True,institution_only,True,gate: 2 inst terms,False,REVIEW,0.2590101361274719,,,False,KEEP
meeting1_2b92fe558813,meeting1_2b92fe558813_u000,"过去讨论的兵役制度常常变加批评,有当过兵的人都知道,我们常常在割草,还有汽油汽,所以很多人会把当兵视为是一种浪费生命的行为。",claim,,"另外,我们的国王其实应该偏向赤通电军、海军、空军,还有不对称战略。",[],[],False,,aad8f659db128c12db11d7b358567381,False,meeting1,,"过去讨论的兵役制度常常变加批评,有当过兵的人都知道,我们常常在割草,还有汽油汽,所以很多人会把当兵视为是一种浪费生命的行为。",True,institution_only,True,gate: strong_anchor,False,REVIEW,0.28212374448776245,,,True,KEEP
meeting1_9ac2b9b49f9c,meeting1_9ac2b9b49f9c_u002,"所谓的两岸关系不是台南海峡两岸,而是太平洋两岸,必须在中美对抗的架构下来思考台湾的议题。",context,"今天外传中共施压台湾的五月天乐团,要他们发表轻重的言论,如果属实,我们就必须严厉谴责,因为这个无助于两岸之间的沟通和交流。","在这个关系里面,和平就三赢,冲突就三输。",[],"[""两岸|cross-strait""]",False,,c91593220a4c772dd7fa3dd9a6700b43,False,meeting1,,"所谓的两岸关系不是台南海峡两岸,而是太平洋两岸,必须在中美对抗的架构下来思考台湾的议题。",True,institution_only,True,gate: 2 inst terms,False,KEEP,0.6904984712600708,,,True,KEEP
meeting1_3fbfa7b8f19f,meeting1_3fbfa7b8f19f_u000,"台海两岸在过去 8 年关系恶劣,我坚持举办了 8 次的双层论坛,就是为了让双方还有一个交流沟通的管道。",context,,"2017 年台北成功举办四大运,背后有很多的谈判,但是我仍然坚守台湾的立场,也成功的让蔡英文女士以中华民国总统的身份在开幕式上台致辞。",[],"[""两岸|cross-strait""]",False,,103abfc6f383de711f2c02751c24ce52,False,meeting1,,"台海两岸在过去 8 年关系恶劣,我坚持举办了 8 次的双层论坛,就是为了让双方还有一个交流沟通的管道。",True,institution_only,True,gate: 2 inst terms,False,REVIEW,0.37940454483032227,,,True,KEEP
meeting1_3fbfa7b8f19f,meeting1_3fbfa7b8f19f_u001,"2017 年台北成功举办四大运,背后有很多的谈判,但是我仍然坚守台湾的立场,也成功的让蔡英文女士以中华民国总统的身份在开幕式上台致辞。",context,"台海两岸在过去 8 年关系恶劣,我坚持举办了 8 次的双层论坛,就是为了让双方还有一个交流沟通的管道。","也让世界看见台湾民进党在现阶段还有党纲,过去 8 年执政与大陆零互动,现在更推举一个自称务实的工作者德戴清德来当总统候选人。",[],[],False,,8639059bcf53a99d84ee58d3da2659ba,False,meeting1,,"2017 年台北成功举办四大运,背后有很多的谈判,但是我仍然坚守台湾的立场,也成功的让蔡英文女士以中华民国总统的身份在开幕式上台致辞。",True,institution_only,True,gate: core_election,False,KEEP,0.702094554901123,,,False,KEEP
meeting1_3fbfa7b8f19f,meeting1_3fbfa7b8f19f_u002,"也让世界看见台湾民进党在现阶段还有党纲,过去 8 年执政与大陆零互动,现在更推举一个自称务实的工作者德戴清德来当总统候选人。",claim,"2017 年台北成功举办四大运,背后有很多的谈判,但是我仍然坚守台湾的立场,也成功的让蔡英文女士以中华民国总统的身份在开幕式上台致辞。",,"[{""name"": ""民进党"", ""party"": ""DPP""}]",[],False,,44724443647633f9fb4b88a05e64dc66,False,meeting1,,"也让世界看见台湾民进党在现阶段还有党纲,过去 8 年执政与大陆零互动,现在更推举一个自称务实的工作者德戴清德来当总统候选人。",True,cooccur: actor×institution,True,gate: actor×inst,False,KEEP,0.7476754188537598,,,False,KEEP
meeting1_546a6dba8b64,meeting1_546a6dba8b64_u000,"另外一方面,国民党也没有修正自己的统一党章,所退败的所有一候选人也公然接受在台湾已经没有名义支持的九个共事。",claim,,"国民两党所坚持的立场都按国际社会所期待的维持现状是相违背的,耐香德只有在选举的时候才不主张,国民党也只有在选举的时候才不主张同意。","[{""name"": ""国民党"", ""party"": ""KMT""}]",[],False,,0afd7f54a4d1c2b52e8ccfbaabeeed50,False,meeting1,,"另外一方面,国民党也没有修正自己的统一党章,所退败的所有一候选人也公然接受在台湾已经没有名义支持的九个共事。",True,cooccur: actor×institution,True,gate: actor×inst,False,KEEP,0.5990135669708252,,,False,KEEP
