doc_id,unit_id,sentence,role,prev,next,speakers,targets,proc_symbolic_flag,event_phase,unit_hash,unit_dup_flag,source,date,preprocessed_text,hard_rule_keep,hard_rule_reason,policy_gate,policy_gate_reason,priority_keep,semantic_status,semantic_similarity,nli_status,nli_score,key_hit,final_status
meeting1_1f5c093a43e0,meeting1_1f5c093a43e0_u002,"金融业不仅仅是壮大自己,也推动台湾产业的进步,包括蔡英文总统就任之后,相较于马英九全总统时代,我们的国民生产毛额已经从 17 兆晋升到 23 兆元之多。",context,"好比说金融业有 66.2 兆元,保险业有 35.7 兆元,证券市场我们有高达 51.5 兆元。",,[],[],False,,aacff62b2b3331db0445e6212a47fc65,False,meeting1,,"金融业不仅仅是壮大自己,也推动台湾产业的进步,包括蔡英文总统就任之后,相较于马英九全总统时代,我们的国民生产毛额已经从 17 兆晋升到 23 兆元之多。",True,institution_only,True,gate: core_election,False,KEEP,0.46977153420448303,,,False,KEEP
meeting1_609424b17cd1,meeting1_609424b17cd1_u002,"那第二个我们也应该要更加进一步的松绑,让金融业有更宽广的发挥空间,金融业也面对着数位转型、近邻转型等等各项的挑战,未来我担任总统,我一定担任金融产业的后三,好好来推动金融产业。",context,"金融业目前也面临的几个困难,第一个国内的投资标的还有待提升来消化金融业的资金。",,[],[],False,,abe965e0e7c913197aa8d44dee096ad5,False,meeting1,,"那第二个我们也应该要更加进一步的松绑,让金融业有更宽广的发挥空间,金融业也面对着数位转型、近邻转型等等各项的挑战,未来我担任总统,我一定担任金融产业的后三,好好来推动金融产业。",True,institution_only,True,gate: core_election,False,KEEP,0.4295586347579956,,,False,KEEP
meeting1_60b4ad7222db,meeting1_60b4ad7222db_u006,"三共总统,已经在 2021 年的4月 22 号,世界第九入高诛高举台湾在 2050 年将达到近邻转型的目标。",context,第四点是打造台湾能够成为亚洲永续金融的魔幻。,"行政院也已经通过了路径图,在未来 2030 年之前投入 9, 000 亿新台币,能够带动民间的投资,在此情景之下,也非常需要金融业的授信,还有这个贷款都能够朝永续发展的目标来走,也让台湾的金融产业能够成为亚洲永续金融的魔幻。",[],[],False,,5d88d43f62fd99164ba2730a2a2c584d,False,meeting1,,"三共总统,已经在 2021 年的4月 22 号,世界第九入高诛高举台湾在 2050 年将达到近邻转型的目标。",True,institution_only,True,gate: core_election,False,KEEP,0.5795129537582397,,,False,KEEP
meeting1_60b4ad7222db,meeting1_60b4ad7222db_u007,"行政院也已经通过了路径图,在未来 2030 年之前投入 9, 000 亿新台币,能够带动民间的投资,在此情景之下,也非常需要金融业的授信,还有这个贷款都能够朝永续发展的目标来走,也让台湾的金融产业能够成为亚洲永续金融的魔幻。",context,"三共总统,已经在 2021 年的4月 22 号,世界第九入高诛高举台湾在 2050 年将达到近邻转型的目标。",,[],[],False,,11845eb42ae854037df1372ec43354c7,False,meeting1,,"行政院也已经通过了路径图,在未来 2030 年之前投入 9, 000 亿新台币,能够带动民间的投资,在此情景之下,也非常需要金融业的授信,还有这个贷款都能够朝永续发展的目标来走,也让台湾的金融产业能够成为亚洲永续金融的魔幻。",True,institution_only,True,gate: core_election,False,KEEP,0.4828716814517975,,,False,KEEP
meeting1_39e771a13e42,meeting1_39e771a13e42_u000,"刚刚两位候选人不约而同提到就是一个中国的原则,我想请问我们全国的父老乡亲也可以请两位市长作答,两岸一家亲跟要推动胡茂背后是不是一个中国原则?",claim,,"另外不断地在强化台湾的主权,可是接受酒恶共事之后,如何保障台湾的主权?",[],"[""两岸|cross-strait""]",False,,0a078bcd8d813d392cadadbd552c79f1,False,meeting1,,"刚刚两位候选人不约而同提到就是一个中国的原则,我想请问我们全国的父老乡亲也可以请两位市长作答,两岸一家亲跟要推动胡茂背后是不是一个中国原则?",True,institution_only,True,gate: core_election,False,KEEP,0.6579994559288025,,,True,KEEP
meeting1_39e771a13e42,meeting1_39e771a13e42_u004,"这一次的总统大选除了在选择总统、副总统候选人,哪一队对国家有使命感,有能力守护台湾的安全,又可以促进台湾的民主和平跟繁荣,也是在选择国家的一条方向。",context,"台湾是应该要自信的,在信赖台湾这条路上持续壮大,还是要走回头路,不管是接受九二共事,或者是接受两岸一家情,或者去推动服贸,真的对台湾有比较好吗?",我要敬请各位父老乡亲。,[],[],False,,5ab2c1dc262c78d02db31a7ee727372d,False,meeting1,,"这一次的总统大选除了在选择总统、副总统候选人,哪一队对国家有使命感,有能力守护台湾的安全,又可以促进台湾的民主和平跟繁荣,也是在选择国家的一条方向。",True,institution_only,True,gate: core_election,False,KEEP,0.7793138027191162,,,False,KEEP
meeting1_4d38a62b6afd,meeting1_4d38a62b6afd_u000,"1月 13 号一定要出来投票,如果国民党跟民众党南白河在国会占多数,那会是一个怎么样的情况?",context,,"他们可以利用国会的多数力量,不管是修法或立法来主导国家的政策。","[{""name"": ""国民党"", ""party"": ""KMT""}, {""name"": ""民众党"", ""party"": ""TPP""}]",[],False,,de3b8a08734c631bc65c8f3c0466c658,False,meeting1,,"1月 13 号一定要出来投票,如果国民党跟民众党南白河在国会占多数,那会是一个怎么样的情况?",True,cooccur: actor×institution,True,gate: actor×inst,False,KEEP,0.48231807351112366,,,True,KEEP
meeting1_54b024a69c68,meeting1_54b024a69c68_u000,"更何况政府已经提出 CPTPP 的申请案,我们也获得美国、日本跟国际社会的支持。",claim,,"未来我也会负责让台湾顺利的加入CBTBP,更何况台湾也已经成功了跟美国签订了 21 世纪贸易协定。",[],[],False,,ecc7f321f9c6b63bcd75c70450303c2e,False,meeting1,,"更何况政府已经提出 CPTPP 的申请案,我们也获得美国、日本跟国际社会的支持。",True,cooccur: actor×institution,True,gate: actor×inst,False,KEEP,0.4593246579170227,,,False,KEEP
meeting1_3cc698d4b6b6,meeting1_3cc698d4b6b6_u000,"换句话说,我们已经走进世界了,世界也已经敞开装备来欢迎台湾的参与,台湾的经济实力、产业实力,绝对有办法在未来的国际发展当中为国家作出贡献,也让台湾占有一席之地,在这种状况之下,我们是绝对不能够走回头路的。",claim,,"所以拜托大家1月 13 号一定要出来投票,总统副总统投 2 号,赖清德、肖美琴一票,区域的立委能够推,支持我们所推荐的民主大联盟优秀的立位候选人,不分区也能够支持 6 号民主进步党一票,民主进步党所推动的民主大联盟是秉持的跨党派、跨世代、跨领域邀请优秀的人才来承担台湾下一个阶段的责任,这个是民进党长期受台湾社会的支持,民进党对台湾社会的责任。",[],[],False,,30019798dcfd9f442a7f0255245b167e,False,meeting1,,"换句话说,我们已经走进世界了,世界也已经敞开装备来欢迎台湾的参与,台湾的经济实力、产业实力,绝对有办法在未来的国际发展当中为国家作出贡献,也让台湾占有一席之地,在这种状况之下,我们是绝对不能够走回头路的。",True,institution_only,True,gate: 2 inst terms,False,KEEP,0.6654002070426941,,,True,KEEP
meeting1_3cc698d4b6b6,meeting1_3cc698d4b6b6_u001,"所以拜托大家1月 13 号一定要出来投票,总统副总统投 2 号,赖清德、肖美琴一票,区域的立委能够推,支持我们所推荐的民主大联盟优秀的立位候选人,不分区也能够支持 6 号民主进步党一票,民主进步党所推动的民主大联盟是秉持的跨党派、跨世代、跨领域邀请优秀的人才来承担台湾下一个阶段的责任,这个是民进党长期受台湾社会的支持,民进党对台湾社会的责任。",claim,"换句话说,我们已经走进世界了,世界也已经敞开装备来欢迎台湾的参与,台湾的经济实力、产业实力,绝对有办法在未来的国际发展当中为国家作出贡献,也让台湾占有一席之地,在这种状况之下,我们是绝对不能够走回头路的。","邀请好的人才,大家共雄共相胜取,让台湾未来能够更好。","[{""name"": ""赖清德"", ""party"": ""DPP""}, {""name"": ""民进党"", ""party"": ""DPP""}]",[],False,,a6176a85dabdaafe518627734f1f9703,False,meeting1,,"所以拜托大家1月 13 号一定要出来投票,总统副总统投 2 号,赖清德、肖美琴一票,区域的立委能够推,支持我们所推荐的民主大联盟优秀的立位候选人,不分区也能够支持 6 号民主进步党一票,民主进步党所推动的民主大联盟是秉持的跨党派、跨世代、跨领域邀请优秀的人才来承担台湾下一个阶段的责任,这个是民进党长期受台湾社会的支持,民进党对台湾社会的责任。",True,cooccur: actor×institution,True,gate: actor×inst,True,KEEP,1.0,KEEP,1.0,True,KEEP
meeting1_579dfae028f6,meeting1_579dfae028f6_u000,"第 16 任总统、副总统选举由中央选举委员会所举办,第三场总统候选人电视证件发表会到此圆满结束。",context,,"感谢全国观众的收看,同时提醒全国的选民, 113 年 1 月 13 日投票时,请记得携带您的国民身份证印章及投票通知单前往投票。",[],[],False,,43872a67cb9700e59d0d955229b53a80,False,meeting1,,"第 16 任总统、副总统选举由中央选举委员会所举办,第三场总统候选人电视证件发表会到此圆满结束。",True,institution_only,True,gate: core_election,False,KEEP,0.4309995472431183,,,False,KEEP
meeting1_900cbb11f957,meeting1_900cbb11f957_u003,"我是这样的,我也不希望说民事选举,刚才就讲了,我不希望国民党跟民进党每次到了这种总统大选都要靠中国赢,民进党就是那一套看中保台芒果干活的国民党外面讲就跑到中国去看看有没有什么资源什么的,看他中共会不会鼓励台商回来投票。",claim,"对,这个台湾所以每次做出来都是错误的动作。","所以一个是反要反对中国来打赢选战,一个要靠中国来打赢选战,长期来看对他们都不是一个正面的发展。","[{""name"": ""民进党"", ""party"": ""DPP""}, {""name"": ""国民党"", ""party"": ""KMT""}]",[],False,,56a7bec728f5c36a6bedac6f88652110,False,meeting1,,"我是这样的,我也不希望说民事选举,刚才就讲了,我不希望国民党跟民进党每次到了这种总统大选都要靠中国赢,民进党就是那一套看中保台芒果干活的国民党外面讲就跑到中国去看看有没有什么资源什么的,看他中共会不会鼓励台商回来投票。",True,cooccur: actor×institution,True,gate: actor×inst,False,KEEP,0.6387165188789368,,,True,KEEP
meeting1_b9fe97fbf36b,meeting1_b9fe97fbf36b_u001,"那我就不计较,你今天带清德副总统,你已经变成政府那个造谣的代表,台湾会断交,我们什么时候来嘲笑过我们自己的国家?",context,"我现在声明,一般电视台那些名嘴在造谣的,我心里会想说,算了,大家都是混一口饭吃的。","没有,因为我也知道这个就是我们外交处境困难,两岸一家亲,我跟你讲,你跟习近平吃饭那不更严重?",[],[],False,,0cec50cf47dea23cdd0f67737992a1b7,False,meeting1,,"那我就不计较,你今天带清德副总统,你已经变成政府那个造谣的代表,台湾会断交,我们什么时候来嘲笑过我们自己的国家?",True,institution_only,True,gate: core_election,False,KEEP,0.7501204013824463,,,False,KEEP
meeting1_b9fe97fbf36b,meeting1_b9fe97fbf36b_u002,"没有,因为我也知道这个就是我们外交处境困难,两岸一家亲,我跟你讲,你跟习近平吃饭那不更严重?",context,"那我就不计较,你今天带清德副总统,你已经变成政府那个造谣的代表,台湾会断交,我们什么时候来嘲笑过我们自己的国家?",或者韩国两岸一家亲的还有一点难哦?,[],"[""两岸|cross-strait""]",False,,72ba642294fd191df5839ab1226b88fd,False,meeting1,,"没有,因为我也知道这个就是我们外交处境困难,两岸一家亲,我跟你讲,你跟习近平吃饭那不更严重?",True,institution_only,True,gate: strong_anchor,False,KEEP,0.5196787118911743,,,True,KEEP
meeting1_f687ce5b67ac,meeting1_f687ce5b67ac_u005,你护总统不可以带头造谣。,context,"我接受一个中国,所以是这样的。","还有一点,你当时说徐春英是共产党,你有没有出来道歉过?",[],[],False,,9dbccfa782a76be341e1e5de81a30803,False,meeting1,,你护总统不可以带头造谣。,True,institution_only,True,gate: core_election,False,REVIEW,0.40745943784713745,,,False,KEEP
meeting1_ceb7071a8497,meeting1_ceb7071a8497_u006,"耦合有意,讲得非常清楚,台湾是一定要布局全球,在经济贸易出口导向不能只看一个中国大陆,我们看的是整个区域经济,甚至要远到新南向之外的印度,包括徽州都可以去,尤其我们用印太愿景办公室来规划我们整个经济体系设施。",context,"所以我一直在思考说未来 a 华民进来再做执政的话,应该不会再去谈这些事情了。","台湾作为一个全球布局的一个很重要选项,所以台湾在整个出口国际经济贸易里面,区域经济最重要,两岸还是要维持整个相关的贸易,尤其对台商要有保障。",[],[],False,,050985bbf76b7a32ee14f10a93ca03a9,False,meeting1,,"耦合有意,讲得非常清楚,台湾是一定要布局全球,在经济贸易出口导向不能只看一个中国大陆,我们看的是整个区域经济,甚至要远到新南向之外的印度,包括徽州都可以去,尤其我们用印太愿景办公室来规划我们整个经济体系设施。",True,institution_only,True,gate: 3 inst terms,False,KEEP,0.6004137992858887,,,True,KEEP
meeting1_ceb7071a8497,meeting1_ceb7071a8497_u007,"台湾作为一个全球布局的一个很重要选项,所以台湾在整个出口国际经济贸易里面,区域经济最重要,两岸还是要维持整个相关的贸易,尤其对台商要有保障。",context,"耦合有意,讲得非常清楚,台湾是一定要布局全球,在经济贸易出口导向不能只看一个中国大陆,我们看的是整个区域经济,甚至要远到新南向之外的印度,包括徽州都可以去,尤其我们用印太愿景办公室来规划我们整个经济体系设施。",,[],"[""两岸|cross-strait""]",False,,2b387b85beeb39074de7bf42c7c7dbba,False,meeting1,,"台湾作为一个全球布局的一个很重要选项,所以台湾在整个出口国际经济贸易里面,区域经济最重要,两岸还是要维持整个相关的贸易,尤其对台商要有保障。",True,institution_only,True,gate: 5 inst terms,False,KEEP,0.5684740543365479,,,True,KEEP
meeting1_a39271e8d074,meeting1_a39271e8d074_u008,"在大陆做生意也不会贪污,不要去用某红的方式在操纵选举,这不好的。",context,还有一级架甲级的达观音也没有。,"好,谢谢大家,谢谢。",[],[],False,,74a841855b42ed4856c5a8829952dfa5,False,meeting1,,"在大陆做生意也不会贪污,不要去用某红的方式在操纵选举,这不好的。",True,institution_only,True,gate: core_election,False,KEEP,0.5140231251716614,,,False,KEEP
meeting1_4957d93a478b,meeting1_4957d93a478b_u001,"而其实我也非常希望国人能够关注到,如果未来的国会是国民党过半或是南白河过半呃。",context,"我这次所推荐或提名的区域跟不分居的地位,都是秉持民主大联盟的精神,跨党派、跨时代、跨领域邀请优秀的好人才共同承担下一个阶段的责任。",目前民进党在地方政府只拥有 5 个县市长。,"[{""name"": ""国民党"", ""party"": ""KMT""}]",[],False,,7b4a3a9c876702ad287727268133a741,False,meeting1,,"而其实我也非常希望国人能够关注到,如果未来的国会是国民党过半或是南白河过半呃。",True,cooccur: actor×institution,True,gate: actor×inst,False,KEEP,0.515078604221344,,,False,KEEP
meeting1_4957d93a478b,meeting1_4957d93a478b_u002,目前民进党在地方政府只拥有 5 个县市长。,context,"而其实我也非常希望国人能够关注到,如果未来的国会是国民党过半或是南白河过半呃。","国清两党跟五党级拥有 17 席的现实首长,如果国会再有国民党掌握或是蓝白掌握,这个在台湾的政治权力上是一个非常严重的失衡。","[{""name"": ""民进党"", ""party"": ""DPP""}]",[],False,,1ce52d4aca277a8702c398f900d9fb3e,False,meeting1,,目前民进党在地方政府只拥有 5 个县市长。,True,cooccur: actor×institution,True,gate: actor×inst,False,REVIEW,0.19722118973731995,,,False,KEEP
meeting1_4957d93a478b,meeting1_4957d93a478b_u003,"国清两党跟五党级拥有 17 席的现实首长,如果国会再有国民党掌握或是蓝白掌握,这个在台湾的政治权力上是一个非常严重的失衡。",context,目前民进党在地方政府只拥有 5 个县市长。,"未来国家即便是我当权总统,未来要推动国政都会遭遇到相当大的困难。","[{""name"": ""国民党"", ""party"": ""KMT""}]",[],False,,a491c953da75438db5ec2f7b1ab1fcb3,False,meeting1,,"国清两党跟五党级拥有 17 席的现实首长,如果国会再有国民党掌握或是蓝白掌握,这个在台湾的政治权力上是一个非常严重的失衡。",True,cooccur: actor×institution,True,gate: actor×inst,False,KEEP,0.6516659259796143,,,False,KEEP
meeting1_4957d93a478b,meeting1_4957d93a478b_u004,"未来国家即便是我当权总统,未来要推动国政都会遭遇到相当大的困难。",context,"国清两党跟五党级拥有 17 席的现实首长,如果国会再有国民党掌握或是蓝白掌握,这个在台湾的政治权力上是一个非常严重的失衡。","所以经济国人能够在总统、副总统支持耐心的消灭型之外,在立伟不管是区域或是不分区域都能够支持迷伊朗所推荐民主大联盟优秀的人选,我们一起承担台湾下一个阶段的责任,我们一起来拜托大家,也谢谢大家好,谢谢。 杨红。",[],[],False,,0790822e382a68874596dbac77940081,False,meeting1,,"未来国家即便是我当权总统,未来要推动国政都会遭遇到相当大的困难。",True,institution_only,True,gate: core_election,False,KEEP,0.5596215128898621,,,False,KEEP
meeting1_4957d93a478b,meeting1_4957d93a478b_u005,"所以经济国人能够在总统、副总统支持耐心的消灭型之外,在立伟不管是区域或是不分区域都能够支持迷伊朗所推荐民主大联盟优秀的人选,我们一起承担台湾下一个阶段的责任,我们一起来拜托大家,也谢谢大家好,谢谢。 杨红。",claim,"未来国家即便是我当权总统,未来要推动国政都会遭遇到相当大的困难。",,[],[],False,,d15d2a49c959bbf9d10112479a5abd31,False,meeting1,,"所以经济国人能够在总统、副总统支持耐心的消灭型之外,在立伟不管是区域或是不分区域都能够支持迷伊朗所推荐民主大联盟优秀的人选,我们一起承担台湾下一个阶段的责任,我们一起来拜托大家,也谢谢大家好,谢谢。 杨红。",True,institution_only,True,gate: core_election,True,KEEP,1.0,KEEP,1.0,True,KEEP
