unit_id,sentence,role,prev,next,speakers,targets,source,date,target_l1,sample_score,sampling_reason
_51ff03c6b5f8_u000,"侯友宜:當選後必定查辦「歹料的」 揭開貪污弊案 2023/12/17 18:47 (12/17 19:31 更新) (中央社記者洪學廣高雄17日電)國民黨總統候選人侯友宜今天南下高雄為立委參選人陳若翠站台,侯友宜說,自己是3個總統候選人當中最會辦案的,當選後一定會查辦「歹料的」,揭開貪污腐敗弊案。",claim,,"侯友宜下午4時許前往大寮為第4選區立委參選人陳若翠站台,多名國民黨高雄市議員、侯友宜二哥侯明鋒、前台南市議員謝龍介等人也到場助講支持,團結大會現場湧入逾2000名支持者,眾人更在場高唱「堅持」展現團結氣勢。","[{""name"": ""侯友宜"", ""party"": ""KMT""}, {""name"": ""國民黨"", ""party"": ""KMT""}]",[],01_Ho_chinatimes_news,2023-12-17 18:47:00,L1-02,8.3,targeted_gap_filling
_3996935bbccb_u006,"侯友宜說,第二,面對校園暴力與霸凌現象高度關聯,政府應參考日本訂定「防止校園霸凌對策推進法」的精神,包括加強道德教育、早日發現校園霸凌行為措施、注意利用網路的校園霸凌行為、對受霸凌兒少和監護人提供援助、對霸凌者進行懲戒及輔導,如果認為校園霸凌行為可作犯罪行為對待,應與當地警方開展合作。",claim,"政府應參照日本、韓國經驗,尤其針對重大犯罪部份,重新檢視年齡、管束、刑責等規定。","他呼籲以更積極態度面對校園霸凌問題,提供更多資源,協助預防、儘早發現及事發處理,給予高關懷對象更多輔導作為。","[{""name"": ""侯友宜"", ""party"": ""KMT""}]",[],01_Ho_chinatimes_news,2023-12-28 13:11:00,L1-02,8.3,targeted_gap_filling
_43b9877cdc9c_u018,"專制無能、貪污腐敗已經讓民進黨從頭爛到尾,尤其剛剛柯主席的那一段話,我心有相同的感覺,我常常在說去菜市場問那些殺豬的關心他們的生活,你知道他跟我說什麼嗎?",claim,"用我們堅定的步伐向前走,未來我一定陪伴著你們一起走,因為我知道你值得更好的未來,我們也知道我們的下一代,希望我們能夠做得更好,他們會更幸福。","「新潮流如果不散,臺灣就賠了一大半」,還跟我喊了3次。","[{""name"": ""民進黨"", ""party"": ""DPP""}]",[],01_Ho_chinatimes_news,2023-12-30 17:17:00,L1-02,8.3,targeted_gap_filling
_0589aa5629ec_u005,"另老師對已成年學生發展師生戀,兩情相悅則無觸法,吳林輝表示,重點是老師是否利用「不對等」權勢發展戀情,昨通過的第3條修正文字也加上,若利用不對等權勢發展戀情,違背倫理才觸法,這點朝野立委也有高度共識。",claim,"教育部學生事務及特殊教育司長吳林輝表示,「性別平等法」修法,朝野立委對「校長及教職員工」不得對未成年學生發生親密關係沒有異議,但對校長及教職員工對學生給予「教學評鑑、指導、訓練、輔導或給予工作機會」,明定不得和成年學生發展性行為及性別相關違背專業倫理,否則觸法。","吳林輝解釋,以不對等關係發展戀情的老師,若觸法皆有罰責,罰則輕重須經性平會衡量決議,最重可罰直接解雇不續聘、終身不得再聘,至於性別平等法賠償金額,酌定損害1~3倍懲罰性賠償金,教師若違法,除性平法罰則,受害學生還可上法院對老師進行訴訟。",[],[],03_Lai_ltn_news,2023-07-21 05:40:23,L1-02,8.3,targeted_gap_filling
_12e4d16b95b5_u001,"(記者許麗娟攝) 2023/10/03 19:46 〔記者許麗娟/高雄報導〕國民黨總統參選人侯友宜今天(3日)繼續在南部跑行程拜票,下午他在同黨立委參選人、高雄市議員黃柏霖的陪同下,到三民區金獅湖畔的覆鼎金保安宮和道德院參拜,保安宮廟方贈送太子爺加持的帽子,侯友宜表示獲太子爺保佑、相挺。",claim,"國民黨總統參選人侯友宜到高雄覆鼎金保安宮參拜,廟方贈送他有太子爺加持的宮廟帽祝他凍蒜。","侯友宜在到覆鼎金保安宮參拜祈福,保安宮立即送上宮廟帽,保安宮常務董事黃明華說,這頂帽子上頭繡有中壇元帥(又稱三太子、太子爺)的風火輪等寶物,帽子已在2天前由中壇元帥加持,戴上後馬上民調第1名、順利當選總統。","[{""name"": ""侯友宜"", ""party"": ""KMT""}, {""name"": ""國民黨"", ""party"": ""KMT""}]",[],01_Ho_ltn_news,2023-10-03 19:46:34,L1-02,8.3,targeted_gap_filling
_4c37f6bc645a_u007,"批柯文哲蓄意扭曲不道德 葛來儀:我不是為他背書 面對外界擔心中國可能試圖影響台灣大選,葛來儀說,中國影響台灣選舉的工具越來越多,有些是明著來,有些是暗著來。",claim,"她說:「我的感覺是,比起其他兩人,他們比較願意『支持』柯文哲。」 但葛來儀強調,對北京來說,侯友宜執政還是比民進黨當家好。","她分析,北京可能動用的手段有3種。","[{""name"": ""柯文哲"", ""party"": ""TPP""}]",[],03_Lai_chinatimes_news,2023-05-26 09:08:00,L1-02,8.3,targeted_gap_filling
_9184c2e0033d_u009,"黨團書記長莊瑞雄指出,過去國民黨的黑金、貪腐橫行,因為專制獨裁,沒有透明,人民對國民黨的黑金貪腐也有既定印象,對民進黨有更高的檢驗標準,7年多以來,沒有中央政務官因為貪污罪而被起訴,民進黨仍需持續努力。",claim,"黨團幹事長劉世芳也說,民進黨執政時期,清廉與透明程度愈來愈高,應講清楚是檢警調哪裡做不好,或法務部、廉政署哪裡做不好,批評的人應提出具體證據,而不是用影射的,不要像是有人在選舉時說苦民所苦,自己爬到樹上抓蚊子,到底是苦什麼民、苦什麼苦,讓人民看不懂。","透過 Google News 此外,民進黨發言人林楚茵今天透過新聞稿表示,民進黨政府執政至今,沒有出現重大弊案及貪腐事件,國際透明組織今年1月公布全球清廉印象指數,台灣在東亞排名第4名,清廉指數比國民黨執政時期高,這是國際認證的事實。","[{""name"": ""民進黨"", ""party"": ""DPP""}, {""name"": ""國民黨"", ""party"": ""KMT""}]",[],03_Lai_chinatimes_news,2023-07-25 13:40:00,L1-02,8.3,targeted_gap_filling
_9184c2e0033d_u000,"藍喊下架貪腐民進黨 綠反批國民黨賄選貪污罰最多 2023/7/25 13:40 (中央社記者林敬殷、葉素萍、王承中台北25日電)前高雄市長韓國瑜在日前國民黨全代會喊出「下架貪腐的民進黨」,民進黨立法院黨團表示,歷年來,不管是廉政署或選罷法,違法遭罰最多且政黨受到連帶處罰,是以國民黨居多,韓國瑜發言的迴力鏢,應該回到國民黨。",claim,,"國民黨立法院黨團總召曾銘宗接受中央社記者訪問表示,目前台灣的主流民意就是要政黨輪替,顯見下架貪腐的民進黨政府是全民共識。","[{""name"": ""民進黨"", ""party"": ""DPP""}, {""name"": ""國民黨"", ""party"": ""KMT""}]","[""立法院|institution""]",03_Lai_chinatimes_news,2023-07-25 13:40:00,L1-02,8.3,targeted_gap_filling
_1a0c6f695743_u005,"他說,美國政府宣布不支持台獨,「台獨金孫」如何繼續務實推動台獨,更批評賴清德有何資格講誠信,民進黨背棄2014年太陽花學運精神。",claim,"柯文哲表示,許多政治人物遇到違建風波都會選擇拆除,但賴清德不重視人民反感。","現場民眾詢問,有教師批判高中課綱刪減文言文,不教明末清初文人顧炎武的「廉恥」是無恥課綱。","[{""name"": ""賴清德"", ""party"": ""DPP""}, {""name"": ""民進黨"", ""party"": ""DPP""}]",[],02_Ke_chinatimes_news,2023-12-08 21:33:00,L1-02,8.3,targeted_gap_filling
_23f83d74356a_u000,批柯文哲蓄意扭曲不道德 葛來儀:我不是為他背書 2023/5/27 07:40 (6/7 17:52 更新) (中央社記者徐薇婷華盛頓26日專電)華府兩岸專家葛來儀昨天指北京傾向支持曾來往過的民眾黨主席柯文哲。,claim,,"她今天澄清,非為柯文哲背書,也未暗示柯文哲是最能與中國溝通的人,她的發言遭曲解。","[{""name"": ""柯文哲"", ""party"": ""TPP""}, {""name"": ""民眾黨"", ""party"": ""TPP""}]","[""兩岸|cross-strait""]",02_Ke_chinatimes_news,2023-05-27 07:40:00,L1-02,8.3,targeted_gap_filling
_43b9877cdc9c_u004,"侯友宜表示,過去8年大家面對詐騙、貪污、低薪、民主倒退與兩岸緊張等問題很辛苦,再過2天就是中華民國113年新的開始,不論過去的路多辛苦,大家有機會用選票改變一切,「未來我一定陪你們往前走,我知道你值得更好的未來」。",claim,"賴清德:我不是賴神 從缺失中反省成長盼帶領國家 批民進黨遠離信念 柯文哲:我代表渴望改變的聲音 侯友宜在作結論時說,柯文哲剛剛流淚是因為民進黨抹黑他,他要跟柯文哲說,「咱不用流眼淚,咱面對打擊要勇敢往前走」。","侯友宜說,他去菜市場關心殺豬的,對方提到「新潮流不散,台灣賠一半」,賴清德是共犯結構的既得利益者,為了選舉不要台獨神主牌,還切割黑金弊案與新潮流,這麼破敗的民進黨已經沒救了,無法讓人民再信任。","[{""name"": ""侯友宜"", ""party"": ""KMT""}]","[""兩岸|cross-strait""]",02_Ke_chinatimes_news,2023-12-30 17:17:00,L1-02,8.3,targeted_gap_filling
_1e310e1bfc01_u015,"柯文哲最後也以台語表示,2024年1月13日,要有勇氣不要再讓國民黨、民進黨的貪污腐敗,繼續吃銅吃鐵吃台灣,要為台灣拚一次。",claim,"過去選舉常聽到「藍的要下架綠的,綠的要下架藍的,各位同胞,終於有一次機會、同時把這兩個(政黨)下架」。",(編輯:楊蘭軒)1121230 總統候選人政見會最終場發言一覽 柯侯賴交鋒校園安全、兩岸議題 副總統候選人政見會 吳欣盈趙少康蕭美琴發言內容一次看 歷屆總統大選中國介選手段一覽 飛彈試射經貿報復擾民心 柯文哲賴清德侯友宜拚2024總統大選 7大政見比一比 侯友宜:賴清德不放棄台獨謀害台灣 忘恩負義 網傳投票箱夾層藏票 查核中心:錯誤訊息 黃珊珊黃國昌扛立院攻防 備戰2026肩負白營母雞重擔 台灣選後第3天 美媒聚焦三黨,"[{""name"": ""柯文哲"", ""party"": ""TPP""}, {""name"": ""民進黨"", ""party"": ""DPP""}, {""name"": ""國民黨"", ""party"": ""KMT""}]",[],02_Ke_chinatimes_news,2023-12-30 15:17:00,L1-02,8.3,targeted_gap_filling
_348d1fa488ce_u014,"凌濤進一步表示,根據財團法人高雄市新世代教育基金會的基本資料顯示,捐助者中的雲豹執行長譚宇軒涉及前口湖鄉長林哲凌等人貪污案件。",claim,"此外,凌濤也點出賴瑞隆在建設公司吳姓家族以及雲豹能源大股東張建偉的資助下,成立規模1000萬元的「高雄市新世代教育基金會」,而雲豹能源集團在上屆立委選舉,捐款最多的對象就是賴瑞隆。","他向賴瑞隆喊話,口口聲聲要為新世代做事,但資助者多是涉入光電弊案的人士,要如何對高雄市民交代?",[],[],01_Ho_ltn_news,2023-08-22 12:32:29,L1-02,8.3,targeted_gap_filling
_5abe1d6b3148_u001,"(記者黃淑莉攝) 2023/03/09 14:46 〔記者黃淑莉/雲林報導〕雲林地檢署偵辦達德集團涉嫌向雲林縣議長沈宗隆及3名議員行賄案,訊後檢方依違反貪污治罪條例等罪嫌,且因屬貪污重罪,有勾串證人之虞向法院聲請羈押議長沈宗隆、議員王又民及廠商、議員助理等6人,消息傳出震撼地方,據指出,2600萬元賄款是以透過下游包商以工程款夾帶方式交付,檢方擴大追查2600萬流向。",claim,雲林地檢署主任檢察官朱啟仁說明達德集團涉嫌行賄議長及議員案。,"雲林地檢署調查,達德集團在2020年間準備在雲林縣設立風機發電,因受到地方鄉親、議會部分議員反應,達德集團為讓工程能順利進行,涉嫌透過下包廠商、白手套,以工程款夾帶賄款方式行賄,包括議長沈宗隆及議員王又民、許留賓、黃文祥等,行賄金額約2600萬元。",[],[],01_Ho_ltn_news,2023-03-09 14:46:15,L1-02,8.3,targeted_gap_filling
_1e310e1bfc01_u007,"柯文哲指出,2016年民進黨上台,以為會是一個謙卑的政府,結果8年過去,國民黨沒有解決的問題,民進黨一樣也沒有解決,而且更加貪污腐敗。",claim,"缺水、缺電、缺工、缺地、缺人才,甚至缺蛋、缺豬肉、缺疫苗、缺快篩,連衛生紙都會缺。","柯文哲表示,當執政者為了一黨一派的利益犧牲國家與人民,就不要怪有6成民意期待政黨輪替,「今天如果你幹得好,怎麼會有這種事情?」 柯文哲也諷刺,賴清德在行政院長任內,要求台電燒乾淨的媒、要年輕人民把工作當作做功德,「你曉不曉得你的外號叫賴功德?」 侯友宜:賴清德不放棄台獨謀害台灣 忘恩負義 賴清德強調護台穩兩岸 批侯沒準備好、柯政見複製貼上 柯文哲表示,他今年5月20日在淡水宣布參選後,就提出台灣不應是外媒所說世界最危險的地方。","[{""name"": ""柯文哲"", ""party"": ""TPP""}, {""name"": ""民進黨"", ""party"": ""DPP""}, {""name"": ""國民黨"", ""party"": ""KMT""}]",[],02_Ke_chinatimes_news,2023-12-30 15:17:00,L1-02,8.3,targeted_gap_filling
