unit_id,sentence,role,prev,next,speakers,targets,source,date,target_l1,sample_score,sampling_reason
_5199db316b55_u004,"在特偵組捲入洩密給當時的總統馬英九,引發喧騰一時的「馬王政爭」事件後,立法院於2016年三讀通過,將特偵組設立法源「法院組織法」第63條之1刪除,特偵組自此裁撤而走入歷史,而基層檢察體系的王牌部隊,即由北檢「忠、愛、吉」3組扛下重任,專責偵辦全國矚目的貪污等刑事重案,而忠組更是領頭羊,專辦國家元首、肅貪等矚目重案,在司法界中有「天下第一組」之稱,能被挑進忠組辦案的檢察官,都是當年度檢察體系的一時之選。",claim,"據悉,北檢嚴肅看待,交給有「天下第一組」之稱的檢肅黑金專組「忠組」偵辦。","此屆總統選舉發生「藍白合」爭議,台獨團體台灣國理事長陳峻涵為此向北檢告發,指控侯、柯、朱、馬等4人,涉嫌違反總統副總統選罷法「搓圓仔湯」條款;",[],"[""立法院|institution"", ""三讀|procedure""]",01_Ho_ltn_news,2023-12-04 17:56:50,L1-02,9.8,targeted_gap_filling
_baec6553f64c_u014,"(編輯:楊凱翔)1121027 藍白政黨協商 柯辦:總統選舉整合歧見也是討論範圍 侯友宜促名字在同張選票限1天內答覆 柯文哲稱無選擇餘地像逼婚 侯友宜駁逼婚說 喊話柯文哲「先確認結婚對象是不是我」 侯友宜提民主初選、全民調各半 柯文哲:砒霜喝半罐還是死 周榆修駁「柯韓配」 王淺秋轉述韓國瑜聽聞後嚇一跳 郭台銘:若選擇政治口水 台灣將錯過下個黃金30年 柯稱最後協商期限是11/20 侯辦:不可能等到那一天 綠:藍白不掩飾政治分贓 柯文哲政治操守令人瞠目 是否與侯友宜同張選票 柯文哲:要有公平辦法 藍白政黨協商30日登場 朱立倫:不是為個別政黨考量 選出最強總統參選人 朱立倫:我與侯柯一起坐下來談 2025/05/24 10:37 2025/05/20 12:58 2025/05/20 10:36 2025/05/15 14:21 2025/05/15 14:16 2025/05/15 13:34 本網站之文字、圖片及影音,非經授權,不得轉載、公開播送或公開傳輸及利用。",claim,"原本想要22日繼續談,但柯文哲表示沒時間,而23日他就很清楚把近期談的內容告訴大家,因為再拖下去只是給別人見縫插針的機會,對兩黨都沒有好處。",,"[{""name"": ""侯友宜"", ""party"": ""KMT""}, {""name"": ""柯文哲"", ""party"": ""TPP""}]",[],02_Ke_chinatimes_news,2023-10-27 12:07:00,L1-02,9.8,targeted_gap_filling
_ed1465e691bf_u014,"民眾黨:選舉應回歸公共政策討論 柯文哲違反議會決議辦雙城論壇留呆帳 北市藍綠黨團不背書 批柯文哲蓄意扭曲不道德 葛來儀:我不是為他背書 侯友宜民調第3 趙少康:藍白不合絕對不會贏 侯友宜:兩岸要務實交流 是民進黨、柯文哲擋服貿 賴清德:重啟服貿是走回一中市場 未看清世界局勢 重啟服貿 蘇貞昌:罔顧台灣400萬從業人口生計 柯文哲與美代表團會面 強調台美關係不因誰執政改變 諾魯與台灣斷交 柯文哲:遺憾但不與中國惡性競爭 總統接見鳳凰獎災害防救楷模 強化防災體系已見成效 美代表團見蔡英文賴清德 中國外交部:堅決反對 2025/05/24 13:14 2025/05/23 10:31 2025/05/22 15:22 2025/05/21 19:20 2025/05/20 12:01 2025/05/20 11:57 本網站之文字、圖片及影音,非經授權,不得轉載、公開播送或公開傳輸及利用。",claim,(編輯:趙蔚蘭)1120624 中國要柯文哲選總統?,,"[{""name"": ""賴清德"", ""party"": ""DPP""}, {""name"": ""侯友宜"", ""party"": ""KMT""}, {""name"": ""趙少康"", ""party"": ""KMT""}, {""name"": ""柯文哲"", ""party"": ""TPP""}, {""name"": ""民進黨"", ""party"": ""DPP""}, {""name"": ""民眾黨"", ""party"": ""TPP""}]","[""兩岸|cross-strait""]",01_Ho_chinatimes_news,2023-06-24 17:13:00,L1-02,9.8,targeted_gap_filling
_dc4ae4b0dcf0_u008,"最後則是,親民黨主張五大安全,分別是國家安全、經濟安全、民生安全、環境安全、倫理安全。",claim,"第三就是之前提過的「三個呼籲、四個心」來解決兩岸問題,包含5月20日後舉行跨黨派會議、讓台灣海峽成為和平緩衝區等,宋楚瑜補充,第四個就是「四個堅持」,包含堅持中華民國憲法的國家定位、自由民主價值、台灣人當家作主的權力、兩岸和平相處與互利互助。","宋楚瑜強調,2024是台灣關鍵的一次選舉,不是投票前喊棄誰、保誰,台灣人民要的是「棄戰爭、保和平」、「棄貪腐、保清廉」,讓非綠聯盟在國會過半的關鍵,就是把政黨票投給「一世做實事」的親民黨。",[],[],02_Ke_ltn_news,2024-01-11 15:57:23,L1-02,9.8,targeted_gap_filling
_ca83d523df4e_u007,(編輯:林淑媛)1121230 賴清德:我是唯一沒有炒地炒房 已發表居住三大政策 侯友宜:凱旋苑到新莊土地都納稅申報 沒炒房炒地 賴清德:柯文哲簽藍白協議都能作廢 最沒資格談誠信 侯友宜:當選總統黨產歸零 徹底解決問題 賴清德:台灣沒有廢死 最好刑事政策是社會政策 侯問是否支持廢死 柯文哲:不執行死刑就終身監禁 賴清德酸神通廣大 侯友宜:99個門牌都合法 賴質疑重啟服貿挺核電 侯酸不廢ECFA、非核家園跳票 網傳投票箱夾層藏票 查核中心:錯誤訊息 黃珊珊黃國昌扛立院攻防 備戰2026肩負白營母雞重擔 台灣選後第3天 美媒聚焦三黨,claim,"柯文哲稱賴清德老是在示範什麼叫抹黑,不是買土地就不對,他哽咽解釋父親買那塊地,是希望有一天他回新竹當新竹醫院院長,感慨這麼多年來人生的際遇,就是沒辦法符合父親的期望。","不過半政情走向 生技、電力股走強 台股17600點關卡震盪 2024/01/01 19:32 2023/12/30 16:47 2023/12/30 16:46 2023/12/30 16:44 2023/12/30 16:40 2023/12/30 16:35 本網站之文字、圖片及影音,非經授權,不得轉載、公開播送或公開傳輸及利用。","[{""name"": ""賴清德"", ""party"": ""DPP""}, {""name"": ""侯友宜"", ""party"": ""KMT""}, {""name"": ""柯文哲"", ""party"": ""TPP""}, {""name"": ""白營"", ""party"": ""TPP""}]","[""ECFA|policy""]",01_Ho_chinatimes_news,2023-12-30 16:44:00,L1-02,9.8,targeted_gap_filling
总统辩论_e76e2f37b3f6_u980,"我说还有人跟我讲,说没关系啦, 贪污,有做事情也可以。",claim,"柯文哲: 他说没关系啦, 不要贪太多,就好。",柯文哲: 这个就是我们国家的问题。,[],[],总统辩论,,L1-02,9.8,targeted_gap_filling
_20c7162712fc_u003,"她更點名侯競辦發言人黃子哲,常上節目喊破局「民眾黨要負最大責任」,自己沒說話不代表認同,「認為民眾黨這麼壞、沒誠信,為何要找柯文哲合作?」 更多新聞:侯友宜喊重審民調 黃珊珊拒絕:同數據不會有不同結果 更多新聞:蔡壁如驚爆柯文哲「早知民調正負3%」 沒關麥內幕全曝光 2024總統大選倒數、候選人、民調分析盡在TVBS 新北耶誕城「桑塔熊回歸」必看光雕秀 活動時間、交通攻略 新北耶誕城「桑塔熊回歸」必看光雕秀 活動時間、交通攻略 《黃金露戰隊》看達人車宿攻略 再抽露營周邊好禮!",claim,最大敵人不是賴清德?,《黃金露戰隊》看達人車宿攻略 再抽露營周邊好禮!,"[{""name"": ""侯友宜"", ""party"": ""KMT""}, {""name"": ""柯文哲"", ""party"": ""TPP""}, {""name"": ""民眾黨"", ""party"": ""TPP""}]",[],03_Lai_tvbs_news,2023-11-22 10:23:00,L1-02,9.8,targeted_gap_filling
_64c5af64e02c_u000,"李坤城表示,選民認同誠信原則,才讓他贏下三重立委初選。",claim,,"(記者甘孟霖攝) 2023/04/27 14:06 〔記者甘孟霖/新北報導〕民進黨新北市第三選區(三重)立委初選,現任新北市議員彭佳芸、李余典,以及2022年選擇不連任議員的李坤城,形成「三腳督」競爭局面,今天(27日)民進黨新北市黨部公布初選民調,李坤城以46.55%勝出,將代表民進黨角逐2024立委選戰。",[],[],03_Lai_ltn_news,2023-04-27 14:06:34,L1-02,9.8,targeted_gap_filling
_9972c8778a6a_u003,"黃澎孝在臉書PO文表示,這位習慣在總統大選期間,就拿民進黨「教改」和「課綱」説事的區桂芝老師,這次「揭竿而起」的理由是教育部的「108課綱」,大刪中國傳統「文言文」,甚至於,連顧炎武四百年前的大作《廉恥》都給刪掉了,區桂芝危言聳聽的警告這將使台灣莘莘學子從此不再明白「士大夫之無恥是謂國恥」的大道理,於是區桂芝以為佔住了「道德高度」,「上綱上線」地給民進黨教改扣上「去中國化」的大帽子,還把「108課綱」打成了「無恥課綱」。",claim,"對此前國大代表黃澎孝表示,黃仁勳與蘇姿丰證明教育「去中國化」無傷大雅,換言之,區桂芝根本就是一個開歷史倒車的「老古董」。","黃澎孝指出,早在清末民初,中國就在梁啟超的倡議下,展開了「去文言文」的白話文運動,民國建立後,在胡適之、蔡元培、陳獨秀等人的推動下,不但形成了波濤洶湧的「新文學運動」。","[{""name"": ""民進黨"", ""party"": ""DPP""}]",[],01_Ho_ltn_news,2023-12-09 12:21:10,L1-02,9.8,targeted_gap_filling
_20c7162712fc_u003,"她更點名侯競辦發言人黃子哲,常上節目喊破局「民眾黨要負最大責任」,自己沒說話不代表認同,「認為民眾黨這麼壞、沒誠信,為何要找柯文哲合作?」 更多新聞:侯友宜喊重審民調 黃珊珊拒絕:同數據不會有不同結果 更多新聞:蔡壁如驚爆柯文哲「早知民調正負3%」 沒關麥內幕全曝光 2024總統大選倒數、候選人、民調分析盡在TVBS 新北耶誕城「桑塔熊回歸」必看光雕秀 活動時間、交通攻略 新北耶誕城「桑塔熊回歸」必看光雕秀 活動時間、交通攻略 《黃金露戰隊》看達人車宿攻略 再抽露營周邊好禮!",claim,最大敵人不是賴清德?,《黃金露戰隊》看達人車宿攻略 再抽露營周邊好禮!,"[{""name"": ""侯友宜"", ""party"": ""KMT""}, {""name"": ""柯文哲"", ""party"": ""TPP""}, {""name"": ""民眾黨"", ""party"": ""TPP""}]",[],02_Ke_tvbs_news,2023-11-22 10:23:00,L1-02,9.8,targeted_gap_filling
_9119c94d99bb_u009,"據了解,檢調尚未掌握此案涉不法金流的事證,如查出犯罪金流及對價關係,全案將另朝最重可處「無期徒刑」的貪污治罪條例之違背職務收賄等罪偵辦。",context,"然而,三人雖涉此罪名,但尚查無具體交付的關鍵事證,疑點還待釐清,三人才均獲交保。",不用抽 不用搶 現在用APP看新聞 保證天天中獎點我下載APP按我看活動辦法,[],[],03_Lai_ltn_news,2023-01-19 05:30:00,L1-02,9.3,targeted_gap_filling
meeting1_3e403711341b_u004,"关于中心我是个问题,我是在我已经改过部队,我会贪污,拜托大家和台湾区的机会和华文地区的地位,和台湾民众冬季的地位。",context,我相信大概的信代动物大。,,[],[],meeting1,,L1-02,9.3,targeted_gap_filling
_d084f7d0ed32_u007,"達德綠能貪污案全案偵查終結,議長沈宗隆、議員王又民、廠商鍾慶郎、德達王姓董事長及潘姓執行長等5人被依貪污罪起訴;",context,"起訴書指出,議員王又民於2019年間向潘姓被告表示希望能給予金錢贊助,達德同意每年支付150萬元,即以不實發票,再利用「禮品贊助」、「活動補助」等名目向達德公司申請交際費,期間共交付275萬元賄款給王又民。",同案游姓被告及開立不實發票廠商等人則被以緩起訴處分。,[],[],03_Lai_ltn_news,2023-07-28 13:06:06,L1-02,9.3,targeted_gap_filling
meeting3_09264e5a7069_u004,"关于中心我是个问题,我是在我已经改过部队,我会贪污,拜托大家和台湾区的机会和华文地区的地位,和台湾民众冬季的地位。",context,我相信大概的信代动物大。,,[],[],meeting3,,L1-02,9.3,targeted_gap_filling
meeting3_2fa95780e343_u005,"我一辈子都在救人,我没有包袱,我也不会贪污,我永远为弱势探普罗大众来努力。",context,那么柯文泽是你是谁?,"我为理性务实科学解决人民生活的困境,我会用清廉勤政、爱民爱乡土来深化民族,我更时时思考着我们要留下一个什么样的团结下一代,当人民偷给我,我绝对会全心全力为国效力。",[],[],meeting3,,L1-02,8.8,targeted_gap_filling
_f58322d6e2f0_u007,落實國防、經濟、民生、環境、倫理安全。,context,"棄掉政黨惡鬥,提升台灣民主品質;","宋楚瑜呼籲大選結束後、新任總統應在就職之前,舉辦「台灣共識會議」,讓朝野各黨坐下協商,共同凝聚「台灣共識」。",[],[],02_Ke_chinatimes_news,2024-01-11 13:59:00,L1-02,8.8,targeted_gap_filling
_94f190a89430_u006,"(編輯:黃瑞弘)1121007 學生質疑民進黨貪污惹議 中山大學:珍惜交流空間 蘇貞昌打書不忘選情 高喊賴清德當選國會過半 新北中和成立聯合服務處 柯文哲輔選邱臣遠 柯文哲:藍白合的SOP以民意為基礎 2025/05/23 12:48 2023/10/07 18:28 2023/10/07 16:31 2023/10/07 13:03 2023/10/06 20:18 2023/10/05 18:01 本網站之文字、圖片及影音,非經授權,不得轉載、公開播送或公開傳輸及利用。",context,"郭台銘說,社會不安造成人心不穩,「為什麼求神拜佛、為什麼要問祖先,最主要是心裡不安定」,往後台灣要選擇和平還是戰爭,面臨經濟危機的海嘯可能到來,國家何去何從。",,"[{""name"": ""賴清德"", ""party"": ""DPP""}, {""name"": ""柯文哲"", ""party"": ""TPP""}, {""name"": ""民進黨"", ""party"": ""DPP""}]",[],03_Lai_chinatimes_news,2023-10-07 13:03:00,L1-02,8.8,targeted_gap_filling
_6e49430cb6ee_u018,"(編輯:楊蘭軒)1121116 柯文哲:藍白協商退讓沒考慮個人 有信心柯侯配會贏 看待藍白合 賴清德:政治上沒有負負得正 郭辦:藍白合與郭柯合不互斥 24日前都可談 藍白協商民眾黨退讓 柯文哲:心情不好但更痛恨民進黨 藍白合3民調專家 陳陸輝莊伯仲關智宇獲推薦 黃國昌退出時力加入民眾黨 柯文哲當面邀任不分區立委 學者:台選舉不影響美對台政策 美國大選可能成轉捩點 侯友宜外交政見搭配合照 葛來儀:別暗示我挺侯 傳進入立院爭取副院長 黃國昌:毫無興趣想都沒想過 柯文哲續攻賴清德老家違建爭議 批涉誠信問題 2024/01/22 16:57 2024/01/15 11:44 2024/01/14 21:26 2024/01/14 20:59 2024/01/14 20:34 2024/01/14 20:09 本網站之文字、圖片及影音,非經授權,不得轉載、公開播送或公開傳輸及利用。",context,"侯友宜表示,賴清德是務實台獨工作者,「你相信這會換來和平嗎,這是引戰」,唯有靠有共同理念的國民黨、民眾黨一起面對,才會創造和平契機。",,"[{""name"": ""賴清德"", ""party"": ""DPP""}, {""name"": ""侯友宜"", ""party"": ""KMT""}, {""name"": ""柯文哲"", ""party"": ""TPP""}, {""name"": ""民進黨"", ""party"": ""DPP""}, {""name"": ""民眾黨"", ""party"": ""TPP""}]",[],01_Ho_chinatimes_news,2023-11-16 16:21:00,L1-02,8.8,targeted_gap_filling
meeting1_135b7f82ff69_u005,"我一辈子都在救人,我没有包袱,我也不会贪污,我永远为弱势探普罗大众来努力。",context,那么柯文泽是你是谁?,"我为理性务实科学解决人民生活的困境,我会用清廉勤政、爱民爱乡土来深化民族,我更时时思考着我们要留下一个什么样的团结下一代,当人民偷给我,我绝对会全心全力为国效力。",[],[],meeting1,,L1-02,8.8,targeted_gap_filling
_f58322d6e2f0_u007,落實國防、經濟、民生、環境、倫理安全。,context,"棄掉政黨惡鬥,提升台灣民主品質;","宋楚瑜呼籲大選結束後、新任總統應在就職之前,舉辦「台灣共識會議」,讓朝野各黨坐下協商,共同凝聚「台灣共識」。",[],[],03_Lai_chinatimes_news,2024-01-11 13:59:00,L1-02,8.8,targeted_gap_filling
_94f190a89430_u006,"(編輯:黃瑞弘)1121007 學生質疑民進黨貪污惹議 中山大學:珍惜交流空間 蘇貞昌打書不忘選情 高喊賴清德當選國會過半 新北中和成立聯合服務處 柯文哲輔選邱臣遠 柯文哲:藍白合的SOP以民意為基礎 2025/05/23 12:48 2023/10/07 18:28 2023/10/07 16:31 2023/10/07 13:03 2023/10/06 20:18 2023/10/05 18:01 本網站之文字、圖片及影音,非經授權,不得轉載、公開播送或公開傳輸及利用。",context,"郭台銘說,社會不安造成人心不穩,「為什麼求神拜佛、為什麼要問祖先,最主要是心裡不安定」,往後台灣要選擇和平還是戰爭,面臨經濟危機的海嘯可能到來,國家何去何從。",,"[{""name"": ""賴清德"", ""party"": ""DPP""}, {""name"": ""柯文哲"", ""party"": ""TPP""}, {""name"": ""民進黨"", ""party"": ""DPP""}]",[],02_Ke_chinatimes_news,2023-10-07 13:03:00,L1-02,8.8,targeted_gap_filling
_9a0191cbdf25_u001,"(資料照) 2023/12/16 20:04 〔記者陳政宇/台北報導〕前總統馬英九今(16)日出席活動時,批評民進黨從民主進步變成貪污退步。",claim,"針對馬英九(見圖)批評民進黨貪污一事,賴清德競總列舉,國民黨籍的黨公職涉貪平均刑期36年、收賄1800萬,而馬英九的愛將林益世、辦公室主任賴素如皆因收賄入獄。","民進黨總統候選人賴清德競選總部發言人陳世凱回應,國民黨籍的黨公職涉貪平均刑期36年、收賄1800萬,而馬英九的愛將林益世、辦公室主任賴素如皆因收賄入獄,涉貪遭判刑的高官族繁不及備載,可見貪婪是國民黨最熟悉的政治體制。","[{""name"": ""民進黨"", ""party"": ""DPP""}]",[],03_Lai_ltn_news,2023-12-16 20:04:06,L1-02,8.3,targeted_gap_filling
_9a0191cbdf25_u000,"針對馬英九(見圖)批評民進黨貪污一事,賴清德競總列舉,國民黨籍的黨公職涉貪平均刑期36年、收賄1800萬,而馬英九的愛將林益世、辦公室主任賴素如皆因收賄入獄。",claim,,"(資料照) 2023/12/16 20:04 〔記者陳政宇/台北報導〕前總統馬英九今(16)日出席活動時,批評民進黨從民主進步變成貪污退步。","[{""name"": ""賴清德"", ""party"": ""DPP""}, {""name"": ""民進黨"", ""party"": ""DPP""}, {""name"": ""國民黨"", ""party"": ""KMT""}]",[],03_Lai_ltn_news,2023-12-16 20:04:06,L1-02,8.3,targeted_gap_filling
_c7ff068d120a_u008,"官員指出,正副侍衛長的建議名單,是由各軍種提出建議丶經國防部彙整後,提交總統府,這也代表著無論是在國防部層級,或是三軍種司令部層級,都必須對建議名單的候選將官,做出完整的人事考核,然後才是由總統來圈定,如果建議名單人選涉有德行丶操守上的問題,軍種司令部及國防部就應該先行調查排除,萬萬不應出現這種才剛上任2天就被調職現職的尷尬場面。",claim,"依據正副侍衛長人事程序,遇有侍衛長出缺時,要由各軍種提出建議人選(現階中將丶資深少將均可)擔任,副侍衛長出缺時則由各軍種提出建議名單(通常為現階少將,但可提報優秀的資深上校),軍種在內部先行選優及綜合評價之後,提報給國防部,國防部在彙整軍種提報的建議名單後,再呈報給總統府,並由總統圈定人選。","總統府侍衛室過去曾發生「特勤人員涉嫌違法私菸案件」,時任國安局長邱國正當時召開記者會表示,未來在既定制度下,侍衛室將由國安局督考。",[],[],03_Lai_ltn_news,2023-03-03 14:43:22,L1-02,8.3,targeted_gap_filling
_b59a2d672ae5_u009,"高院二審改採「實質影響力說」,認為林益世是利用立委的權力,恐嚇中鋼、中聯公司的高層人士,改依貪污治罪條例之「違背職務行為收賄罪」重判12年。",claim,"立委任內收受6300萬元方面,歷審都判有罪,但罪名適用有歧異,一審認為6300萬元是「喬事費」,處理民間公司的合約並非立委的法定職務行為,不成立貪污罪,依刑法「公務員假借職務權力機會犯恐嚇得利罪」判刑7年4月。","高院更一審前年又維持一審見解採「法定職權說」,認定林益世僅構成「公務員假借職務權力機會恐嚇得利罪」,且因審理逾8年,適用刑事妥適審判法的減刑規定,改判4年10月。",[],[],03_Lai_ltn_news,2023-03-03 14:46:41,L1-02,8.3,targeted_gap_filling
_5d0ac284a396_u001,"(記者陳政宇攝) 2023/03/24 11:24 〔記者陳政宇/台北報導〕民進黨新北市三重區立委余天今(24)日正式宣布放棄競選連任,為配合民進黨主席賴清德政策與誠信問題,將支持前新北議員李坤城接棒參選;",claim,"余天今日受訪宣布,決定放棄區域立委選舉,並支持已登記參加初選的前新北市議員李坤城。","他並透露,有意代表派系(正國會)獲得下屆不分區提名,但仍待中央黨部規劃。","[{""name"": ""賴清德"", ""party"": ""DPP""}, {""name"": ""民進黨"", ""party"": ""DPP""}]",[],03_Lai_ltn_news,2023-03-24 11:24:09,L1-02,8.3,targeted_gap_filling
_43b9877cdc9c_u004,"侯友宜表示,過去8年大家面對詐騙、貪污、低薪、民主倒退與兩岸緊張等問題很辛苦,再過2天就是中華民國113年新的開始,不論過去的路多辛苦,大家有機會用選票改變一切,「未來我一定陪你們往前走,我知道你值得更好的未來」。",claim,"賴清德:我不是賴神 從缺失中反省成長盼帶領國家 批民進黨遠離信念 柯文哲:我代表渴望改變的聲音 侯友宜在作結論時說,柯文哲剛剛流淚是因為民進黨抹黑他,他要跟柯文哲說,「咱不用流眼淚,咱面對打擊要勇敢往前走」。","侯友宜說,他去菜市場關心殺豬的,對方提到「新潮流不散,台灣賠一半」,賴清德是共犯結構的既得利益者,為了選舉不要台獨神主牌,還切割黑金弊案與新潮流,這麼破敗的民進黨已經沒救了,無法讓人民再信任。","[{""name"": ""侯友宜"", ""party"": ""KMT""}]","[""兩岸|cross-strait""]",01_Ho_chinatimes_news,2023-12-30 17:17:00,L1-02,8.3,targeted_gap_filling
_1e310e1bfc01_u007,"柯文哲指出,2016年民進黨上台,以為會是一個謙卑的政府,結果8年過去,國民黨沒有解決的問題,民進黨一樣也沒有解決,而且更加貪污腐敗。",claim,"缺水、缺電、缺工、缺地、缺人才,甚至缺蛋、缺豬肉、缺疫苗、缺快篩,連衛生紙都會缺。","柯文哲表示,當執政者為了一黨一派的利益犧牲國家與人民,就不要怪有6成民意期待政黨輪替,「今天如果你幹得好,怎麼會有這種事情?」 柯文哲也諷刺,賴清德在行政院長任內,要求台電燒乾淨的媒、要年輕人民把工作當作做功德,「你曉不曉得你的外號叫賴功德?」 侯友宜:賴清德不放棄台獨謀害台灣 忘恩負義 賴清德強調護台穩兩岸 批侯沒準備好、柯政見複製貼上 柯文哲表示,他今年5月20日在淡水宣布參選後,就提出台灣不應是外媒所說世界最危險的地方。","[{""name"": ""柯文哲"", ""party"": ""TPP""}, {""name"": ""民進黨"", ""party"": ""DPP""}, {""name"": ""國民黨"", ""party"": ""KMT""}]",[],01_Ho_chinatimes_news,2023-12-30 15:17:00,L1-02,8.3,targeted_gap_filling
_2c2c90665960_u002,"柯志恩說,民進黨有人背著妻兒,帶著小三在外面遊玩,侯友宜則要避免想到妻兒,因為他帶著基層警察出生入死,兩個男人面對妻兒都很愧疚,但狀況卻不一樣,這就是人格、高度,總統要選品格不貪污、不會歪哥的。",claim,"國民黨今天在捷運鳳山西站旁空地舉辦造勢活動,現場展現團結氣勢,除了黨籍市議員、立委參選人外,智庫執行長柯志恩、台東縣長饒慶鈴、嘉義市長黃敏惠、前立法院長王金平等人接續致詞。","柯志恩也說,賴清德只要到高雄就說高雄要贏100萬票,立委一定要八仙過海;","[{""name"": ""侯友宜"", ""party"": ""KMT""}, {""name"": ""民進黨"", ""party"": ""DPP""}]",[],01_Ho_chinatimes_news,2023-10-28 21:43:00,L1-02,8.3,targeted_gap_filling
_0e853dfbeafb_u005,"侯友宜說,台灣第三波民主改革是為了建立典範,這是重要里程碑,如何讓人民重新信任政府很重要,領導人要有誠信,建立典範就是為了團結大家。",claim,"主持人吳子嘉談及藍白合11月簽署6點協議,第6點提到國民黨與民眾黨承諾為台灣第三波民主改革建立典範,必須成立聯合政府。","侯友宜表示,當時藍白合6點協議,別人算不算,他不管,但是他講過的一定算。","[{""name"": ""侯友宜"", ""party"": ""KMT""}]",[],01_Ho_chinatimes_news,2024-01-01 23:22:00,L1-02,8.3,targeted_gap_filling
_1e310e1bfc01_u015,"柯文哲最後也以台語表示,2024年1月13日,要有勇氣不要再讓國民黨、民進黨的貪污腐敗,繼續吃銅吃鐵吃台灣,要為台灣拚一次。",claim,"過去選舉常聽到「藍的要下架綠的,綠的要下架藍的,各位同胞,終於有一次機會、同時把這兩個(政黨)下架」。",(編輯:楊蘭軒)1121230 總統候選人政見會最終場發言一覽 柯侯賴交鋒校園安全、兩岸議題 副總統候選人政見會 吳欣盈趙少康蕭美琴發言內容一次看 歷屆總統大選中國介選手段一覽 飛彈試射經貿報復擾民心 柯文哲賴清德侯友宜拚2024總統大選 7大政見比一比 侯友宜:賴清德不放棄台獨謀害台灣 忘恩負義 網傳投票箱夾層藏票 查核中心:錯誤訊息 黃珊珊黃國昌扛立院攻防 備戰2026肩負白營母雞重擔 台灣選後第3天 美媒聚焦三黨,"[{""name"": ""柯文哲"", ""party"": ""TPP""}, {""name"": ""民進黨"", ""party"": ""DPP""}, {""name"": ""國民黨"", ""party"": ""KMT""}]",[],01_Ho_chinatimes_news,2023-12-30 15:17:00,L1-02,8.3,targeted_gap_filling
