doc_id,unit_id,sentence,role,prev,next,speakers,targets,proc_symbolic_flag,event_phase,unit_hash,unit_dup_flag,source,date,preprocessed_text,hard_rule_keep,hard_rule_reason,policy_gate,policy_gate_reason,priority_keep,semantic_status,semantic_similarity,nli_status,nli_score,key_hit,final_status
_aad0630517d3,_aad0630517d3_u002,(圖/翻攝自黃揚明(剝雞)臉書) 更多新聞:邀錢小豪拍MV 草爺再出新單曲 集資千萬再開複合式夾娃娃機店 于美人為用藝名參選台北市第五選區立委而改名。,context,于美人本名于耘捷。,(圖/翻攝自于美人臉書) 更多新聞:黑人買的網軍超雷?,[],[],False,,3127639a0a56193c7f980351c33a4aa9,False,02_Ke_tvbs_news,2023-07-04 20:38:00,(圖/翻攝自黃揚明(剝雞)臉書) 更多新聞:邀錢小豪拍MV 草爺再出新單曲 集資千萬再開複合式夾娃娃機店 于美人為用藝名參選台北市第五選區立委而改名。,True,institution_only,True,gate: core_election,False,KEEP,0.4330053031444549,,,True,KEEP
_2aa3d8a654cc,_2aa3d8a654cc_u001,更多新聞:沙國司機路中中央下車吵架 「保齡球式高速撞飛」1死1重傷 更多新聞:金球獎最佳男主角 身穿燕尾服現身In-N-Out「獎盃放桌上」 2024總統大選倒數 獨家分析盡在TVBS 《壞人大小姐》上大銀幕了!,context,"板球是印度最受歡迎的運動之一,不過8日卻傳出有選手在比賽途中,被隔壁比賽飛來的球擊中後腦、倒地後慘死的意外,這起事件再度凸顯印度人口過於稠密導致球場不足,使得單一場地經常需要同時舉辦2場以上比賽,進而發生這類型的死亡事件。",免費搶 👉早上空腹喝黑咖啡的真相 👉代謝出狀況?,[],[],False,,f2c79f1e3301f6e75bddcd7962d701ce,False,02_Ke_tvbs_news,2024-01-10 18:08:00,更多新聞:沙國司機路中中央下車吵架 「保齡球式高速撞飛」1死1重傷 更多新聞:金球獎最佳男主角 身穿燕尾服現身In-N-Out「獎盃放桌上」 2024總統大選倒數 獨家分析盡在TVBS 《壞人大小姐》上大銀幕了!,True,institution_only,True,gate: core_election,False,KEEP,0.5438989400863647,,,True,KEEP
_3556dbcc7b56,_3556dbcc7b56_u003,"更多新聞:aespa唱台灣尾牙「總統級維安」核對4個資 員工親曝:總部被逼瘋 更多新聞:aespa唱台灣尾牙「總統級維安」核對4個資 員工親曝:總部被逼瘋 《TVBS》提醒您:◎吸菸有礙身體健康,戒菸專線0800-636363◎吸菸能導致肺癌、心臟血管疾病及肺氣腫 2024總統大選倒數 獨家分析盡在TVBS 《邪妓》1/26獻妓品!",context,"今(11)天下午SM娛樂為此對外道歉,針對違規在室內使用電子煙的行為,也承諾會誠實繳納罰鍰。",免費搶票 👉早上空腹喝黑咖啡的真相 👉代謝出狀況?,[],[],False,,268fbe1fa619c528f9311ac3bcd15b27,False,02_Ke_tvbs_news,2024-01-11 15:36:00,"更多新聞:aespa唱台灣尾牙「總統級維安」核對4個資 員工親曝:總部被逼瘋 更多新聞:aespa唱台灣尾牙「總統級維安」核對4個資 員工親曝:總部被逼瘋 《TVBS》提醒您:◎吸菸有礙身體健康,戒菸專線0800-636363◎吸菸能導致肺癌、心臟血管疾病及肺氣腫 2024總統大選倒數 獨家分析盡在TVBS 《邪妓》1/26獻妓品!",True,institution_only,True,gate: taiwanicity=2,True,KEEP,1.0,KEEP,1.0,True,KEEP
_aab4327be9b6,_aab4327be9b6_u002,"民國80年11月10日,中華職棒總冠軍賽第7戰在現已拆除的台北市立棒球場登場,味全龍對決統一獅。",context,"回顧倡議、籌備、興建過程,歷時長達32年與6名台北市長,今年終於取得使用執照,朝正式啟用再進一步。","比賽期間天公不作美,滿場超過1萬3000名觀眾淋成落湯雞,比賽一度中斷。",[],[],False,,1b97f944bf05bdff8379b93a59e46a50,False,02_Ke_tvbs_news,2023-11-18 14:22:00,"民國80年11月10日,中華職棒總冠軍賽第7戰在現已拆除的台北市立棒球場登場,味全龍對決統一獅。",True,institution_only,True,gate: strong_anchor,False,REVIEW,0.2237814664840698,,,False,KEEP
_aab4327be9b6,_aab4327be9b6_u004,"2024總統大選倒數、候選人、民調分析盡在TVBS 新北耶誕城「桑塔熊回歸」必看光雕秀 活動時間、交通攻略 新北耶誕城「桑塔熊回歸」必看光雕秀 活動時間、交通攻略 點我拿《五月的35日》免費電影票,12/1起戲院見!",context,"比賽期間天公不作美,滿場超過1萬3000名觀眾淋成落湯雞,比賽一度中斷。","點我拿《五月的35日》免費電影票,12/1起戲院見!",[],[],False,,abd33fba2a8e43101e35a540e20e8d2a,False,02_Ke_tvbs_news,2023-11-18 14:22:00,"2024總統大選倒數、候選人、民調分析盡在TVBS 新北耶誕城「桑塔熊回歸」必看光雕秀 活動時間、交通攻略 新北耶誕城「桑塔熊回歸」必看光雕秀 活動時間、交通攻略 點我拿《五月的35日》免費電影票,12/1起戲院見!",True,institution_only,True,gate: core_election,False,KEEP,0.5208131074905396,,,True,KEEP
_3ec50a28bbee,_3ec50a28bbee_u000,"新北市議會第一審查會昨天專案報告城市外交,期間,民進黨議員陳乃瑜嗆國民黨議員戴湘儀「你就是護航的花瓶」,讓戴湘儀自曝氣到手抖,轟民進黨主席、總統參選人賴清德上個月才說要挺女權,會提升女性的政策參與機會與勞動價值,讓每名女性自由、尊嚴追求夢想,「全國女性都不應該受到這樣的歧視」。",claim,,新北市議員陳乃瑜。,"[{""name"": ""賴清德"", ""party"": ""DPP""}, {""name"": ""民進黨"", ""party"": ""DPP""}, {""name"": ""國民黨"", ""party"": ""KMT""}]",[],False,,72d92af845cbf6925ed4d5c30eb3bb19,False,02_Ke_tvbs_news,2023-10-14 09:46:00,"新北市議會第一審查會昨天專案報告城市外交,期間,民進黨議員陳乃瑜嗆國民黨議員戴湘儀「你就是護航的花瓶」,讓戴湘儀自曝氣到手抖,轟民進黨主席、總統參選人賴清德上個月才說要挺女權,會提升女性的政策參與機會與勞動價值,讓每名女性自由、尊嚴追求夢想,「全國女性都不應該受到這樣的歧視」。",True,cooccur: actor×institution,True,gate: actor×inst,False,KEEP,0.5562935471534729,,,True,KEEP
_3ec50a28bbee,_3ec50a28bbee_u004,(圖/翻攝自戴湘儀IG) 更多新聞:藍白合成不成「底線十月底」 柯文哲:時間越近大家頭腦越清楚 2024總統大選倒數、候選人、民調分析盡在TVBS 維持體態不費力!,context,"柯文哲喊「柯當正」勝率最高 郭董也有份 戴湘儀透露,其實當下氣到手都在抖。",41歲王心凌:掌握2個8分原則 維持體態不費力!,"[{""name"": ""柯文哲"", ""party"": ""TPP""}]",[],False,,bda0c0f97e40d638c7270cf633310da6,False,02_Ke_tvbs_news,2023-10-14 09:46:00,(圖/翻攝自戴湘儀IG) 更多新聞:藍白合成不成「底線十月底」 柯文哲:時間越近大家頭腦越清楚 2024總統大選倒數、候選人、民調分析盡在TVBS 維持體態不費力!,True,cooccur: actor×institution,True,gate: actor×inst,False,KEEP,0.6905466914176941,,,True,KEEP
_9aabcd853ce0,_9aabcd853ce0_u000,"鴻海創辦人郭台銘今(28)日以一席「迷彩服」赴桃園市蘆竹區誠聖宮參拜,現場也有不少支持者高喊「總統好!」郭台銘表示,誠聖宮廟前廣場這次借給國軍做為演習據點是個特殊原因,所以他特地穿上迷彩軍服,向漢光演習的國軍弟兄表達敬意。",claim,,"他也強調,「戰爭無情,和平無價」,建軍備戰是守護和平的最後手段,「備戰絕不懼戰!」我們只有一個目標,維護台海和平, 打造台灣下一個「黃金三十年」, 確保中華民國繁榮昌盛,我們的孩子幸福平安。",[],[],False,,9950856a4131b18873ad8c9f612443c6,False,02_Ke_tvbs_news,2023-07-28 12:23:00,"鴻海創辦人郭台銘今(28)日以一席「迷彩服」赴桃園市蘆竹區誠聖宮參拜,現場也有不少支持者高喊「總統好!」郭台銘表示,誠聖宮廟前廣場這次借給國軍做為演習據點是個特殊原因,所以他特地穿上迷彩軍服,向漢光演習的國軍弟兄表達敬意。",True,institution_only,True,gate: core_election,False,KEEP,0.574113130569458,,,True,KEEP
_9aabcd853ce0,_9aabcd853ce0_u001,"他也強調,「戰爭無情,和平無價」,建軍備戰是守護和平的最後手段,「備戰絕不懼戰!」我們只有一個目標,維護台海和平, 打造台灣下一個「黃金三十年」, 確保中華民國繁榮昌盛,我們的孩子幸福平安。",claim,"鴻海創辦人郭台銘今(28)日以一席「迷彩服」赴桃園市蘆竹區誠聖宮參拜,現場也有不少支持者高喊「總統好!」郭台銘表示,誠聖宮廟前廣場這次借給國軍做為演習據點是個特殊原因,所以他特地穿上迷彩軍服,向漢光演習的國軍弟兄表達敬意。","郭台銘穿著一身迷彩軍服,一下車就吸引眾人目光,不少支持者前來問候、握手及合照,看到國軍弟兄還舉起右手敬禮。",[],[],False,,be87df9aa34d924588de557c04d5ddc6,False,02_Ke_tvbs_news,2023-07-28 12:23:00,"他也強調,「戰爭無情,和平無價」,建軍備戰是守護和平的最後手段,「備戰絕不懼戰!」我們只有一個目標,維護台海和平, 打造台灣下一個「黃金三十年」, 確保中華民國繁榮昌盛,我們的孩子幸福平安。",True,institution_only,True,gate: taiwanicity=2,True,KEEP,1.0,KEEP,1.0,True,KEEP
_f71737803d48,_f71737803d48_u001,"對此,馬西屏今(11)日也親上火線解釋,直言「這也是我20年生涯的第一次!」馬西屏今日突然在臉書表示,他2004年開始在電視上評論,這份工作今年剛好20年,「我最近一個半月沒有出現在電視評論節目,這也是我20年生涯的第一次,除了生病之外,我還沒有放自己假一個半月過,休假的真愉快。」 馬西屏直言,「最近一個半月沒有出現在電視評論節目,這也是我20年生涯的第一次。」(圖/翻攝自馬西屏臉書) 2024總統大選倒數 獨家分析盡在TVBS 《邪妓》1/26獻妓品!",claim,"68歲資深媒體人馬西屏驚爆「消失1個半月」,上遍各大政論節目的他,這近1個多月以來,卻一點蹤跡都沒有!",免費搶票 👉早上空腹喝黑咖啡的真相 👉代謝出狀況?,[],[],False,,a625b1ec623b3753b6ab37cfa3a74f38,False,02_Ke_tvbs_news,2024-01-11 11:25:00,"對此,馬西屏今(11)日也親上火線解釋,直言「這也是我20年生涯的第一次!」馬西屏今日突然在臉書表示,他2004年開始在電視上評論,這份工作今年剛好20年,「我最近一個半月沒有出現在電視評論節目,這也是我20年生涯的第一次,除了生病之外,我還沒有放自己假一個半月過,休假的真愉快。」 馬西屏直言,「最近一個半月沒有出現在電視評論節目,這也是我20年生涯的第一次。」(圖/翻攝自馬西屏臉書) 2024總統大選倒數 獨家分析盡在TVBS 《邪妓》1/26獻妓品!",True,institution_only,True,gate: core_election,False,REVIEW,0.3182882070541382,,,True,KEEP
_6cdf8391f889,_6cdf8391f889_u001,(圖/翻攝自統一獅官方粉絲團臉書) 統一獅挑戰上半季冠軍。,context,"林安可4月23日重返一軍頻頻開轟,暫居本季全壘打王。","(圖/翻攝自統一獅官方粉絲團臉書) 本文為作者評論意見並獨家授權刊登,不代表TVBS立場,版權所有,未經許可請勿引用,以免侵權。",[],[],False,,90b579b107595c74adce30acac4f1025,False,02_Ke_tvbs_news,2023-06-06 13:02:00,(圖/翻攝自統一獅官方粉絲團臉書) 統一獅挑戰上半季冠軍。,True,institution_only,True,gate: strong_anchor,False,REVIEW,0.1751076877117157,,,False,KEEP
_6cdf8391f889,_6cdf8391f889_u002,"(圖/翻攝自統一獅官方粉絲團臉書) 本文為作者評論意見並獨家授權刊登,不代表TVBS立場,版權所有,未經許可請勿引用,以免侵權。",context,(圖/翻攝自統一獅官方粉絲團臉書) 統一獅挑戰上半季冠軍。,"本文為作者評論意見並獨家授權刊登,不代表TVBS立場,版權所有,未經許可請勿引用,以免侵權。",[],[],False,,ceb9f0afd4cf719d8485d39a66b4e202,False,02_Ke_tvbs_news,2023-06-06 13:02:00,"(圖/翻攝自統一獅官方粉絲團臉書) 本文為作者評論意見並獨家授權刊登,不代表TVBS立場,版權所有,未經許可請勿引用,以免侵權。",True,institution_only,True,gate: strong_anchor,False,REVIEW,0.1747027039527893,,,False,KEEP
_30b7d986bab6,_30b7d986bab6_u000,"民進黨今(16)日下午在台北圓山飯店召開全代會,是副總統賴清德接任黨主席後的首次會議,前任主席、總統蔡英文也將到場。",context,,"會中賴、蔡都將發表談話,也會一字排開替代表民進黨參選總統的賴清德及提名或合作的71區域立委候選人大造勢;","[{""name"": ""賴清德"", ""party"": ""DPP""}, {""name"": ""民進黨"", ""party"": ""DPP""}]",[],False,,599b74ea8507bdf72457572886e49835,False,02_Ke_tvbs_news,2023-07-16 10:29:00,"民進黨今(16)日下午在台北圓山飯店召開全代會,是副總統賴清德接任黨主席後的首次會議,前任主席、總統蔡英文也將到場。",True,cooccur: actor×institution,True,gate: actor×inst,False,KEEP,0.5263580083847046,,,True,KEEP
_30b7d986bab6,_30b7d986bab6_u001,"會中賴、蔡都將發表談話,也會一字排開替代表民進黨參選總統的賴清德及提名或合作的71區域立委候選人大造勢;",context,"民進黨今(16)日下午在台北圓山飯店召開全代會,是副總統賴清德接任黨主席後的首次會議,前任主席、總統蔡英文也將到場。","此外,也將提請修正《公職候選人提名條例》,是否納入黑金槍毒不能參選,展現改革決心,受到關注。","[{""name"": ""賴清德"", ""party"": ""DPP""}, {""name"": ""民進黨"", ""party"": ""DPP""}]",[],True,campaigning,15998f546d7f4b5bdaa819d121433780,False,02_Ke_tvbs_news,2023-07-16 10:29:00,"會中賴、蔡都將發表談話,也會一字排開替代表民進黨參選總統的賴清德及提名或合作的71區域立委候選人大造勢;",True,cooccur: actor×institution,True,gate: actor×inst,False,KEEP,0.6344164609909058,,,True,KEEP
_30b7d986bab6,_30b7d986bab6_u002,"此外,也將提請修正《公職候選人提名條例》,是否納入黑金槍毒不能參選,展現改革決心,受到關注。",context,"會中賴、蔡都將發表談話,也會一字排開替代表民進黨參選總統的賴清德及提名或合作的71區域立委候選人大造勢;",賴清德將於全代會中發表談話。,[],[],False,,459a963a220c3702b21cab16ca1f4521,False,02_Ke_tvbs_news,2023-07-16 10:29:00,"此外,也將提請修正《公職候選人提名條例》,是否納入黑金槍毒不能參選,展現改革決心,受到關注。",True,institution_only,True,gate: core_election,False,KEEP,0.4210581183433532,,,False,KEEP
_a5ecac3c42c5,_a5ecac3c42c5_u000,"國民黨台北市黨部今(2)日下午在台北市大直典華飯店舉行「鳳鳴朝陽 萬眾一心」誓師大會,替藍營總統參選人侯友宜造勢,市黨部原先有邀請高雄市前市長韓國瑜到場,不過韓國瑜昨天已經提前在黃復興黨部活動中與侯友宜合體同框,今天並未現身而是改送花籃,祝活動「圓滿成功」。",context,,"但韓國瑜昨與侯友宜兩人互動冷,全場也沒提支持侯友宜,今天又缺席僅送花籃,也讓藍軍內部憂心兩人是否真的心結已解。","[{""name"": ""侯友宜"", ""party"": ""KMT""}, {""name"": ""國民黨"", ""party"": ""KMT""}, {""name"": ""藍營"", ""party"": ""KMT""}]",[],True,campaigning,7a9b48b70caa315ded7a6fb8ad7064a7,False,02_Ke_tvbs_news,2023-07-02 14:45:00,"國民黨台北市黨部今(2)日下午在台北市大直典華飯店舉行「鳳鳴朝陽 萬眾一心」誓師大會,替藍營總統參選人侯友宜造勢,市黨部原先有邀請高雄市前市長韓國瑜到場,不過韓國瑜昨天已經提前在黃復興黨部活動中與侯友宜合體同框,今天並未現身而是改送花籃,祝活動「圓滿成功」。",True,cooccur: actor×institution,True,gate: actor×inst,False,KEEP,0.5249383449554443,,,True,KEEP
_a5ecac3c42c5,_a5ecac3c42c5_u002,"負責主辦的北市黨部主委黃呂錦茹今天頒發動員召集令予基層組織及直屬社團,號召百餘個社團組織千軍萬馬來相挺侯友宜,會場擠滿千人支持者揮舞國旗,場面壯觀。",claim,"但韓國瑜昨與侯友宜兩人互動冷,全場也沒提支持侯友宜,今天又缺席僅送花籃,也讓藍軍內部憂心兩人是否真的心結已解。","韓國瑜昨天高喊集中選票,但未提及侯友宜本人名字。","[{""name"": ""侯友宜"", ""party"": ""KMT""}]","[""國旗|symbol""]",True,,3880bec782cc007c8822bd3abd383ef6,False,02_Ke_tvbs_news,2023-07-02 14:45:00,"負責主辦的北市黨部主委黃呂錦茹今天頒發動員召集令予基層組織及直屬社團,號召百餘個社團組織千軍萬馬來相挺侯友宜,會場擠滿千人支持者揮舞國旗,場面壯觀。",True,cooccur: actor×institution,True,gate: actor×inst,False,REVIEW,0.4010743796825409,,,True,KEEP
_f58c98af4177,_f58c98af4177_u000,"由湯唯、影帝梁朝偉2007年共演的《色,戒》,橫掃多個國際獎外,湯唯也因而聲名大噪,該片在兩岸三地掀起熱議,尤其兩人大尺度的床戲,更是最多人咀嚼的話題之一,還不斷傳出兩人假戲真做。",context,,"湯唯原本與大陸男星田雨愛得轟轟烈烈,卻在拍完這部戲後分手,許多網友便斷定男方接受不了「真槍實彈」的床戲。",[],"[""兩岸|cross-strait""]",False,,d7152d8027ebebd5c1c0377bad2dfe53,False,02_Ke_tvbs_news,2023-08-31 14:00:00,"由湯唯、影帝梁朝偉2007年共演的《色,戒》,橫掃多個國際獎外,湯唯也因而聲名大噪,該片在兩岸三地掀起熱議,尤其兩人大尺度的床戲,更是最多人咀嚼的話題之一,還不斷傳出兩人假戲真做。",True,institution_only,True,gate: 2 inst terms,False,REVIEW,0.2380262613296508,,,True,KEEP
_15bbd3356d56,_15bbd3356d56_u000,"主持人于美人出戰台北市第五選區(北中正、萬華)立委,民眾黨總統參選人柯文哲昨(26日)也表態支持。",claim,,"而于美人今(27)日上廣播節目也坦言,聽到時非常驚訝「殺的措手不及」,被問到「當選後是否考慮民眾黨」,于美人也表態了!","[{""name"": ""柯文哲"", ""party"": ""TPP""}, {""name"": ""民眾黨"", ""party"": ""TPP""}]",[],False,,3f3716825cd666a55bb497355b1610fa,False,02_Ke_tvbs_news,2023-06-27 08:59:00,"主持人于美人出戰台北市第五選區(北中正、萬華)立委,民眾黨總統參選人柯文哲昨(26日)也表態支持。",True,cooccur: actor×institution,True,gate: actor×inst,False,KEEP,0.6924057006835938,,,True,KEEP
_15bbd3356d56,_15bbd3356d56_u002,"于美人於《千秋萬事》中表示,當時聽到柯文哲表態支持,真的是「殺的我措手不及」,不過所有肯定都欣然接受,只是聽到時是驚訝的,「但也覺得他(柯文哲)是想在立法院中不要一黨獨大,這想法我是理解」。",claim,"而于美人今(27)日上廣播節目也坦言,聽到時非常驚訝「殺的措手不及」,被問到「當選後是否考慮民眾黨」,于美人也表態了!","于美人表示聽到柯文哲喊支持,真的是「殺的措手不及」。","[{""name"": ""柯文哲"", ""party"": ""TPP""}]","[""立法院|institution""]",False,,e1d1a58ae8b8c3bbb4f8d399f18f5999,False,02_Ke_tvbs_news,2023-06-27 08:59:00,"于美人於《千秋萬事》中表示,當時聽到柯文哲表態支持,真的是「殺的我措手不及」,不過所有肯定都欣然接受,只是聽到時是驚訝的,「但也覺得他(柯文哲)是想在立法院中不要一黨獨大,這想法我是理解」。",True,cooccur: actor×institution,True,gate: actor×inst,True,KEEP,1.0,KEEP,1.0,True,KEEP
_8582b7ae8119,_8582b7ae8119_u000,"2014年「太陽花學運」在當時引發社會大眾高度關注,但在經過9年後,許多曾表態支持這起社會運動的政商名流卻紛紛「後悔」,包括名嘴朱學恒也在直播節目中向前立委蔡正元致歉,而蔡正元的小編也11日透露,民眾黨總統參選人柯文哲、柯競辦總幹事黃珊珊私下也已為「支持太陽花」道歉。",claim,,"不過,柯文哲辦公室發言人戴于文今(12)日表示,柯文哲從未因太陽花事件向蔡正元道歉,僅是針對太陽花事件後續交換意見。","[{""name"": ""柯文哲"", ""party"": ""TPP""}, {""name"": ""民眾黨"", ""party"": ""TPP""}]",[],False,,d2b1e1647fd316eef7532bdaf67f1c9a,False,02_Ke_tvbs_news,2023-11-12 10:50:00,"2014年「太陽花學運」在當時引發社會大眾高度關注,但在經過9年後,許多曾表態支持這起社會運動的政商名流卻紛紛「後悔」,包括名嘴朱學恒也在直播節目中向前立委蔡正元致歉,而蔡正元的小編也11日透露,民眾黨總統參選人柯文哲、柯競辦總幹事黃珊珊私下也已為「支持太陽花」道歉。",True,cooccur: actor×institution,True,gate: actor×inst,False,KEEP,0.4854503273963928,,,True,KEEP
_8582b7ae8119,_8582b7ae8119_u003,"柯文哲曾表態支持太陽花學運,並現身立法院替學生們加油打氣。",claim,"戴于文表示,柯文哲從未因太陽花事件向蔡正元道歉,僅是針對太陽花事件後續交換意見,強調太陽花事件是台灣政經發展上重要的記憶,也是落實公開透明、全民參與的契機,對於台灣的民主進程,都有正面的助益。","(圖/翻攝自柯文哲臉書) 2024總統大選倒數、候選人、民調分析盡在TVBS 加入《TVBS娛樂頭條》官方LINE帳號,拿熱門旅宿券 加入《TVBS娛樂頭條》官方LINE帳號,拿熱門旅宿券 3種食物很營養,卻害你血糖飆升!","[{""name"": ""柯文哲"", ""party"": ""TPP""}]","[""立法院|institution""]",False,,ecb43180e82c3b11efa7e4c564fdb18b,False,02_Ke_tvbs_news,2023-11-12 10:50:00,"柯文哲曾表態支持太陽花學運,並現身立法院替學生們加油打氣。",True,cooccur: actor×institution,True,gate: actor×inst,True,KEEP,1.0,KEEP,1.0,True,KEEP
_8582b7ae8119,_8582b7ae8119_u004,"(圖/翻攝自柯文哲臉書) 2024總統大選倒數、候選人、民調分析盡在TVBS 加入《TVBS娛樂頭條》官方LINE帳號,拿熱門旅宿券 加入《TVBS娛樂頭條》官方LINE帳號,拿熱門旅宿券 3種食物很營養,卻害你血糖飆升!",context,"柯文哲曾表態支持太陽花學運,並現身立法院替學生們加油打氣。",糖友飲食錯觀念快丟掉 2024年12生肖財運皮夾色大公開!,"[{""name"": ""柯文哲"", ""party"": ""TPP""}]",[],False,,91bcd0624fc634e0e8adede32849fbcf,False,02_Ke_tvbs_news,2023-11-12 10:50:00,"(圖/翻攝自柯文哲臉書) 2024總統大選倒數、候選人、民調分析盡在TVBS 加入《TVBS娛樂頭條》官方LINE帳號,拿熱門旅宿券 加入《TVBS娛樂頭條》官方LINE帳號,拿熱門旅宿券 3種食物很營養,卻害你血糖飆升!",True,cooccur: actor×institution,True,gate: actor×inst,False,REVIEW,0.4106497764587402,,,True,KEEP
_da99f8ac2f7d,_da99f8ac2f7d_u000,"民進黨籍嘉義市5屆議員、現任黨團總召蔡文旭今天病逝,享壽60歲,妻子哀痛發文「有些人不能失去、卻不得不放手」;",context,,"蔡文旭病中自認活得很精彩,「唯一抱歉的是,無法再為鄉親服務」。","[{""name"": ""民進黨"", ""party"": ""DPP""}]",[],False,,3b2847edef61b9eecf96230903dafb41,False,02_Ke_tvbs_news,2023-12-13 18:05:00,"民進黨籍嘉義市5屆議員、現任黨團總召蔡文旭今天病逝,享壽60歲,妻子哀痛發文「有些人不能失去、卻不得不放手」;",True,cooccur: actor×institution,True,gate: actor×inst,False,KEEP,0.4447470307350158,,,False,KEEP
_da99f8ac2f7d,_da99f8ac2f7d_u003,"2024總統大選倒數、候選人、民調分析盡在TVBS 新北耶誕城「桑塔熊回歸」必看光雕秀 活動時間、交通攻略 新北耶誕城「桑塔熊回歸」必看光雕秀 活動時間、交通攻略 快來下載TVBS新聞APP,天天打卡抽咖啡 2024十二生肖運勢搶先看 「這生肖」把握前途無量的一年 👉早上空腹喝黑咖啡的真相 👉代謝出狀況?",context,"蔡文旭服務處表示,蔡文旭今年8月間才獨自騎機車到花蓮縣旅遊,但回到嘉義後,發現走路常會喘,說話上氣不接下氣,就醫診斷是肺積水,已浸潤多日,肺部已有萎縮現像,立即住院治療,出院後慢慢調養休息。",你吃的可能是關鍵!,[],[],False,,f3c15e271bce5602daacf0f1fff57bb4,False,02_Ke_tvbs_news,2023-12-13 18:05:00,"2024總統大選倒數、候選人、民調分析盡在TVBS 新北耶誕城「桑塔熊回歸」必看光雕秀 活動時間、交通攻略 新北耶誕城「桑塔熊回歸」必看光雕秀 活動時間、交通攻略 快來下載TVBS新聞APP,天天打卡抽咖啡 2024十二生肖運勢搶先看 「這生肖」把握前途無量的一年 👉早上空腹喝黑咖啡的真相 👉代謝出狀況?",True,institution_only,True,gate: core_election,False,KEEP,0.5433096289634705,,,True,KEEP
