doc_id,unit_id,sentence,role,prev,next,speakers,targets,proc_symbolic_flag,event_phase,unit_hash,unit_dup_flag,source,date,preprocessed_text,hard_rule_keep,hard_rule_reason,policy_gate,policy_gate_reason,priority_keep,semantic_status,semantic_similarity,nli_status,nli_score,key_hit,final_status
_bfe5e68c3932,_bfe5e68c3932_u000,"行政院日前宣布全民普發現金6000元,不過,礙於立院朝野無法取得共識,恐怕要等到4月才領得到現金,遭外界諷刺開春紅包變成「清明禮金」。",context,,而各類生育補助、敬老禮金、振興獎金等補助都成為近期最夯話題。,[],[],False,,e8e96235382046f6ca007553440973e7,False,02_Ke_tvbs_news,2023-01-25 13:58:00,"行政院日前宣布全民普發現金6000元,不過,礙於立院朝野無法取得共識,恐怕要等到4月才領得到現金,遭外界諷刺開春紅包變成「清明禮金」。",True,institution_only,True,gate: core_election,False,REVIEW,0.3403255641460418,,,False,KEEP
_6075defd9a3b,_6075defd9a3b_u000,"藍白合破局後,國民黨正副總統參選人由侯友宜、趙少康組成「侯康配」,不過,國民黨新北立委候選人葉元之卻因為先前掛上的「侯柯看板」卻很尷尬,目前看板用「塗掉」的方式將民眾黨總統候選人柯文哲照片蓋過,再畫上趙少康的輪廓圖。",context,,"與此同時,「葉元之 藍白合看板」也成為google map地標,網友紛紛前往朝聖打卡,有網友留言評論寫下「分手擂台戲碼的歷史證據」、「歷史地標看一天少一天」。","[{""name"": ""侯友宜"", ""party"": ""KMT""}, {""name"": ""趙少康"", ""party"": ""KMT""}, {""name"": ""柯文哲"", ""party"": ""TPP""}, {""name"": ""國民黨"", ""party"": ""KMT""}, {""name"": ""民眾黨"", ""party"": ""TPP""}]",[],False,,09e322d71cdb244170499278c23d864f,False,02_Ke_tvbs_news,2023-11-27 15:55:00,"藍白合破局後,國民黨正副總統參選人由侯友宜、趙少康組成「侯康配」,不過,國民黨新北立委候選人葉元之卻因為先前掛上的「侯柯看板」卻很尷尬,目前看板用「塗掉」的方式將民眾黨總統候選人柯文哲照片蓋過,再畫上趙少康的輪廓圖。",True,cooccur: actor×institution,True,gate: actor×inst,False,KEEP,0.6080902814865112,,,True,KEEP
_85c147aa44cf,_85c147aa44cf_u000,"前立委黃國昌昨(16)日退出時代力量,隨即就投入民眾黨的懷抱,對此,曾是他太陽花學運夥伴的民進黨前副秘書長林飛帆直言,不感到意外,更多的是為他感到唏噓,無法想像,他與國民黨、民眾黨站在一起,倡議重啟服貿,或支持馬英九的九二共識,「對於這樣的國昌,我希望他內心能夠平靜,不為恨、失落或慾望所苦」。",claim,,黃國昌昨(16)日退出時代力量。,"[{""name"": ""民進黨"", ""party"": ""DPP""}, {""name"": ""國民黨"", ""party"": ""KMT""}, {""name"": ""民眾黨"", ""party"": ""TPP""}]",[],False,,364ad8dd61e53d7912eca97d7703527a,False,02_Ke_tvbs_news,2023-11-17 15:45:00,"前立委黃國昌昨(16)日退出時代力量,隨即就投入民眾黨的懷抱,對此,曾是他太陽花學運夥伴的民進黨前副秘書長林飛帆直言,不感到意外,更多的是為他感到唏噓,無法想像,他與國民黨、民眾黨站在一起,倡議重啟服貿,或支持馬英九的九二共識,「對於這樣的國昌,我希望他內心能夠平靜,不為恨、失落或慾望所苦」。",True,cooccur: actor×institution,True,gate: taiwanicity=2,True,KEEP,1.0,KEEP,1.0,True,KEEP
_85c147aa44cf,_85c147aa44cf_u003,"(圖/翻攝自林飛帆臉書) 2024總統大選倒數、候選人、民調分析盡在TVBS 新北耶誕城「桑塔熊回歸」必看光雕秀 活動時間、交通攻略 新北耶誕城「桑塔熊回歸」必看光雕秀 活動時間、交通攻略 點我拿《五月的35日》免費電影票,12/1起戲院見!",context,(圖/TVBS資料照) 民進黨前副秘書長林飛帆。,"點我拿《五月的35日》免費電影票,12/1起戲院見!",[],[],False,,c82cf086b3ccee84699459981f71cc54,False,02_Ke_tvbs_news,2023-11-17 15:45:00,"(圖/翻攝自林飛帆臉書) 2024總統大選倒數、候選人、民調分析盡在TVBS 新北耶誕城「桑塔熊回歸」必看光雕秀 活動時間、交通攻略 新北耶誕城「桑塔熊回歸」必看光雕秀 活動時間、交通攻略 點我拿《五月的35日》免費電影票,12/1起戲院見!",True,institution_only,True,gate: core_election,False,KEEP,0.5684065222740173,,,True,KEEP
_cc6aa3f862ce,_cc6aa3f862ce_u011,"本文所調查之結果,非參考投票、民調、網路問卷等資料,名次僅代表網路討論聲量大小,不代表網友正負評價。",context,"《KEYPO大數據關鍵引擎》輿情分析系統擁有巨量資料,以人工智慧作語意分析之工具資料蒐集範圍:每月處理1000億以上中文資料的網路社群大數據資料庫,其內容涵蓋Facebook、YouTube、新聞媒體、討論區、部落格等網站,針對討論『2023年臺灣上映電影』相關文本進行分析,並根據網友就該議題之討論,作為本分析依據。",本篇分析報告使用「KEYPO大數據關鍵引擎」輿情分析系統本文由《DailyView 網路溫度計》授權提供 DailyView 網路溫度計 2024總統大選倒數 獨家分析盡在TVBS 2023國內外10大新聞哪個議題最有感?,[],[],False,,3ad88906346482c5f7fa9321eda8c5ca,False,02_Ke_tvbs_news,2024-01-04 14:02:00,"本文所調查之結果,非參考投票、民調、網路問卷等資料,名次僅代表網路討論聲量大小,不代表網友正負評價。",True,institution_only,True,gate: core_election,False,REVIEW,0.347295194864273,,,True,KEEP
_cc6aa3f862ce,_cc6aa3f862ce_u012,本篇分析報告使用「KEYPO大數據關鍵引擎」輿情分析系統本文由《DailyView 網路溫度計》授權提供 DailyView 網路溫度計 2024總統大選倒數 獨家分析盡在TVBS 2023國內外10大新聞哪個議題最有感?,context,"本文所調查之結果,非參考投票、民調、網路問卷等資料,名次僅代表網路討論聲量大小,不代表網友正負評價。",方志友瘦身6公斤沒瘦胸 秘訣菜單曝光 👉早上空腹喝黑咖啡的真相 👉代謝出狀況?,[],[],False,,fcaa24ff4d47fbc883c00a894fd15508,False,02_Ke_tvbs_news,2024-01-04 14:02:00,本篇分析報告使用「KEYPO大數據關鍵引擎」輿情分析系統本文由《DailyView 網路溫度計》授權提供 DailyView 網路溫度計 2024總統大選倒數 獨家分析盡在TVBS 2023國內外10大新聞哪個議題最有感?,True,institution_only,True,gate: core_election,False,REVIEW,0.3372560143470764,,,True,KEEP
_06c11abf9696,_06c11abf9696_u001,"但立委就問,比照原住民,未來新住民是不是也適用?",context,"泰雅族人寶杜‧巴燕,前年申請單獨以羅馬拼音文字登記身分證姓名,被戶政事務所拒絕,他不服提行政訴訟,台北高等行政法院判戶政事務所敗訴,新北戶政事務所告知他,願意協助更改!","2024總統大選倒數、候選人、民調分析盡在TVBS 加入《TVBS娛樂頭條》官方LINE帳號,拿熱門旅宿券 加入《TVBS娛樂頭條》官方LINE帳號,拿熱門旅宿券 3種食物很營養,卻害你血糖飆升!",[],[],False,,cb7adba83640b66e694488bd74113379,False,02_Ke_tvbs_news,2023-11-09 14:44:00,"但立委就問,比照原住民,未來新住民是不是也適用?",True,institution_only,True,gate: core_election,False,KEEP,0.498196005821228,,,True,KEEP
_06c11abf9696,_06c11abf9696_u002,"2024總統大選倒數、候選人、民調分析盡在TVBS 加入《TVBS娛樂頭條》官方LINE帳號,拿熱門旅宿券 加入《TVBS娛樂頭條》官方LINE帳號,拿熱門旅宿券 3種食物很營養,卻害你血糖飆升!",context,"但立委就問,比照原住民,未來新住民是不是也適用?",糖友飲食錯觀念快丟掉 2024年12生肖財運皮夾色大公開!,[],[],False,,17daec77f365306258366ce171454716,False,02_Ke_tvbs_news,2023-11-09 14:44:00,"2024總統大選倒數、候選人、民調分析盡在TVBS 加入《TVBS娛樂頭條》官方LINE帳號,拿熱門旅宿券 加入《TVBS娛樂頭條》官方LINE帳號,拿熱門旅宿券 3種食物很營養,卻害你血糖飆升!",True,institution_only,True,gate: core_election,False,REVIEW,0.3625704646110534,,,True,KEEP
_985b5d3260f1,_985b5d3260f1_u004,"(圖/翻攝自Dcard) 2024總統大選倒數、候選人、民調分析盡在TVBS 加入《TVBS娛樂頭條》官方LINE帳號,拿熱門旅宿券 加入《TVBS娛樂頭條》官方LINE帳號,拿熱門旅宿券 年度包款100選!",context,(圖/翻攝自Dcard) 會客菜往往是重口味的食物。,蔡詩芸第一個包大推這品牌 全台洗腎人口4成有糖尿病!,[],[],False,,41b0a6fc9663cf68e569291268430f50,False,02_Ke_tvbs_news,2023-11-03 10:18:00,"(圖/翻攝自Dcard) 2024總統大選倒數、候選人、民調分析盡在TVBS 加入《TVBS娛樂頭條》官方LINE帳號,拿熱門旅宿券 加入《TVBS娛樂頭條》官方LINE帳號,拿熱門旅宿券 年度包款100選!",True,institution_only,True,gate: core_election,False,REVIEW,0.3750795722007751,,,True,KEEP
_55a3cd5aba18,_55a3cd5aba18_u006,"(圖/奇蹟製造提供) 2024總統大選倒數、候選人、民調分析盡在TVBS 加入《TVBS娛樂頭條》官方LINE帳號,拿熱門旅宿券 加入《TVBS娛樂頭條》官方LINE帳號,拿熱門旅宿券 年度包款100選!",context,"抽菸又吃檳榔「遭嫌像老鴇」 親姊悲揭傷心內幕 夏米雅分享回春水秘方,更分送給女學員們使用。",蔡詩芸第一個包大推這品牌 全台洗腎人口4成有糖尿病!,[],[],False,,d361f9ceb7ca22aa24f98f7fd8f9d444,False,02_Ke_tvbs_news,2023-11-05 14:48:00,"(圖/奇蹟製造提供) 2024總統大選倒數、候選人、民調分析盡在TVBS 加入《TVBS娛樂頭條》官方LINE帳號,拿熱門旅宿券 加入《TVBS娛樂頭條》官方LINE帳號,拿熱門旅宿券 年度包款100選!",True,institution_only,True,gate: core_election,False,REVIEW,0.3664450049400329,,,True,KEEP
_47bc66deefdf,_47bc66deefdf_u002,"台灣參加國際漫畫盛事安古蘭漫畫節逾10年,已累積出口碑與讀者市場,無論從展館開幕人潮、稍早台灣4組漫畫家舉行現場簽繪活動民眾熱烈參與情況,或從許多讀者不斷詢問可否直接購買展示作品都可見端倪。",context,"安古蘭作者之家代表指出,台漫豐富、具想像力與大膽圖像,所以會被廣泛翻譯出版。",快加TVBS娛樂頭條好友!,[],[],False,,7c6e823ac7b3ecc9cbb22bf136c011bc,False,02_Ke_tvbs_news,2023-01-27 10:43:00,"台灣參加國際漫畫盛事安古蘭漫畫節逾10年,已累積出口碑與讀者市場,無論從展館開幕人潮、稍早台灣4組漫畫家舉行現場簽繪活動民眾熱烈參與情況,或從許多讀者不斷詢問可否直接購買展示作品都可見端倪。",True,institution_only,True,gate: 2 inst terms,False,REVIEW,0.2824508547782898,,,False,KEEP
_92a021e794cb,_92a021e794cb_u000,"民眾黨總統參選人柯文哲在15日與國民黨代表協商之後,終於點頭同意「藍白合」,但卻引發民眾黨幕僚與支持者的不滿。",claim,,"對此,柯文哲也流下男兒淚,昨晚在臉書上發布一影片,稱很多人都在等他的解釋,並談到曾看到支持者說過最感動的一句話是「只要阿北不放棄,我們就不會放棄」,他說,現在自己要反過來拜託支持者,「只要你們不放棄,我就不放棄」,言談中數度哽咽並落淚。","[{""name"": ""柯文哲"", ""party"": ""TPP""}, {""name"": ""國民黨"", ""party"": ""KMT""}, {""name"": ""民眾黨"", ""party"": ""TPP""}]",[],True,legislative,27c82a0efc235903f335148bdbd7a989,False,02_Ke_tvbs_news,2023-11-17 11:22:00,"民眾黨總統參選人柯文哲在15日與國民黨代表協商之後,終於點頭同意「藍白合」,但卻引發民眾黨幕僚與支持者的不滿。",True,cooccur: actor×institution,True,gate: actor×inst,False,KEEP,0.5517829656600952,,,True,KEEP
_92a021e794cb,_92a021e794cb_u002,"柯文哲表示,知道15日很多人都沒有睡好,抱歉讓大家擔心,也知道很多人都在等他的解釋,「為什麼突然有這樣的轉折,突然答應了藍白整合?」他說,這兩週自己開始環台、全台開講,傾聽大家的心聲,發現大家對於台灣的經濟、台海和平、台灣的未來非常不安,很多人都一直跟他說,無論如何一定要讓2024政黨輪替,並提到與台南市議會與7個無黨籍的議員會面,好幾位議員都告訴他「我們現在跟你照相,如果你沒選贏,我們選後都會被人家清算」,感嘆民進黨怎麼會變成這樣肅殺對立?",claim,"對此,柯文哲也流下男兒淚,昨晚在臉書上發布一影片,稱很多人都在等他的解釋,並談到曾看到支持者說過最感動的一句話是「只要阿北不放棄,我們就不會放棄」,他說,現在自己要反過來拜託支持者,「只要你們不放棄,我就不放棄」,言談中數度哽咽並落淚。",讓他們繼續執政怎麼辦?,"[{""name"": ""柯文哲"", ""party"": ""TPP""}, {""name"": ""民進黨"", ""party"": ""DPP""}]",[],False,,57641ff321391489a8ec452c2421c31a,False,02_Ke_tvbs_news,2023-11-17 11:22:00,"柯文哲表示,知道15日很多人都沒有睡好,抱歉讓大家擔心,也知道很多人都在等他的解釋,「為什麼突然有這樣的轉折,突然答應了藍白整合?」他說,這兩週自己開始環台、全台開講,傾聽大家的心聲,發現大家對於台灣的經濟、台海和平、台灣的未來非常不安,很多人都一直跟他說,無論如何一定要讓2024政黨輪替,並提到與台南市議會與7個無黨籍的議員會面,好幾位議員都告訴他「我們現在跟你照相,如果你沒選贏,我們選後都會被人家清算」,感嘆民進黨怎麼會變成這樣肅殺對立?",True,cooccur: actor×institution,True,gate: taiwanicity=2,True,KEEP,1.0,KEEP,1.0,True,KEEP
_92a021e794cb,_92a021e794cb_u006,"(圖/柯文哲臉書) 2024總統大選倒數、候選人、民調分析盡在TVBS 點我拿《五月的35日》免費電影票,12/1起戲院見!",context,民眾黨主席柯文哲落淚。,"點我拿《五月的35日》免費電影票,12/1起戲院見!","[{""name"": ""柯文哲"", ""party"": ""TPP""}]",[],False,,eb28ee577403afacda78e1fa1e9d1c50,False,02_Ke_tvbs_news,2023-11-17 11:22:00,"(圖/柯文哲臉書) 2024總統大選倒數、候選人、民調分析盡在TVBS 點我拿《五月的35日》免費電影票,12/1起戲院見!",True,cooccur: actor×institution,True,gate: actor×inst,False,KEEP,0.4815274477005005,,,True,KEEP
_f84cb1e034a2,_f84cb1e034a2_u000,"距離總統大選僅剩大約五個月時間,民進黨總統參選人賴清德在多數民調中保持穩定領先,不過,民眾黨台北市議員林珍羽對此表示,現在所有人開始攻賴清德的本命區,即便府院黨、媒體要護航,問題也擋不下來,如此賴清德可能無法穩坐他目前的35%支持度了。",claim,,民進黨總統參選人賴清德。,"[{""name"": ""賴清德"", ""party"": ""DPP""}, {""name"": ""民進黨"", ""party"": ""DPP""}, {""name"": ""民眾黨"", ""party"": ""TPP""}]",[],False,,fe7d8b8046a6667f14637ed1c5e7b74b,False,02_Ke_tvbs_news,2023-08-11 11:14:00,"距離總統大選僅剩大約五個月時間,民進黨總統參選人賴清德在多數民調中保持穩定領先,不過,民眾黨台北市議員林珍羽對此表示,現在所有人開始攻賴清德的本命區,即便府院黨、媒體要護航,問題也擋不下來,如此賴清德可能無法穩坐他目前的35%支持度了。",True,cooccur: actor×institution,True,gate: actor×inst,False,KEEP,0.7343431711196899,,,True,KEEP
_f84cb1e034a2,_f84cb1e034a2_u001,民進黨總統參選人賴清德。,context,"距離總統大選僅剩大約五個月時間,民進黨總統參選人賴清德在多數民調中保持穩定領先,不過,民眾黨台北市議員林珍羽對此表示,現在所有人開始攻賴清德的本命區,即便府院黨、媒體要護航,問題也擋不下來,如此賴清德可能無法穩坐他目前的35%支持度了。",(圖/賴清德辦公室提供) 民進黨總統參選人賴清德。,"[{""name"": ""賴清德"", ""party"": ""DPP""}, {""name"": ""民進黨"", ""party"": ""DPP""}]",[],False,,6f57e14b255645d4180a78b0f727e43c,False,02_Ke_tvbs_news,2023-08-11 11:14:00,民進黨總統參選人賴清德。,True,cooccur: actor×institution,True,gate: actor×inst,False,KEEP,0.6214776039123535,,,True,KEEP
_f84cb1e034a2,_f84cb1e034a2_u002,(圖/賴清德辦公室提供) 民進黨總統參選人賴清德。,context,民進黨總統參選人賴清德。,(圖/TVBS) 每晚6-10點主播陪你互動聊天!,"[{""name"": ""賴清德"", ""party"": ""DPP""}, {""name"": ""民進黨"", ""party"": ""DPP""}]",[],False,,7c030a15d8807ad63b9d6e18272138db,False,02_Ke_tvbs_news,2023-08-11 11:14:00,(圖/賴清德辦公室提供) 民進黨總統參選人賴清德。,True,cooccur: actor×institution,True,gate: actor×inst,False,KEEP,0.6651666164398193,,,True,KEEP
_a8157b5df691,_a8157b5df691_u000,"民眾黨總統參選人柯文哲昨(6)日自爆「內心本質還是深綠的」,並表示外交上會依循總統蔡英文的外交路線,不過在兩岸關係上會比較表達和善。",claim,,被問是否會因此噴柯?,"[{""name"": ""柯文哲"", ""party"": ""TPP""}, {""name"": ""民眾黨"", ""party"": ""TPP""}]","[""兩岸|cross-strait""]",False,,19a6bbf6d05efe615b8ea777ccfee18a,False,02_Ke_tvbs_news,2023-12-07 15:59:00,"民眾黨總統參選人柯文哲昨(6)日自爆「內心本質還是深綠的」,並表示外交上會依循總統蔡英文的外交路線,不過在兩岸關係上會比較表達和善。",True,cooccur: actor×institution,True,gate: actor×inst,False,KEEP,0.5572843551635742,,,True,KEEP
_a8157b5df691,_a8157b5df691_u002,"民眾黨不分區立委參選人黃國昌回應,沒那麼在意柯內心是什麼顏色,只在意能否好好解決台灣內政問題,喊話都生活在這塊土地,不要再用過去意識形態繼續撕裂社會,「不要永遠你自己就是親中愛台,別人就是親中舔共。」黃國昌今(7)日召開「請賴清德誠實面對 別一再說謊」記者會,揭露民進黨總統參選人賴清德的萬里建物根本不是「老家改建」,而是在2003年新建的全新貳層建物,新建時賴清德已是立法委員,當時的台北縣長則為前行政院長蘇貞昌,且賴清德從未誠實申報,違反《公職人員產申報法》,從未繳納「房屋稅」,卻向社會謊稱有繳房屋稅,逃稅長達20年。",claim,被問是否會因此噴柯?,黃國昌今(7)日召開「請賴清德誠實面對 別一再說謊」記者會。,"[{""name"": ""賴清德"", ""party"": ""DPP""}, {""name"": ""民進黨"", ""party"": ""DPP""}, {""name"": ""民眾黨"", ""party"": ""TPP""}]",[],False,,8595128bac479fa2d648eafa1d71a7f4,False,02_Ke_tvbs_news,2023-12-07 15:59:00,"民眾黨不分區立委參選人黃國昌回應,沒那麼在意柯內心是什麼顏色,只在意能否好好解決台灣內政問題,喊話都生活在這塊土地,不要再用過去意識形態繼續撕裂社會,「不要永遠你自己就是親中愛台,別人就是親中舔共。」黃國昌今(7)日召開「請賴清德誠實面對 別一再說謊」記者會,揭露民進黨總統參選人賴清德的萬里建物根本不是「老家改建」,而是在2003年新建的全新貳層建物,新建時賴清德已是立法委員,當時的台北縣長則為前行政院長蘇貞昌,且賴清德從未誠實申報,違反《公職人員產申報法》,從未繳納「房屋稅」,卻向社會謊稱有繳房屋稅,逃稅長達20年。",True,cooccur: actor×institution,True,gate: taiwanicity=3,True,KEEP,1.0,KEEP,1.0,True,KEEP
_a8157b5df691,_a8157b5df691_u006,(圖/陳昫蓁攝) 更多新聞:專訪/黃國昌「挺韓國瑜爭立法院長」?,context,(圖/翻攝自黃國昌臉書) 更多新聞:不避諱「深綠出身背景」 柯文哲:病人送急診難道問藍綠 黃國昌今(7)日召開「請賴清德誠實面對 別一再說謊」記者會。,"柯文哲給答案 2024總統大選倒數、候選人、民調分析盡在TVBS 新北耶誕城「桑塔熊回歸」必看光雕秀 活動時間、交通攻略 新北耶誕城「桑塔熊回歸」必看光雕秀 活動時間、交通攻略 快來下載TVBS新聞APP,天天打卡抽咖啡 2024十二生肖運勢搶先看 「這生肖」把握前途無量的一年 👉早上空腹喝黑咖啡的真相 👉代謝出狀況?",[],"[""立法院|institution""]",False,,708e8b6a2ae156b61e6ccde410ad3eaa,False,02_Ke_tvbs_news,2023-12-07 15:59:00,(圖/陳昫蓁攝) 更多新聞:專訪/黃國昌「挺韓國瑜爭立法院長」?,True,institution_only,True,gate: core_election,True,KEEP,1.0,KEEP,1.0,True,KEEP
_a8157b5df691,_a8157b5df691_u007,"柯文哲給答案 2024總統大選倒數、候選人、民調分析盡在TVBS 新北耶誕城「桑塔熊回歸」必看光雕秀 活動時間、交通攻略 新北耶誕城「桑塔熊回歸」必看光雕秀 活動時間、交通攻略 快來下載TVBS新聞APP,天天打卡抽咖啡 2024十二生肖運勢搶先看 「這生肖」把握前途無量的一年 👉早上空腹喝黑咖啡的真相 👉代謝出狀況?",context,(圖/陳昫蓁攝) 更多新聞:專訪/黃國昌「挺韓國瑜爭立法院長」?,你吃的可能是關鍵!,"[{""name"": ""柯文哲"", ""party"": ""TPP""}]",[],False,,dd12a876454f342010b18a139c325a54,False,02_Ke_tvbs_news,2023-12-07 15:59:00,"柯文哲給答案 2024總統大選倒數、候選人、民調分析盡在TVBS 新北耶誕城「桑塔熊回歸」必看光雕秀 活動時間、交通攻略 新北耶誕城「桑塔熊回歸」必看光雕秀 活動時間、交通攻略 快來下載TVBS新聞APP,天天打卡抽咖啡 2024十二生肖運勢搶先看 「這生肖」把握前途無量的一年 👉早上空腹喝黑咖啡的真相 👉代謝出狀況?",True,cooccur: actor×institution,True,gate: actor×inst,False,KEEP,0.6060335636138916,,,True,KEEP
_0449938948f6,_0449938948f6_u000,"距離2024立委選舉僅剩不到7個月的時間,民進黨、國民黨都力拚國會單獨過半,民眾黨則希望扮演關鍵少數席次。",context,,"其中,在台北市部分,目前仍是綠、藍兩大陣營的廝殺,現行綠藍陣營席次4比4,包含綠營的士林北投立委吳思瑤、內湖南港立委高嘉瑜、藍營的中山北松山立委王鴻薇、文山南中正區立委賴士葆都要力拚連任,另士林大同、中正萬華、大安、松山信義立委則確定換人當,且目前仍看不出哪一陣營較有優勢。","[{""name"": ""民進黨"", ""party"": ""DPP""}, {""name"": ""國民黨"", ""party"": ""KMT""}, {""name"": ""民眾黨"", ""party"": ""TPP""}]",[],False,,0cf93e38721169a1332619df2e6cb39b,False,02_Ke_tvbs_news,2023-06-23 10:39:00,"距離2024立委選舉僅剩不到7個月的時間,民進黨、國民黨都力拚國會單獨過半,民眾黨則希望扮演關鍵少數席次。",True,cooccur: actor×institution,True,gate: actor×inst,True,KEEP,1.0,KEEP,1.0,True,KEEP
_0449938948f6,_0449938948f6_u001,"其中,在台北市部分,目前仍是綠、藍兩大陣營的廝殺,現行綠藍陣營席次4比4,包含綠營的士林北投立委吳思瑤、內湖南港立委高嘉瑜、藍營的中山北松山立委王鴻薇、文山南中正區立委賴士葆都要力拚連任,另士林大同、中正萬華、大安、松山信義立委則確定換人當,且目前仍看不出哪一陣營較有優勢。",context,"距離2024立委選舉僅剩不到7個月的時間,民進黨、國民黨都力拚國會單獨過半,民眾黨則希望扮演關鍵少數席次。",吳思瑤拚連任。,"[{""name"": ""綠營"", ""party"": ""DPP""}, {""name"": ""藍營"", ""party"": ""KMT""}]",[],False,,7e1bd6b0997260e5071806966db918bf,False,02_Ke_tvbs_news,2023-06-23 10:39:00,"其中,在台北市部分,目前仍是綠、藍兩大陣營的廝殺,現行綠藍陣營席次4比4,包含綠營的士林北投立委吳思瑤、內湖南港立委高嘉瑜、藍營的中山北松山立委王鴻薇、文山南中正區立委賴士葆都要力拚連任,另士林大同、中正萬華、大安、松山信義立委則確定換人當,且目前仍看不出哪一陣營較有優勢。",True,cooccur: actor×institution,True,gate: actor×inst,True,KEEP,1.0,KEEP,1.0,True,KEEP
_0449938948f6,_0449938948f6_u004,(圖/TVBS) 吳沛憶參選中正萬華立委。,context,(圖/翻攝自吳思瑤臉書) 王鴻薇力拚連任。,(圖/TVBS) 徐巧芯參選松山信義立委。,[],[],False,,3f883a847c846b2aa02ae565b4733805,False,02_Ke_tvbs_news,2023-06-23 10:39:00,(圖/TVBS) 吳沛憶參選中正萬華立委。,True,institution_only,True,gate: core_election,False,KEEP,0.5661484003067017,,,True,KEEP
_0449938948f6,_0449938948f6_u005,(圖/TVBS) 徐巧芯參選松山信義立委。,context,(圖/TVBS) 吳沛憶參選中正萬華立委。,(圖/TVBS) 【重點消息】話題時事不漏接!,[],[],False,,d8b62e413c0907da881d269ee346c8be,False,02_Ke_tvbs_news,2023-06-23 10:39:00,(圖/TVBS) 徐巧芯參選松山信義立委。,True,institution_only,True,gate: core_election,False,KEEP,0.4738587737083435,,,True,KEEP
_65ada5943934,_65ada5943934_u000,"大陸人氣直播主馮提莫翻唱歌曲〈學貓叫〉爆紅兩岸,嗓音和外型都甜美的她,也被譽為「大陸第一網紅」。",context,,"她自爆去年12月罹患甲狀腺癌晚期,直播停擺的期間都在抗癌,目前已大幅好轉。",[],"[""兩岸|cross-strait""]",False,,e6c0402cd5d91e01e9cdf968aac5c9cf,False,02_Ke_tvbs_news,2023-08-13 12:12:00,"大陸人氣直播主馮提莫翻唱歌曲〈學貓叫〉爆紅兩岸,嗓音和外型都甜美的她,也被譽為「大陸第一網紅」。",True,institution_only,True,gate: strong_anchor,False,REVIEW,0.2117607295513153,,,True,KEEP
