doc_id,unit_id,sentence,role,prev,next,speakers,targets,proc_symbolic_flag,event_phase,unit_hash,unit_dup_flag,source,date,preprocessed_text,hard_rule_keep,hard_rule_reason,policy_gate,policy_gate_reason,priority_keep,semantic_status,semantic_similarity,nli_status,nli_score,key_hit,final_status
_a1bd0a1bdcc6,_a1bd0a1bdcc6_u005,"(圖/TVBS) 原時段,每週一至週五晚間,仍有18:00-19:00《TVBS1800儀點靈》 《TVBS1800儀點靈》每週一到週五晚上6點至7點,快速整理每天最新話題與新聞,還有兩岸最新動態,都能透過簡單易懂的方式,和網友、觀眾聊時事,掌握天下事。",context,"每週一到週五晚間10點到11點,由主播彭志宇引領觀眾,了解最新的熱話題。","《TVBS1800儀點靈》由主播王馨儀,帶您每日新聞不漏接,一點就靈。",[],"[""兩岸|cross-strait""]",False,,c5e954fb108d423644f11b5bac9dbff9,False,02_Ke_tvbs_news,2023-11-20 11:00:00,"(圖/TVBS) 原時段,每週一至週五晚間,仍有18:00-19:00《TVBS1800儀點靈》 《TVBS1800儀點靈》每週一到週五晚上6點至7點,快速整理每天最新話題與新聞,還有兩岸最新動態,都能透過簡單易懂的方式,和網友、觀眾聊時事,掌握天下事。",True,institution_only,True,gate: strong_anchor,False,DROP,0.1127926856279373,DROP,-0.0108819007873535,True,KEEP
_a1bd0a1bdcc6,_a1bd0a1bdcc6_u014,2024總統大選倒數、候選人、民調分析盡在TVBS 新北耶誕城「桑塔熊回歸」必看光雕秀 活動時間、交通攻略 新北耶誕城「桑塔熊回歸」必看光雕秀 活動時間、交通攻略 《黃金露戰隊》看達人車宿攻略 再抽露營周邊好禮!,context,"週一至週五晚間9點至10點,讓《TVBS看世界》主播彭志宇帶您解讀新世界。",《黃金露戰隊》看達人車宿攻略 再抽露營周邊好禮!,[],[],False,,73dfa57626e0ebee296d5311605d89bf,False,02_Ke_tvbs_news,2023-11-20 11:00:00,2024總統大選倒數、候選人、民調分析盡在TVBS 新北耶誕城「桑塔熊回歸」必看光雕秀 活動時間、交通攻略 新北耶誕城「桑塔熊回歸」必看光雕秀 活動時間、交通攻略 《黃金露戰隊》看達人車宿攻略 再抽露營周邊好禮!,True,institution_only,True,gate: core_election,False,KEEP,0.5405710339546204,,,True,KEEP
_f91edb66005c,_f91edb66005c_u008,(圖/TVBS) 2024總統大選倒數、候選人、民調分析盡在TVBS 新北耶誕城「桑塔熊回歸」必看光雕秀 活動時間、交通攻略 新北耶誕城「桑塔熊回歸」必看光雕秀 活動時間、交通攻略 2023大阪最熱逛街聖地!,context,"約會專家「揭6點」打預防針:快找下一個 鄉民嘆,今年漲價漲很厲害。",環球必玩5攻略 👉早上空腹喝黑咖啡的真相 👉代謝出狀況?,[],[],False,,b71cb8f69a2541067a52270e393b2b07,False,02_Ke_tvbs_news,2023-11-19 23:02:00,(圖/TVBS) 2024總統大選倒數、候選人、民調分析盡在TVBS 新北耶誕城「桑塔熊回歸」必看光雕秀 活動時間、交通攻略 新北耶誕城「桑塔熊回歸」必看光雕秀 活動時間、交通攻略 2023大阪最熱逛街聖地!,True,institution_only,True,gate: core_election,False,KEEP,0.5376242995262146,,,True,KEEP
_635cdc7c0f92,_635cdc7c0f92_u000,"民進黨創黨黨員、前立委鄭寶清5日爆震撼彈,證實已申請加入民眾黨。",context,,"今(8)日民眾黨於萬華舉辦廟口開講,另一名民進黨創黨元老許國泰也出席力挺,致詞時砲轟「台灣所有下一代被民進黨害死」,痛批民進黨專用私人,貪污腐化讓自己人賺錢,並稱讚民眾黨總統參選人柯文哲禮賢下士,高喊「要相信柯文哲,還是民進黨貪污腐化私人團隊?」 前民進黨立委鄭寶清。","[{""name"": ""民進黨"", ""party"": ""DPP""}, {""name"": ""民眾黨"", ""party"": ""TPP""}]",[],False,,c047068a619134e02e98361cf401eaeb,False,02_Ke_tvbs_news,2023-10-08 20:57:00,"民進黨創黨黨員、前立委鄭寶清5日爆震撼彈,證實已申請加入民眾黨。",True,cooccur: actor×institution,True,gate: actor×inst,False,KEEP,0.5059407949447632,,,True,KEEP
_635cdc7c0f92,_635cdc7c0f92_u001,"今(8)日民眾黨於萬華舉辦廟口開講,另一名民進黨創黨元老許國泰也出席力挺,致詞時砲轟「台灣所有下一代被民進黨害死」,痛批民進黨專用私人,貪污腐化讓自己人賺錢,並稱讚民眾黨總統參選人柯文哲禮賢下士,高喊「要相信柯文哲,還是民進黨貪污腐化私人團隊?」 前民進黨立委鄭寶清。",claim,"民進黨創黨黨員、前立委鄭寶清5日爆震撼彈,證實已申請加入民眾黨。",(圖/TVBS資料畫面) 許國泰怒轟台灣所有下一代被民進黨害死。,"[{""name"": ""柯文哲"", ""party"": ""TPP""}, {""name"": ""民進黨"", ""party"": ""DPP""}, {""name"": ""民眾黨"", ""party"": ""TPP""}]",[],False,,acbc2fe2b5ee5ac2a25a5c309bd0941a,False,02_Ke_tvbs_news,2023-10-08 20:57:00,"今(8)日民眾黨於萬華舉辦廟口開講,另一名民進黨創黨元老許國泰也出席力挺,致詞時砲轟「台灣所有下一代被民進黨害死」,痛批民進黨專用私人,貪污腐化讓自己人賺錢,並稱讚民眾黨總統參選人柯文哲禮賢下士,高喊「要相信柯文哲,還是民進黨貪污腐化私人團隊?」 前民進黨立委鄭寶清。",True,cooccur: actor×institution,True,gate: taiwanicity=2,True,KEEP,1.0,KEEP,1.0,True,KEEP
_e20d6fb1144d,_e20d6fb1144d_u000,"國民黨總統參選人侯友宜的訪美之旅落幕,此行8天走訪4城市,不只拜會AIT主席羅森伯格,紐約及華府智庫專家學者,還密會美國前官員、參眾議員,獲得美方正面評價,除了事前準備充足,其實還有一位幕後功臣,就是「總統級」的資深翻譯陳珮馨。",context,,"她曾任前總統馬英九的專屬翻譯官,接待過大大小小的外賓,這次向美方精準傳達侯友宜的論述,替不諳英文的侯友宜加分不少。","[{""name"": ""侯友宜"", ""party"": ""KMT""}, {""name"": ""國民黨"", ""party"": ""KMT""}]",[],False,,db330a38131d1807abcaa8db4080fcea,False,02_Ke_tvbs_news,2023-10-01 12:59:00,"國民黨總統參選人侯友宜的訪美之旅落幕,此行8天走訪4城市,不只拜會AIT主席羅森伯格,紐約及華府智庫專家學者,還密會美國前官員、參眾議員,獲得美方正面評價,除了事前準備充足,其實還有一位幕後功臣,就是「總統級」的資深翻譯陳珮馨。",True,cooccur: actor×institution,True,gate: actor×inst,False,KEEP,0.5913608074188232,,,True,KEEP
_e20d6fb1144d,_e20d6fb1144d_u001,"她曾任前總統馬英九的專屬翻譯官,接待過大大小小的外賓,這次向美方精準傳達侯友宜的論述,替不諳英文的侯友宜加分不少。",context,"國民黨總統參選人侯友宜的訪美之旅落幕,此行8天走訪4城市,不只拜會AIT主席羅森伯格,紐約及華府智庫專家學者,還密會美國前官員、參眾議員,獲得美方正面評價,除了事前準備充足,其實還有一位幕後功臣,就是「總統級」的資深翻譯陳珮馨。","資深翻譯陳珮馨蹲坐在侯友宜、AIT主席羅森伯格之間,當起重要的溝通橋樑。","[{""name"": ""侯友宜"", ""party"": ""KMT""}]",[],False,,87c45036d2553c2690923d9d3a6ebd15,False,02_Ke_tvbs_news,2023-10-01 12:59:00,"她曾任前總統馬英九的專屬翻譯官,接待過大大小小的外賓,這次向美方精準傳達侯友宜的論述,替不諳英文的侯友宜加分不少。",True,cooccur: actor×institution,True,gate: actor×inst,False,REVIEW,0.4064869880676269,,,True,KEEP
_11b8112afb4e,_11b8112afb4e_u006,(圖/翻攝自PTT) 更多新聞:報導屠殺嬰兒被疑造假 以色列記者:我「真希望」不是真的 報導屠殺嬰兒被疑造假 以色列記者:我「真希望」不是真的 2024總統大選倒數、候選人、民調分析盡在TVBS 維持體態不費力!,context,她飯店巧遇「神秘金鑰匙」 解鎖1隱藏服務嗨翻 許多網友都表示拿坡里烤雞比炸雞好吃。,41歲王心凌:掌握2個8分原則 維持體態不費力!,[],[],False,,c185024cd284bc833a51165c6f6b3c9d,False,02_Ke_tvbs_news,2023-10-12 15:47:00,(圖/翻攝自PTT) 更多新聞:報導屠殺嬰兒被疑造假 以色列記者:我「真希望」不是真的 報導屠殺嬰兒被疑造假 以色列記者:我「真希望」不是真的 2024總統大選倒數、候選人、民調分析盡在TVBS 維持體態不費力!,True,institution_only,True,gate: core_election,False,KEEP,0.497783362865448,,,True,KEEP
_836e0e76006b,_836e0e76006b_u000,"2024總統大選將在2024年1月13日登場,國民黨、民進黨、民眾黨三組候選人,分別就經濟、勞動、兩岸、生育、教育、能源、住宅、長照等重大議題提出政見,究竟對台灣有那些願景與政見細節,《TVBS新聞網》帶您一次瞭解。",context,,※第三場 3總統候選人勞動相關政策。,"[{""name"": ""民進黨"", ""party"": ""DPP""}, {""name"": ""國民黨"", ""party"": ""KMT""}, {""name"": ""民眾黨"", ""party"": ""TPP""}]","[""兩岸|cross-strait""]",False,debate/manifesto,a7e2c828d01efe7cf95c2ba90308ce9d,False,02_Ke_tvbs_news,2024-01-12 10:42:00,"2024總統大選將在2024年1月13日登場,國民黨、民進黨、民眾黨三組候選人,分別就經濟、勞動、兩岸、生育、教育、能源、住宅、長照等重大議題提出政見,究竟對台灣有那些願景與政見細節,《TVBS新聞網》帶您一次瞭解。",True,cooccur: actor×institution,True,gate: taiwanicity=3,True,KEEP,1.0,KEEP,1.0,True,KEEP
_836e0e76006b,_836e0e76006b_u001,※第三場 3總統候選人勞動相關政策。,context,"2024總統大選將在2024年1月13日登場,國民黨、民進黨、民眾黨三組候選人,分別就經濟、勞動、兩岸、生育、教育、能源、住宅、長照等重大議題提出政見,究竟對台灣有那些願景與政見細節,《TVBS新聞網》帶您一次瞭解。",(圖/TVBS) 3總統候選人健保醫療政策。,[],[],False,,d751ba0574a532e87d8c5b325441e382,False,02_Ke_tvbs_news,2024-01-12 10:42:00,※第三場 3總統候選人勞動相關政策。,True,institution_only,True,gate: core_election,False,REVIEW,0.4143182635307312,,,True,KEEP
_836e0e76006b,_836e0e76006b_u002,(圖/TVBS) 3總統候選人健保醫療政策。,context,※第三場 3總統候選人勞動相關政策。,(圖/TVBS) 3總統候選人長照政策。,[],[],False,,a7403cf181913393764807295e2fef02,False,02_Ke_tvbs_news,2024-01-12 10:42:00,(圖/TVBS) 3總統候選人健保醫療政策。,True,institution_only,True,gate: taiwanicity=2,True,KEEP,1.0,KEEP,1.0,True,KEEP
_836e0e76006b,_836e0e76006b_u003,(圖/TVBS) 3總統候選人長照政策。,context,(圖/TVBS) 3總統候選人健保醫療政策。,(圖/TVBS) 守護勞工七件事:●勞工加薪、企業減稅●守護弱勢、減低賦稅●增加休假天數、勞動尊嚴再升級●力保勞保基金、永續發展●興建勞工宅●保障非典型勞工權益●修訂勞動三法、勞權加碼治安(新北校園割頸案) 校園暴力「零容忍」四大主張:●參照日韓修法、加強安檢、教育預防懲戒輔導,[],[],False,,81a4f05067ef5744daec8c642e353d7a,False,02_Ke_tvbs_news,2024-01-12 10:42:00,(圖/TVBS) 3總統候選人長照政策。,True,institution_only,True,gate: core_election,False,KEEP,0.5408719182014465,,,True,KEEP
_836e0e76006b,_836e0e76006b_u004,(圖/TVBS) 守護勞工七件事:●勞工加薪、企業減稅●守護弱勢、減低賦稅●增加休假天數、勞動尊嚴再升級●力保勞保基金、永續發展●興建勞工宅●保障非典型勞工權益●修訂勞動三法、勞權加碼治安(新北校園割頸案) 校園暴力「零容忍」四大主張:●參照日韓修法、加強安檢、教育預防懲戒輔導,claim,(圖/TVBS) 3總統候選人長照政策。,"以及黑幫入侵加重刑責​​​​●將《少年事件處理法》修法,下修重大犯罪的刑事處分年齡下限,從現行16歲降至14歲●黑幫入侵校園加重其刑可至2分之1●校園霸凌當作犯罪行為看待,與當地警方合作,積極面對、提供支援加強預防 三位候選人在最終場政見發表會都提及了新北校園割頸案。",[],[],False,,8c1231e49a7fb464f0e5c6a628a2ba43,False,02_Ke_tvbs_news,2024-01-12 10:42:00,(圖/TVBS) 守護勞工七件事:●勞工加薪、企業減稅●守護弱勢、減低賦稅●增加休假天數、勞動尊嚴再升級●力保勞保基金、永續發展●興建勞工宅●保障非典型勞工權益●修訂勞動三法、勞權加碼治安(新北校園割頸案) 校園暴力「零容忍」四大主張:●參照日韓修法、加強安檢、教育預防懲戒輔導,True,institution_only,True,gate: 5 inst terms,False,REVIEW,0.3319141864776611,,,False,KEEP
_836e0e76006b,_836e0e76006b_u005,"以及黑幫入侵加重刑責​​​​●將《少年事件處理法》修法,下修重大犯罪的刑事處分年齡下限,從現行16歲降至14歲●黑幫入侵校園加重其刑可至2分之1●校園霸凌當作犯罪行為看待,與當地警方合作,積極面對、提供支援加強預防 三位候選人在最終場政見發表會都提及了新北校園割頸案。",claim,(圖/TVBS) 守護勞工七件事:●勞工加薪、企業減稅●守護弱勢、減低賦稅●增加休假天數、勞動尊嚴再升級●力保勞保基金、永續發展●興建勞工宅●保障非典型勞工權益●修訂勞動三法、勞權加碼治安(新北校園割頸案) 校園暴力「零容忍」四大主張:●參照日韓修法、加強安檢、教育預防懲戒輔導,(圖/TVBS) 3總統候選人經濟發展政策。,[],"[""政見發表會|procedure""]",True,debate/manifesto,50d699defb6ba763d77c06082a300a6f,False,02_Ke_tvbs_news,2024-01-12 10:42:00,"以及黑幫入侵加重刑責​​​​●將《少年事件處理法》修法,下修重大犯罪的刑事處分年齡下限,從現行16歲降至14歲●黑幫入侵校園加重其刑可至2分之1●校園霸凌當作犯罪行為看待,與當地警方合作,積極面對、提供支援加強預防 三位候選人在最終場政見發表會都提及了新北校園割頸案。",True,institution_only,True,gate: core_election,True,KEEP,1.0,KEEP,1.0,True,KEEP
_836e0e76006b,_836e0e76006b_u006,(圖/TVBS) 3總統候選人經濟發展政策。,context,"以及黑幫入侵加重刑責​​​​●將《少年事件處理法》修法,下修重大犯罪的刑事處分年齡下限,從現行16歲降至14歲●黑幫入侵校園加重其刑可至2分之1●校園霸凌當作犯罪行為看待,與當地警方合作,積極面對、提供支援加強預防 三位候選人在最終場政見發表會都提及了新北校園割頸案。","(圖/TVBS) 針對新北校園割喉案,提出以下改革措施:●未來將落實「社會安全網2.0」●修改學生輔導法,讓學生及早了解心理諮商※第二場2024總統候選人第二場電視政見發表會於12月26日下午2時登場,民眾黨總統候選人柯文哲、民進黨總統候選人賴清德、國民黨總統候選人侯友宜將再度交鋒,抽籤順序,依序為柯文哲、侯友宜、賴清德柯文哲第一輪政見發表教育主張12+1義務教育、建立多元管道來健全雙語師資,包括教師聯合甄選、外籍師資徵選等。",[],[],False,,fb1b4e000294b1f204bc091a81ea7b47,False,02_Ke_tvbs_news,2024-01-12 10:42:00,(圖/TVBS) 3總統候選人經濟發展政策。,True,institution_only,True,gate: core_election,False,KEEP,0.4986422657966614,,,True,KEEP
_836e0e76006b,_836e0e76006b_u007,"(圖/TVBS) 針對新北校園割喉案,提出以下改革措施:●未來將落實「社會安全網2.0」●修改學生輔導法,讓學生及早了解心理諮商※第二場2024總統候選人第二場電視政見發表會於12月26日下午2時登場,民眾黨總統候選人柯文哲、民進黨總統候選人賴清德、國民黨總統候選人侯友宜將再度交鋒,抽籤順序,依序為柯文哲、侯友宜、賴清德柯文哲第一輪政見發表教育主張12+1義務教育、建立多元管道來健全雙語師資,包括教師聯合甄選、外籍師資徵選等。",claim,(圖/TVBS) 3總統候選人經濟發展政策。,"柯文哲怒批民進黨執政以意識形態介入教育,更用「卡管」讓台大2年沒有校長,搞掉3個教育部長,更有許多論文抄襲者升官、若無其事,是品德教育的最差示範。","[{""name"": ""賴清德"", ""party"": ""DPP""}, {""name"": ""侯友宜"", ""party"": ""KMT""}, {""name"": ""柯文哲"", ""party"": ""TPP""}, {""name"": ""民進黨"", ""party"": ""DPP""}, {""name"": ""國民黨"", ""party"": ""KMT""}, {""name"": ""民眾黨"", ""party"": ""TPP""}]","[""政見發表會|procedure""]",True,debate/manifesto,7c8ca1d1ccae306830d12bda85d749c9,False,02_Ke_tvbs_news,2024-01-12 10:42:00,"(圖/TVBS) 針對新北校園割喉案,提出以下改革措施:●未來將落實「社會安全網2.0」●修改學生輔導法,讓學生及早了解心理諮商※第二場2024總統候選人第二場電視政見發表會於12月26日下午2時登場,民眾黨總統候選人柯文哲、民進黨總統候選人賴清德、國民黨總統候選人侯友宜將再度交鋒,抽籤順序,依序為柯文哲、侯友宜、賴清德柯文哲第一輪政見發表教育主張12+1義務教育、建立多元管道來健全雙語師資,包括教師聯合甄選、外籍師資徵選等。",True,cooccur: actor×institution,True,gate: actor×inst,True,KEEP,1.0,KEEP,1.0,True,KEEP
_836e0e76006b,_836e0e76006b_u009,"侯友宜第一輪政見發表治安怒批民進黨打詐不力,並提出提出治安三箭「一打詐、二掃毒掃槍、三除暴」政見,他表示自己會全力拚治安、壓制詐團,朝一年掃蕩、二年少1/3、三年減半目標邁進。",claim,"柯文哲怒批民進黨執政以意識形態介入教育,更用「卡管」讓台大2年沒有校長,搞掉3個教育部長,更有許多論文抄襲者升官、若無其事,是品德教育的最差示範。","賴清德第一輪政見發表國家願景、建設計畫拚投資0歲~22歲,讓台灣均衡發展,並將提出完整計畫,會用加薪、減稅、少負擔來陪伴每個人走過每個階段;","[{""name"": ""侯友宜"", ""party"": ""KMT""}, {""name"": ""民進黨"", ""party"": ""DPP""}]",[],False,debate/manifesto,9fd03197eeaf07f39f56cd3c70a97bb1,False,02_Ke_tvbs_news,2024-01-12 10:42:00,"侯友宜第一輪政見發表治安怒批民進黨打詐不力,並提出提出治安三箭「一打詐、二掃毒掃槍、三除暴」政見,他表示自己會全力拚治安、壓制詐團,朝一年掃蕩、二年少1/3、三年減半目標邁進。",True,cooccur: actor×institution,True,gate: actor×inst,False,KEEP,0.5097419023513794,,,True,KEEP
_836e0e76006b,_836e0e76006b_u010,"賴清德第一輪政見發表國家願景、建設計畫拚投資0歲~22歲,讓台灣均衡發展,並將提出完整計畫,會用加薪、減稅、少負擔來陪伴每個人走過每個階段;",context,"侯友宜第一輪政見發表治安怒批民進黨打詐不力,並提出提出治安三箭「一打詐、二掃毒掃槍、三除暴」政見,他表示自己會全力拚治安、壓制詐團,朝一年掃蕩、二年少1/3、三年減半目標邁進。","當中包括0到6歲國家一起養2.0、長照3.0,減輕三明治家庭的負擔,而長照3.0會強調公立安養中心的設置。","[{""name"": ""賴清德"", ""party"": ""DPP""}]",[],False,debate/manifesto,b97c4865c18e23864f6650af4f940828,False,02_Ke_tvbs_news,2024-01-12 10:42:00,"賴清德第一輪政見發表國家願景、建設計畫拚投資0歲~22歲,讓台灣均衡發展,並將提出完整計畫,會用加薪、減稅、少負擔來陪伴每個人走過每個階段;",True,cooccur: actor×institution,True,gate: taiwanicity=2,True,KEEP,1.0,KEEP,1.0,True,KEEP
_836e0e76006b,_836e0e76006b_u011,"當中包括0到6歲國家一起養2.0、長照3.0,減輕三明治家庭的負擔,而長照3.0會強調公立安養中心的設置。",claim,"賴清德第一輪政見發表國家願景、建設計畫拚投資0歲~22歲,讓台灣均衡發展,並將提出完整計畫,會用加薪、減稅、少負擔來陪伴每個人走過每個階段;","柯文哲第二輪政見發表少子化政策柯文哲提出少子化與高齡化問題,談及生育補助,提及懷孕滿3個月給新台幣5萬元,每生一名新生兒補助10萬元,育兒津貼也從5歲延長至12歲;",[],[],False,,db16ba3720802d9b5635a19275457f90,False,02_Ke_tvbs_news,2024-01-12 10:42:00,"當中包括0到6歲國家一起養2.0、長照3.0,減輕三明治家庭的負擔,而長照3.0會強調公立安養中心的設置。",True,institution_only,True,gate: strong_anchor,False,REVIEW,0.1582269221544265,,,True,KEEP
_836e0e76006b,_836e0e76006b_u012,"柯文哲第二輪政見發表少子化政策柯文哲提出少子化與高齡化問題,談及生育補助,提及懷孕滿3個月給新台幣5萬元,每生一名新生兒補助10萬元,育兒津貼也從5歲延長至12歲;",claim,"當中包括0到6歲國家一起養2.0、長照3.0,減輕三明治家庭的負擔,而長照3.0會強調公立安養中心的設置。","育兒家庭綜合所得稅的扣除額,從5歲延長到12歲;","[{""name"": ""柯文哲"", ""party"": ""TPP""}]",[],False,debate/manifesto,bf0d9763365b67b0b64c2e8a911cb781,False,02_Ke_tvbs_news,2024-01-12 10:42:00,"柯文哲第二輪政見發表少子化政策柯文哲提出少子化與高齡化問題,談及生育補助,提及懷孕滿3個月給新台幣5萬元,每生一名新生兒補助10萬元,育兒津貼也從5歲延長至12歲;",True,cooccur: actor×institution,True,gate: actor×inst,False,REVIEW,0.2914033532142639,,,True,KEEP
_836e0e76006b,_836e0e76006b_u016,"高齡化提出「壯世代計畫」,檢討修改現行65歲強制退休的規定,讓有意願工作的人繼續工作,而不是政府強制退休 3總統候選人生育政策。",context,"人工生殖法應納入代理孕母,協助不孕家庭有機會圓夢,並修改婦女凍卵後解凍需配偶同意的條文。",(圖/TVBS) 國民黨總統候選人-侯友宜 3總統候選人住宅政策。,[],[],False,,18439565577b930d334329b127c419ec,False,02_Ke_tvbs_news,2024-01-12 10:42:00,"高齡化提出「壯世代計畫」,檢討修改現行65歲強制退休的規定,讓有意願工作的人繼續工作,而不是政府強制退休 3總統候選人生育政策。",True,institution_only,True,gate: core_election,False,REVIEW,0.213756114244461,,,True,KEEP
_836e0e76006b,_836e0e76006b_u017,(圖/TVBS) 國民黨總統候選人-侯友宜 3總統候選人住宅政策。,context,"高齡化提出「壯世代計畫」,檢討修改現行65歲強制退休的規定,讓有意願工作的人繼續工作,而不是政府強制退休 3總統候選人生育政策。","(圖/TVBS) 民眾黨總統候選人-柯文哲 互相認識互相了解互相尊重互相合作互相諒解產業能源產業 :5大政策盼大力提升產業韌性1.制定《經濟安全保障法》2. 強化優勢產業自主3. 解決五缺 企業安心4. 提高獲利 成果共享5.大步加入區域經濟組織 能源:提出「淨零碳排,永續未來」政策,並訂下2030能源占比目標,包括燃氣45%、再生能源30%、燃煤15%、核能10%1.能源永續:務實減碳、能源潔淨、供電穩定2.珍惜資源:永續經營、碳定價有效減排3.低碳交通:以空品區為基礎、運具環保低碳化4.開源節流:水資源管理調度運用更有效益5.在地淨零:生態利用、土地管理符合永續6.社會運動:不只科技,更在生活方式 3總統候選人能源政策。","[{""name"": ""侯友宜"", ""party"": ""KMT""}, {""name"": ""國民黨"", ""party"": ""KMT""}]",[],False,,d4fb74cb9c1d6f212b0483fb46ced027,False,02_Ke_tvbs_news,2024-01-12 10:42:00,(圖/TVBS) 國民黨總統候選人-侯友宜 3總統候選人住宅政策。,True,cooccur: actor×institution,True,gate: actor×inst,False,KEEP,0.563543438911438,,,True,KEEP
